C	does anyone want my sweetcorn?
B	there's no rush
D	I'm alright actually I think I'm full
B	I didn't even realise it was sweetcorn in it
C	in the samosa a bit strange
D	yeah I don't think
C	I thought it was a bit strange
D	I don't think I don't think Indians use sweetcorn much do they?
A	no
C	how spicy was yours? cos mine was really mild
D	yeah no they don't do spicy in here
C	really mild
D	what are you on about?
B	Magnum
C	oh
A	on the way out?
C	yeah
D	Co-op's been doing a pack of three Magnums for two pounds recently
A	is that
C	yeah
D	which we've treated ourselves to a few
C	we can't believe how much chocolate bars and packs of crisps have gone up
D	yeah
C	you'd swear it was thirty-five P when we left and now it's seventy P standard
D	if you go in a newsagents or a Co-op it's like seventy P or sixty P for a chocolate bar
C	but if you go in Aldi it's still thirty-three P
D	still thirty-three P
C	like it used to
D	weird isn't it?
A	weird innit?
D	or go to Poundland and you can get a pack of three for a pound
C	they want you buying in bulk
A	yeah
C	cos even in Co-op they're you get one chocolate bar for
D	for one pound fifty or something like that yeah
C	one pound twenty so you're like well I'll just buy more but you end up just eating more
D	yeah you end up with a pack of three of Wispa in the fridge and don't know how it's happened
C	we've we've had a constant supply of Terry's Chocolate Orange haven't we? for
D	they do it for a pound in the check Chocolate Orange
C	is it a quid though?
D	I mean we've only bought them twice but we make them last like four days
C	is it a quid?
D	it's a pound yeah
C	so much better than buying a chocolate bar
D	so much better value yeah we like Terry's Chocolate Orange
C	it reminds me of Christmas
D	really good never had
C	well I caught that
D	my house is
A	yeah
C	nothing wrong with a bit of flatulence is there?
D	it's natural I suppose
C	let rip
D	yeah
C	very regal
D	the other Wetherspoons building is a bit nicer actually
C	we'll go to that one next time then
D	yeah mix it up
C	what was it called?
C	J D Wetherspoon
D	yeah it looked like it was on on a it wasn't on a junction it was just
C	it's that way isn't it?
D	it's down there yeah it's down that road down there
D	no no next to oh yeah that road down there
C	yeah that's where I'm pointing as I said I found it on a map cos I had to look up this place
D	yeah
C	I'm glad we convened at the right one
D	yeah me too
A	are we walking from here or driving from here?
D	we're gonna walk first to the second hand big one
A	yeah yeah
D	and go round that little area
B	antiquey one
D	and then we're gonna come back and then we're gonna drive to the charity shops
B	where is it?
D	yeah
B	different in the oh mind you that is five o'clock in the morning
D	do we need anything else from the shops?
B	there's that wet weather coming down
C	winter is it?
B	yeah
D	yeah
B	it is changing
D	it's not gonna last much longer
B	it's gonna change this weekend
A	yeah
C	it's lovely at the minute
B	the jet the jet streams move in
D	the Gulf Stream?
B	is it the Gulf Stream?
D	yeah the jet stream
B	or one or the other I thought there was a jet stream as well though isn't there?
D	from a jet
A	only when you're in a jet
B	no I'm sure it's
C	it didn't sound wrong to me so I'm not sure
D	no it doesn't yeah yeah
B	I'm sure they said it was the jet the jet stream
A	zoom what was that? jet stream
B	yeah it's
B	it's been going above Scotland
D	oh yeah
B	and it's come down
D	yeah that's a different stream
B	and
A	Ryanair
C	cos that's what keeps us warm the Gulf Stream
D	yeah yeah there's there's a different stream we're talking about
C	we're on the same line of longitude as like frozen other parts of the world so if we didn't have that our winters would be like minus ten minus twenty like consistently
D	they're not they're damp
C	but it could happen they've found in history that the Gulf Stream has reversed
D	it's gone it reverses every X amount of thousands of years so at any point it could just plunge us into the worst winter ever
B	the ice age again
C	yeah
B	there was an ice age
A	yeah
C	yeah
D	there was definitely an ice age I don't know if yeah
C	what's crazy there's a tipping point in the ice age as well
D	yeah yeah once some once it's
C	once it gets below about middle of France
D	yeah then that's that's
C	the whole world will freeze
D	the whole world will freeze
C	so there'll be an ice age
D	yeah
C	we've had it before where it's come down about so far and then it's still kinda hot in the equator but if it gets down to about southern France so I've heard
D	mm then it's chilled the world enough to the the whole world really
C	the world's cold enough the world will freeze over
B	bit like that erm film
C	yeah
D	The Day After Tomorrow
C	well I was thinking
A	when I have a lager oh when it comes on
C	I was thinking I was thinking Ice Age
C	not not Ice Age
D	you've gotta have a whisky dad
B	there was a film I think it was The Day After Tomorrow
C	yeah
B	where it just
C	the day before The Day After Tomorrow
D	alright alright gonna need another wee anyway
B	and er
C	I'd better head back then hadn't i?
D	yeah you'll get lots of work done today I'll get nothing nothing
C	there you go shall I pause this now then?
D	no give it another
C	I'll just leave it
D	second yeah while
B	I mean it's still crazy that there was that you know dinosaurs wasn't there?
C	yeah
D	yeah there were dinosaurs quite a few of them
C	what's crazy is there still are
B	and how many millions of years they existed for
A	instead of being walking about now
C	then poof
B	yeah
C	gone
B	they died
C	although today we still kind of have I mean a crocodile is effectively a dinosaur
D	they're prehistoric
C	they're perfectly evolved they were around at the same time they grow up to like seven or eight metres in length in the sea which is like three or four times the length of your dad they're pretty big
D	just with a bit sharper teeth
C	yeah
B	what's that alligators?
C	yeah crocodiles salt water crocodiles they're dinosaurs effectively
B	crocodiles yeah
C	mm mm
D	mm mm mm
B	well they think some of the fish in the ocean is prehistoric as well
C	yeah
B	don't they?
D	oh yeah no
C	but they don't need to evolve anymore
D	no yeah
C	they're perfectly suited to their environment it's all good
D	what did whales evolve from? cos they're massive
C	they were sea creatures that came out onto the land and then went back into the sea
D	and then went back into the sea yeah
B	whales?
C	hence why they breathe
D	yeah
B	oh and they're mammals
C	yeah mammals in the sea will have come out of the sea and gone back in the sea
D	it's probably also why they're
C	theoretically it's
D	I mean maybe not why but they're incredibly intelligent as well so
C	yeah
D	that crossing over
C	you may have found that they never truly left the sea
D	yeah yeah
C	they just kind of were a bit land sea-based and then kind of went back in
D	yeah they are really
B	ladies running around
C	do you know there are
D	yeah you get worried about a centipede coming towards you imagine a bloody whale coming down
C	if you think how inland
D	those little legs
C	how inland Russia is there's no sea in the middle of Russia or anywhere near it there are dolphins in one of their biggest lakes there because of where the sea used to be connected where the sea level was much higher
C	where it was sea that far inland
B	yeah
C	and there are dolphins in the lake
D	yeah this I mean this lake is huge
C	it's huge lake
D	but it's very far from the ocean
C	yeah
D	and it's got all kinds of species of animals hidden in it
C	it's massive it's about as far from the ocean as you can be but there are dolphins in it
B	you ever been to Russia?
D	no no we'd love to go
C	well we went through Moscow on the way home
D	oh we did we did very very briefly running
C	yeah we were that was horrible
B	ah
D	in the end we went past we ran past all the people on our flight and basically pushed in front of the queue
C	we were the first on the plane
D	we thought we were late
B	mind you that was like the first time we flew to Italy wasn't it? when we when we
D	yeah went to
B	via Amsterdam and we only had a very small window
D	and mum was guiding us cos I was a child
B	yeah so that was the first time either of us had flown
D	flown and we we were standing on the side of this glass banging on a window
D	so we were on the other side
C	how old were you?
D	er ten eleven
D	yeah yeah I told you my mum got on the conveyor belt with the suitcase
C	you got on it?
D	cos she thought once it
C	Brits abroad eh?
B	it went behind plastic you see and I didn't realise it kept just going round and round
C	what did you think happened to it all?
C	that was it furnace
D	so as it got near the end she jumped on and grabbed it off
C	incinerator
B	and it wasn't even
D	no
B	well one bloke said well that was close or something didn't he? or that was lucky
D	I don't remember that bit I just remember being horribly embarrassed
C	after you weren't sucked in there
D	yeah
C	you'd have got lost with the baggage
A	yeah could have done
D	we laughed about that for some time clearly
B	and at the end
D	ten years later no fifteen years
B	and that suitcase was still there as well at the end
D	yeah
B	wasn't it? it wasn't claimed
D	and my one wasn't didn't come through
B	and your
D	that looked like it
C	is that the only time that's happened?
D	er yeah lost our suitcase
C	if we knew that we weren't gonna get our suitcases this time I knew it I knew it
D	yeah there was a feeling it's cos our connection was too short
C	ah I knew it mm mm
D	set her off didn't we?
D	half a pint just leave her in here on her own now shall we
D	you say some priceless things dad I've got that on tape
B	when we was on the ferry going over dad gives a running commentary on everything about the boats land and
C	I'm not sure I get it
D	it's alright it's an in
C	did I miss the punchline?
D	it's genetics
C	optical illusion yeah
B	I didn't even realise he didn't even realise that it was coming towards us
D	realise that it was coming towards us oh dear oh dear
D	priceless stuff at least you keep each other amused there you go you can go darling don't stand here you don't have to wait around for this tomfoolery
B	no
C	cool
D	enough's enough eh?
C	thank you very much alright lovely to see you again yeah
B	yes yeah and you
C	sorry it's only quick
A	ta ta mate
