A	so is
A	smoky eyes oh I wonder if he's done it for a joke
B	yeah so I'm gonna I might ask
A	oh right
B	he said well I was gonna ask the erm cos I thought it'd be nice not a tree but like having a baby in a like a sling thing and then balloons and people's fingerprints as the balloons
A	oh to do a oh I see
B	yeah
A	it'll give her a whole new er
B	but I'll send her a picture of kind of what I've finished
A	yeah I'm sure she would
B	yes
A	I don't know that you'd need to invite her you you could do but
B	but I thought he was gonna he was gonna do it when we're there cos I'm not standing with him
A	no that's true yeah
B	so I don't really want to ask anyone else
A	I mean don't forget you've not invited
B	yeah I know
A	is that something you're thinking though it's got quite big?
B	well
A	no I haven't but your dad'll have it
B	I might just text dad's phone
A	text him yeah
B	I'll yeah get the number off dad
A	I think because it's got as big as it has it's
B	yeah I know they won't come anyway so
A	well they probably won't will they? or there'll there'll be an excuse or maybe she won't
B	yeah yeah yeah
A	it won't be so bad it's not like a wedding so and that'll be fine then if she comes
B	I tell you what I might text dad now and just say look
A	ask for his number
B	can you send me Uncle
A	yeah just because I think it seems to have got yeah and then nobody will ever need know we were considering not inviting them
B	yeah
A	I think if it was a smaller affair you know and you were talking about twenty people cos there's another five of them and fair enough but now we're up to numbers we're up to but like I say I wouldn't necessarily add on to the catering for
B	no no no I'm just doing it
A	because there'll be plenty of food cos she always does masses on her buffets doesn't she?
B	yeah yeah she's not gonna stand there and headcount for goodness sake
A	oh no of course not
B	send me
A	I imagine your dad will go and see them today because he hasn't seen them for a week
B	oh
A	I don't think he saw them last week with him being in Scotland
B	oh okay
A	so I imagine he'll go today
B	yeah when he gets home from his
A	I think he's working Tuesday Wednesday
B	six-hour meeting
A	yeah Tuesday Wednesday Saturday I think
B	mm
A	and
B	tomorrow is she?
A	and Thursday and Sunday is what she's I think because she didn't have that day off last week she's
B	yes I knew she was having an extra one off this week
A	yeah I do fancy going to Birmingham to look at erm outfits cos I I liked that you know the the House of Fraser they've got there? it's
B	yeah
A	that we went to before with the Wallis section and you came with me didn't you?
B	yeah
A	cos they have so many more things there than they do
B	I could go on Thursday
A	well we haven't lost any weight yet
B	if
A	I don't really need one either but I just wanna have a look I might leave it a couple of weeks
B	I'm got my own yeah I'm gonna wear that one that I've got upstairs you know the dress with the
A	the blue and white?
B	mm
A	yes because you had another one but that was for your baby shower was that pink and blue?
B	yeah pink and blue yeah
A	the similar style with the polka dots
B	yeah yeah
A	is that the one?
B	it was different material
A	but
B	eight months pregnant
A	so you're not talking about that dress?
B	no I'm not wearing that one I think that's the
A	oh yeah
B	no the other one I had was it's
A	oh it wasn't a maternity dress?
A	yes it was just the
B	no do you remember they were in Debenham's
A	oh yeah
B	was it Debenham's?
A	much smaller little
B	mm
A	polka dot on it tiny
B	well it's not it's not even I don't think it's a polka dot
A	no it's not
B	it's like bows or something like that
A	yeah it's so
B	yeah
A	yes when
B	she'll probably ask me if I'm sure I'm not pregnant again at the
A	oh she better not
B	I'll say er how about a smile
A	yeah yeah you should point the camera smile
B	smile
B	smile oh no yes no it's going to be great standing up in a church oh could the godparents please come forward?
A	yes
B	that'll be my sister
B	and our friends
A	mm
B	mm oh I don't know it's not as if she hasn't got the time to
A	well she hasn't said if she's coming to the christening has she?
B	well no I don't know
A	any of them haven't replied have they?
B	oh no well
A	oh that's right pushed them and they said yes
B	she better not just turn up with like a million bracelets or something I don't want them
A	no
B	or like sparkles for the table or she can throw them
A	it's the fact she won't let you know it's the fact she just muscles in on everything
B	I know that was exactly like it for the wedding like I gave her the tables I think I'd given her tables
A	yeah yeah
B	she'll like that and yes okay they they did contribute so she needed something
A	yeah yeah
B	but then it was like oh by the way I've bought this oh by the not
A	I know I know
B	you know as the bride
A	yeah
B	maybe oh well I've seen these what do you think or erm I've done you you know you know er do you think these would look nice or what are your thoughts on these?
A	they're very manipulative that whole family is
B	oh yeah they are
A	they're really manipulative
B	yeah yeah yeah yeah
A	everything that they do is geared to
B	yeah yeah
A	getting their own way and it's ridiculous
B	well I know and I'm just like I mean he has
A	well I can't imagine
B	yeah he does
A	he never seems he never comes across as?
B	no no he's quite a rare a rare breed
A	it's yeah it's just the way they use every situation like she did with the erm well the hen do she invited her own person didn't she? she invited her friend to the hen do
B	yeah big
A	that's right and then the baby shower when she just forwarded the text and told me she'd invited people without even asking and now
B	I mean yeah
A	yeah
B	but at the same time it was like well what on earth are we meant to say to that?
A	well yeah there's
B	obviously before she'd texted her back
A	yeah
B	she'd been straight on to
A	yeah yeah
B	oh have you had a text? and he'd obviously replied and said no
A	yeah and that's why I think
B	oh of course yeah of course they told them
A	straightaway so they think you've got an issue with them
B	yeah yeah yeah yeah erm
A	I think not the fact that you're trying to keep it down
B	and she's obviously I think she's annoyed with us
A	oh on DVD
B	mm yeah that'll be good er
A	I want to see that one
B	she's obviously I don't think she's erm offered to do anything for the christening because of that whole oh you're not inviting my whole family where you should think well you
A	well her family are invited
B	of course they are but it
A	oh
A	well only
B	yeah exactly yeah I know and
B	her and
A	yeah
B	and
A	oh can't he?
B	no he's been he's got some VIP concert experience and he's been waiting for thirty-five years to see this this band so
B	yeah yeah I mean
A	yeah that's right the fewer of them that come the better
B	yeah yeah
B	he's also not like them
A	no he's a bit more laid-back isn't he?
B	well
A	is he he's her twin isn't he?
B	yeah
A	yeah
B	he's alright
A	I was going to say why his wife doesn't bother with any of them
B	well exactly you
A	you've never met her have you?
B	no I said you I said I know that you that that you think that it's the reason what happened was I think the whole reason behind it is they were in Florida one year and
A	yeah
B	and they were just sat in their rooms and
A	mhm
B	but hadn't asked
B	yeah
A	mm
B	and so then I think she just said something to
A	right
A	mm
B	erm but I think I think there's much more to it than that erm I I don't know what you know what she's done but
A	it's funny cos
B	yeah yeah yeah
A	you should erm you should take
B	yeah definitely yeah
A	of of all of the family
B	and so that would what would that that would do to his mother?
A	do you know where he lives? because if ever you were passing that way say
B	I don't know where he lives
A	oh give give your uncle a call and see if we can call in cos his wife you know your auntie hasn't met
B	his
A	never be there but there'd be no reason not to and
B	oh no
A	likewise she's perfectly pleasant and she's got her issues with
B	yeah yeah yeah
A	and you'd probably have er
B	yeah yeah
A	you'd probably get on fine
B	yeah I think I mean I it is a bit I just
A	it's got to be
B	oh yeah I just reckon I think it's a bit odd that she really doesn't have anything to do with any of them like and she'd like obviously you've had your fair share of
A	grief
B	the brunt from dad's side but
A	yeah
B	I mean yes okay you won't go row with them every single time you see them but if there's ever kind of a a big thing like a big birthday or and everyone's going you you won't purposefully not go I mean you'll say oh do we have to? but
A	oh yeah I'll always go to it
B	of course you will but so that's something that she never you know never do this woman so
A	well that's what
B	yeah yeah yeah
A	stay out of everything
B	yeah so then you think okay she could be a little bit like her because
A	mm
B	but then again
A	well I don't know why
B	no
A	I mean at your baby shower she didn't even speak to her sister
B	no I know
A	who she personally invited
B	I know it's awful
A	because I must admit I'd forgotten about inviting them and if she'd have said oh can we? I'd have gone yes of course
B	yeah yeah yeah
A	but she sent me
B	why should you invite? them she's my
A	well yes yeah
B	husband's auntie it's not like
A	nothing to do with you no you're right
B	no nothing to do with me whatsoever
A	oh look they're on the trampettes on there I need to get mine back out
B	but erm yeah I know because there's no connection with me and them whatsoever
A	mm
B	erm I don't you know particularly get on with them and
A	she just competes with her sister for who can do the most erm
B	oh yeah
A	outrageous presents for everybody and it's just a competition anyway and I know that's
B	presents are the competition
A	yeah like
B	no
A	oh not for me thank you oh not but in the end I just bypassed her and not
B	yeah bye yeah not for you
A	not for you not for me thank you
B	oh dear
A	and
B	that's what she's going to do at the christening and I'll say well bring your own wine if you want to do that
A	oh well if she's gonna bring her own hopefully she won't bring that much and she'll be alright
B	mm she'll drink everyone else's
A	I won't bring any red
B	no no
A	because that's all she drinks
B	yeah
A	I'm only taking white
B	erm no definitely
A	do we have to provide glasses or? okay
B	no no no they're all there
A	she'll have the glasses if we want like a Prosecco and a toast or something
B	yeah yeah they will be there
A	will she? because we should maybe
B	I'll text her about that
A	yeah
B	but yeah they've done like all the
A	but you could also mention on the invite to your friends nearer the time you know
B	yeah
A	it is it's it's a it's a bring a bottle
B	yeah yeah yeah I will do
A	cos
B	well
B	not in the middle of the day though not on a like a
A	well it's a Sunday evening it's four o'clock yeah
B	yeah yeah yeah they'll bring their own mm fun fun fun
A	oh okay and decorate it a bit
B	yeah
B	toys
A	oh
B	toys toys toys
A	okay yeah will there be somewhere to put them?
B	yeah yeah yeah I said to
A	to lie them but what can you lie them on?
B	I'm gonna take some blankets
A	oh okay
B	it'll be alright
A	yeah
B	perfect
A	that'll be nice if we can go outside as well well
B	yes
A	he'll be happy
B	yes he can
A	it's a nice venue actually the way she's got it
B	yeah it is nice
A	isn't this a shame watching all these newborn lambs and we're all going to eat them at Easter?
B	I know yeah yeah
B	it's sad isn't it?
A	all these lovely lambs being born but yes
B	oh yeah
A	did you see the one they did this morning? she had triplets
B	no
A	but this was really unusual for a lamb but then they announced that the mum had died
B	oh
A	yeah but there's three they're the three black ones they've got there
B	oh really?
A	two boys and a girl yeah
B	oh
A	but the mum died
B	it's yeah
A	couldn't cope with all three
B	mm
A	it's a shame
B	oh look at them
A	mm
B	oh no I don't think that could work for me
A	yeah I'll have to get some Easter eggs for er
B	oh yeah oh well ask her the day before
A	yes she hasn't replied to whether she wants tea tonight
B	oh okay
A	I told her what it was so she's got in a fighting chance of
B	yeah
A	she liked it last time she had it
B	oh okay well she might not like it this time
A	this time no no that's right
B	yes don't want that yuck
A	she might go to
B	yeah
A	she's gone on the train anyway her car's still on the drive
B	oh
B	right
A	has he had to?
B	forward
A	has he got to wake up now too much sleep?
B	well he's had two hours
A	he's had two hours has he?
B	yes I think that's my cut off point
A	you're coming out
A	it's time to wake up
B	oh
B	trying to sit
A	we we weren't you know you were saying about when I was talking about
B	yeah
A	and you were saying oh yeah I'd love it I'd like to do that erm I thought oh we'll never get the chance to do all that together cos
B	yeah
A	always working especially Christmas time
B	yeah
A	then she won't wanna pay premium in February
B	no
A	so
B	oh
A	he says well mum you've woken me up what do you want me to do? stick a dummy in my mouth
B	well just calm for a minute while I take that off
A	it's a nice snug fit
B	well
A	yeah
B	I won't be a teacher forever
A	don't you think?
B	it's not one for
A	but you get all the summer holidays
B	yeah I know but
A	that's a massive plus
B	oh of course but
A	if you can get it down to doing less work in between classes cos that's where it all comes from
B	yeah yeah
A	it's the it's all the extra
B	yeah but it's it's either you
A	mm
B	do cut down and then you don't do such a good job of it
A	yeah I suppose
B	and I'm not really agreeing with where the whole
A	no
B	oh well she's got to compete with her sister who's already retired
A	is her sister sister older?
B	yeah
A	yeah
B	five years
A	oh is she?
B	yeah
A	yeah did she retire at fifty-five then?
B	I think so
A	fifty-six maybe
B	yeah
A	oh is he? is he fifty-nine at the end of this month?
B	yeah
A	in the same year next year
B	and so there'll be some sort of holiday
A	you may not be invited
B	we we won't be invited I know that for sure
A	oh
B	no we won't be
A	we'll have to do Florida would be nice we'll have to do it when
B	yeah
A	when you're on maternity leave next
B	maternity leave next what so I've oh yeah after I've had the baby?
A	er either way yeah oh yeah you wanna go on rides
A	yeah when you'd when you have so we'd have a baby and and a toddler won't we
B	wa wa wa wa wa
A	the innocent go and feed the alligators
B	mm oh
A	what does his top say?
B	handsome little fella just like daddy
B	oh a big yawn do you want some milk?
A	he said oh I'm just waking up
B	I know that but do we want milk when we've finished waking up?
A	very true
B	do you want this?
A	let's hope you're gonna like having er water on your head in the church
B	yeah
A	oh you were gonna go swimming today
B	yeah I know
A	were you gonna go with erm
B	maybe I'll go with
A	ah yes
B	I'll text
A	good idea Auntie
B	and take Auntie
A	I can come and watch again
B	oh yes
A	and start shouting my mummy's dropping you
B	dumping you in the water ah right oh so much fun
A	ah
B	oh dear
A	she says he can't hear a thing he's all bunged up and she goes it's so annoying
A	well they had parents' evening and erm you know what's his name? the Mr the PE teacher?
A	you know was was talking about
B	oh okay
A	he said
B	what because of the cold?
A	no he said he'd forgotten his shoes
B	oh oh
A	which he might have done but
B	yeah
A	and we had said maybe give the cross-county a miss anyway so he hadn't done it so Mr
B	yeah yeah
A	and
A	and he just went oh really I hear art's quite hard to do with two broken arms
B	okay
A	the PE
B	oh I must say
A	and I said blimey and that's how that's how parents' evening went for PE
B	lovely yes
A	it was it was must for
B	shall we have some milk?
A	you eh?
B	hi
B	yes I think so
A	go and make me a bottle go and make me a bottle
B	please may I have some milk?
A	oh you are so snuggly and cuddly aren't you?
A	you are
B	are you?
A	you are snuggly
B	are you?
B	yes yes I am
A	oh
B	do you want a drink while I'm in here?
A	oh yes put the kettle on and I'll have a cup of coffee thank you very much what time are you making your stuffed mushrooms?
B	mummy's getting hungry
A	oh
