A	set or whatever
B	whatever it is
A	yours were fairly limited yes
B	poor dad he's not been able to enjoy that with his children
A	no funny isn't it? and yeah well
B	he didn't go did he?
A	no he didn't even go no I quite enjoyed it
B	you were there with the
A	interesting
B	that's going to stay there for a long time probably
A	well I didn't know whether to now dad's bought a whole polishing kit but I was going to take the car for a good clean it's in desperate need
B	yeah it is
A	he wants to clean the windows and clean the cars so he's obviously wanting to give himself jobs and I just want to take the car for a proper clean
B	dad's not going to do the serious job that you need
A	he went out with a bucket
A	to clean the car and that was about three months ago
A	it's only fifteen degrees still
B	really?
A	it just looks beautiful
B	it does look beautiful that'll do that's enough
A	looking is all we need
B	bright sunshine yeah
A	as long as
B	I told him to bring warm clothes he doesn't really own very many well he does but he leaves them in India he doesn't have to use them elsewhere
B	he said Spanish parents are fine cos Spanish and Israelis are pretty
A	yes probably closer
B	equally rude
A	mm
B	I can imagine that
A	yes where he doesn't even feel at home in England
B	yeah
A	it's kind of weirdness
B	yeah exactly it's like we were saying about Germany where you feel that you kind of get what's going on in reverse well he can speak very good English that's a very lucky thing for me that's a like a bit of a barrier not for the
A	yes
B	kids not for the family family cos they all speak very good English but the well first of all you know they speak Hebrew to each other a lot
A	mm
B	so you miss
A	mm
B	what people are saying and half the time you aren't involved in the conversation
A	no that's a little bit disconcerting isn't it?
B	it's fine cos I'm very used to it but erm it's just a factor you know in in er when you're when I'm in er with er when I'm with them
A	yeah
B	with his family that I don't really understand what's going on some of the time and then I just kind of switch of into my own thing you know and they're very polite like they always try to speak English
A	mm
B	if I'm there and even to each other when they're not directly addressing me
A	yes so you're still in
B	but you know it's your family so you just default to your own language don't you?
A	yes if you've got something to say quickly or urgently
B	yeah or even if you're just chatting and it becomes animated which it usually does in Israel
A	I hope he gets dad's humour I hope you've given him a whole load of warnings
A	oh Mr
B	and yeah with the kids like I can't talk to the kids at all
A	yes
B	so that's a shame cos they really want to you know
A	yes to chat with you
B	to chat and tell me things and they'll just chat to be in Hebrew
A	mm
B	I have no idea what they're talking about I just go yes but
A	oh right yes
B	so she erm speaks English to her daughter
A	okay
B	sometimes as well her daughter clearly is a very clever girl and can clearly understand English actually she doesn't dare to speak it but she's only four
A	yeah no but that's that's quite nice yeah she she gets what you're saying
B	but you can tell that she understands what you're saying she was much more shy by the end she she would come and babble at me she knew all the words to the Frozen songs so we were singing them together
A	yeah yeah oh lovely
B	it was cool
A	erm not always so we'll just see erm I'll text
B	so we picking him up from school?
A	yes we'll probably have to go straight there
B	eleven O nine what time is oh ETA
A	twelve
B	twelve and what time is it?
A	twelve
B	oh twelve
A	it does just near the end and then an extra few minutes but you can't walk through the school you have to walk round and it takes a good five minutes
B	erm
A	so yes I know where to go in
B	no but you know that you can park on the entrance way that opens to the
A	yes
B	and this is the house
A	yeah
B	and you can park there on the road
A	yes
B	but you can also go all the way round to the other side
A	that's what you have to do you're not allowed through
B	I see
A	at lunch time so if you decide to walk it you've got to walk all the way round as well
B	oh rubbish
A	erm and that's why you need to be a bit earlier erm than this so I'll we'll just drive there and pick him up even though we have no seat to put him in
B	oh I see what you mean yeah we being thirty seconds and
A	yeah erm a funny thing I went for her last time and
B	oops
A	and er
B	yeah she's not in the other classroom isn't she?
A	she did didn't she?
B	mm it's funny with her though I don't know if it's just kids thing but you ask her a question like what kind of snacks do you buy at school then? you know she gets her thirty P and she just like completely makes up the answer
A	makes it up I know
B	yeah what's that about
A	I don't know
B	I'll say what did you do at school I mean sometimes she answers you know there are certain questions where she just
A	no says we went on a coach trip
B	yeah
A	did you really? erm so when it was really funny because we were erm and then she would say that's a lie
A	erm and you're not really supposed to tell lies you know? and I was completely baffled but the erm on her birthday
B	oh
A	because I'd just like to really be sure that it's okay because the teacher didn't say that I I'm not sure and I'd texted
B	oh no
A	so we went and changed her in the toilet
A	oh funny
B	it's quite
A	no no no no
B	and something in her is not like connecting the dots
A	a little bit naughty
B	do you think it's naughty?
A	no I do yes it's just like a little story
B	she's like I have macaroni and this it's like no you don't have macaroni as a snack
B	yeah we do
A	no that's right
B	have macaroni
A	once you've questioned it
B	right
A	it's the little naughty story
A	it's like an an imaginary thing that then it becomes a lie and they don't really they really don't know quite what the lie is
B	not sure what the difference is
A	yeah why is it different to tell a story
B	oh I see yeah
A	do you see what I mean?
B	yeah like if you'll ask her so what did you do what did you see when you went on safari?
A	yeah
B	she might just invent a story about having seen a giraffe
A	totally she she told no she told me something ridiculous erm
A	in safari
B	mm yeah
A	funny isn't it? but I think sometimes it's the things that are also maybe a little issue like erm
B	okay
A	and she she just says no she doesn't want snacks and I think there was a little bit of a tussle going on so you wonder if that comes into it
B	yeah yeah
A	that she's then sort of thinks you're part of the spying team
B	the conspiracy that want her to buy
A	with the snack snacks yes I see what you mean
B	yes
A	oh just
A	emergency heat required
A	oh right yeah
B	and I'd be like how much does it cost and he'd go six and I'd get another thing and how much does this cost? and he would go six
A	full shopping experience
B	full shopping experience erm she erm made a pet store with all of her little cuddly toys and erm she telling me all how you need to look after them but the funny thing with her is that she tells you what to say
A	I know
A	I refuse
B	no pretend you're the mother and you're buying a kangaroo for
A	and you're saying yeah yeah
B	your daughter and you're saying that she's very special right I'm buying a kangaroo for my daughter
A	I just say no I'm going to decide what I say you decide what you're going to say
A	oh okay
B	it's a little bit annoying
A	if I yes
A	you can't even think
B	I knew it was like that with Barbie's but erm
A	no it's extending
B	she just fully dominates the storyline
A	I
B	it's kind of quite oh cos that's
A	a crud cruddy bit
B	crud cruddy bit is kind of coming off my face
A	well it's maybe where it rubbed into your hair or something
B	no no it's just dry and it's dry skin which is coloured with the crud
A	well that's no good
B	in general though I quite quite like this
A	it's busy
B	it's
B	and it isn't very comfortable is it?
A	it's not very comfortable
B	I was noticing that cos he was driving me to the station and it was quite
A	you get all the bumps
B	it's very bumpy
A	it's quite bumpy
B	it's all bit race car
A	it's just vroom
B	yeah
A	I don't feel calm
B	I don't feel calm especially with dad driving
A	and dad is you know and then he decides to overtake people
B	yeah
A	erm and I don't feel quite so relaxed and whereas in this car everything happens smoothly and you don't have that same race boy feeling
B	I think you've just got to let him have it
A	in yourself
B	you've got this one
A	so I
B	that you enjoy it
A	the joy of going out in it
B	yeah I agree
A	it's actually quite nice to drive yourself
B	I was going to say exactly that maybe you should just take it out
A	yeah the
B	yes
A	I'm sure this is not the idea
B	it's not Los Angeles is it?
A	but so if I go out in it cos it's a sunny day I just tootle along quite nicely and it feels really nice
B	yeah that's fun
A	but if dad's going at sixty you feel completely buffeted
B	yeah I know I don't
A	I don't
B	erm it encourages that type of driving as well
A	I think that's what it does yeah
A	I know
B	I feel very handicapped and I just don't see when that's going to happen
A	you need to come back for a
B	for a few months
A	few months at some stage and you you're you're right there you know you're just right there and it
B	no I know I just need to de-traumatise myself
A	absolutely and get get somebody really good
B	yeah
A	and just take your time do do it properly don't rush yourself
B	yeah it's rushed isn't it?
A	erm and just say you know what I can already drive I just need to refresh and get all those little details that that guy just didn't seem to have a clue about
B	he didn't know any of it and he didn't teach me some of the main things either
A	he didn't teach you properly at all
B	on the way to the first test like the night before I'd been studying and er realised we'd never done an
A	is always done
B	so I was like we've not done an emergency stop on the way so you just don't feel you know
A	oh totally not
B	any confidence
A	no shame
B	I don't I shouldn't really have failed so badly I just
A	no but it got worse
B	no I just lost all my confidence
A	yes exactly
B	and he kind of
A	yeah and that was one
B	that was
A	the second one was worse than the first and the third one was a write off
B	no the second one er the second one was good I thought I'd passed
A	ah
B	the third one was a write off I don't know why I didn't pass the second one I was obviously not ready because the first time he said you're too hesitant
A	mm
B	erm the second time he I can't remember his reasons I think I might have made a major error
A	you made yeah probably
A	yeah no
B	so I obviously had good control over the car I just felt
A	to be honest I think it's
B	uncomfortable in certain situations and I think I still would
A	yeah but I think that's erm
B	like traffic
A	yeah you hadn't had that yeah
B	and he should have just taken me to
A	no absolutely and
B	yeah
A	it's not a nice place
B	well that's what everyone else was doing
A	no but even if you drive all-round the town and keep including the route
B	yeah yeah it was and I think erm you I could have just done with being driving
A	no all of that should be cleared up shouldn't it?
B	massive crossroads and those things
A	yeah
B	yeah exactly
A	erm to over and over and over and over and over
B	if er if I'd just had a month or so more I could have done it it was just
A	yeah that's right
B	I could easily do it I don't doubt myself really cos I was always quite comfortable driving but erm just not the situation's not arisen but this kind of scenario just makes me feel frustrated that I can't drive and when I'm in Israel same you know
A	mm
B	like I keep thinking I can't do things a lot of things or it's just more difficult to do them and I always feel like erm dependent on other people as
A	but I I you know would it be of any benefit to do the test somewhere else like
B	yeah maybe
A	in I I don't mean benefit but would it be easier like if you passed your test in England would you be able to drive in Israel anyway?
B	yeah I don't know you have to do the international license I think so or you have to do an additional thing maybe to convert it into an international license yeah well this is what I thought you know that I could do it somewhere else as well I don't know how easy it is to convert one to the other
A	no
B	and I just need to be able I just need to drive for while
A	yes
B	the good thing about England is that you can drive without
A	on the provisional license
B	on the provisional whereas in
A	no
B	you have to be with a driver
A	you can't in Holland either oh you can't yeah you you here you can drive with a family member can't you?
B	or anyone with a license
A	anyone with a license that's right
B	yeah no but in Israel you can't drive at all unless you're either in a car with an instructor or you're not
A	no
B	already passed you know so
A	you should get it in erm the US of A
B	I know just go there
A	you just pitch up
B	my friend
A	I remember you saying how bad she was
B	it was crazy and she just er more or less batted her eyelids at this little dude and you know there was like one street in that town you were driving up and down it a few times that was how she got her license but she was a liability
A	no that's also not so good
A	you know you may kill yourself but you've got your license
B	well it's very surprising that she's alive her method of parking was to get out of the car and ask a man to park for her
A	you're joking
B	no
A	bit bit rude
B	and she was there and I said she'll be fine she'll be fine and he was like telling me funny stories like they'd been driving together somewhere and she'd arrived at a roundabout and she turned to him and said is this a roundabout then?
A	oh oh
B	it was quite fun though
A	oh shit
B	oh what?
A	dad's still got the key
B	oh shit right no problem we'll just get in touch with
A	oh if you it's just
B	erm hello? there we go
A	oh god
A	erm on the Whatsapp
B	we can pop over
A	erm
