A	haircut
C	no we didn't have Christmas presents this year last year she'd erm well I meant the last Christmas the Christmas before we did
A	mm
C	you we had that set of nice knives I had a mug
A	oh yes
C	you had erm pass what did you have?
B	I don't know how you remember that kind of stuff I don't know
A	yeah I don't I don't remember
C	I have to remember because that doesn't really
A	I don't remember
B	I forget what I've bought other people
A	yeah I I forget that I forget what I've got stuff I've got I acquire stuff and I'm not sure where it comes from
B	when we visited our friends in Tennessee
A	no
B	there's a few things we bought them
C	his memory's getting terrible
B	mm
C	and mine's not brilliant by any means
B	no
C	and mine sort of stops halfway through things like I lose track
B	yeah
C	but this morning dad came in and we want a cup of tea and I said right I'm going now so he said I'll see you about three so I said no it won't be three I'll see you at five no I'll see you at three so I goes aren't you picking
A	yeah
C	I'm beginning to think well
B	it's quite funny that two the comedy sketch isn't it?
A	yes no memories
B	just part of getting older isn't it?
A	no nothing arrived
C	I can't bear the chemo now can we
B	no
A	we'll have to put it down to old age my love that's why my
B	my short term memory is not great I have to take a lot of notes and that kind of stuff
C	I do now especially for dates on the calendar and that
B	mm I mean we there's so much technology nowadays that we don't really need to remember certain things you can just
C	yeah but then I think that's not good I think you need to
A	if it if it goes yeah if
B	I mean that's fair those core skills you shouldn't shouldn't really forget
A	I think
B	but like if I didn't have my laptop all the work that I have to hand in and everything I don't know how I'd keep on top of it I'd just have pile I don't know how people did degrees before this kind of thing I'd just be stacks of paper everywhere
A	yes
C	yeah that's why I think it's that boring cos everything had to be put on to paper didn't it?
B	yeah gosh that would have been tiresome writing a thesis up and then getting it wrong a bit and having to go
A	read or type it or whatever
B	yeah
A	dum dum dum and then you make mistakes it's like oh god I'm gonna throw it away rather than just delete and
B	yeah
A	cut and paste or nothing
B	problem is that people don't back up well enough now so
B	I'm trying to keep it on the cloud I mean
A	can you put it on can't you put it on the cloud?
B	yeah I've got
A	well put it on mine as well
B	I've got it on a hard drive I've got it on a USB and I've got it on a cloud so
A	yeah
B	hopefully that'll be fine but this cloud so many I can give you a copy as well just incase
A	yes that's fine not a problem right I sent her that
B	I've got a presentation to give in a couple of weeks on erm
A	already?
B	I have to give a presentation on Nigerian pidgin phrenology supersegmentals and phonotactics should be interesting
A	good luck with that
A	I've heard of French creole but I've never heard of English creole
B	I mean erm Nigerian pidgin English Jamaican that's an English creole
A	yeah yeah man
B	yeah
A	yeah it's creole course it is isn't it? yeah creole
B	erm I've been to a couple of places in Nicaragua and Honduras that were er English creoles on the Caribbean coast
A	yeah
B	erm which at the time fascinated me
A	yeah
B	but so you need to know about lexifier languages what gave them their words but then you also need to know about the substrate which are the African languages that
A	yeah
B	give them their grammar and give them all this kind of stuff so it's really quite complex
A	I bet it is
B	and there's no theory there's no set er
A	mm
B	you know this is the best idea at the minute but it changes
A	mm
B	syntax is even heavier
A	mm
B	doing like as I said it's cognitive science
A	mm
B	every book's like a six hundred page maths book of like it's it's all about the language faculty and and it's trying to work out language of the mind and like basically do you know Noam Chomsky?
A	no
B	he revolutionised linguistics and a whole bunch of other departments he's actually the tenth most quoted person in modern books now and the er
A	oh right cos I don't read books I
B	the other nine are dead
A	right
B	in in the top nine are like Plato Aristotle and Chomsky's like
A	yeah
B	in the top ten which must be crazy to feel
A	yeah
B	you know I'm in the top ten of the most
A	and still alive
B	cos basically the behaviourists before that in the fifties were saying that children learn language through positive reinforcement and negative reinforcement from their parents and from their peers
A	mm
B	but Chomsky turned around and came up with what's called Plato's problem and the poverty of the stimulus where he's saying well how can children produce sentences that they've never heard?
A	mm
B	it's not possible that they just hear the sentence and thus then regurgitate it
B	and how is it that a child will hear a mistake yet know that it's a mistake?
A	mm
B	you'd think that they'd replicate the mistakes
B	these kind of things so since this the fifties sixties it's exploded and it's just gone on and they've been trying to make and they've worked out that the're are
A	mm
B	but in Spanish they have a null subject language
A	mm
B	because the inflection
B	you don't need to say
A	yeah you don't have to emphasise the er the the the I yeah
B	yeah so there's lots of these parameters and they found that all these parameters are binary it's either the language is that or the other and there's like a list of different parameters and basically the last fifty years they've been finding the core parameters but but again it's all theory
A	mm
B	and it's really difficult to prove so
A	yeah
B	and the problem with it is that it started off as transformational theory and then moved on to principles and parameters it then in the eighties and nineties was called government and binding theory now it's called the minimalist programme they keep changing it because the the theory's developing so
A	yeah
B	trying to learn about all this is a bit you know there's like
A	yeah
B	so many theories to try and get through before you actually get to the core of it
A	good luck
B	yeah
B	as well how do I apply this in the classroom? you know
A	yeah
B	how am I gonna use this knowledge?
A	yes plenty with those who who there
B	no yeah of course
A	cos if they're forced to be there you'll be going this I'm never gonna impart this to these people
B	but I mean mine and
A	yeah
B	for the future but er we you know we need to have a PHD before we can be doing that so that's a long way off
B	it may never happen
A	you've gotta get your master's first get get a get a job do PHD part time if you can
B	I mean we may do
A	yeah
B	more more people get funding when they cos the the university it's good for the university to have foreign students so they fund people to come into the university
A	mm
B	it would also be a way of getting our foot in the door with another country
A	yeah but would it pay for your like your accommodation and
B	funding would if we got the correct funding
A	yeah
B	would cover everything
A	yeah
B	they can fund people up to fifteen to twenty thousand pound a year for four years
A	er well I would definitely go in two off two prongs at the same time I'd be trying to look for work and seeing if I could do this
B	yeah
A	rather than just relying on one
B	no I mean our plan our plan after this is to go and work in the Middle East and save up the money so that we have enough money to self-fund ourselves
A	mm
B	and then if we get funding then we can just save that money we don't need to do it
A	yeah
B	but
A	I'm gonna get changed I suppose we're too early to go for the role call of thank yous isn't it? phoning people up
C	yeah my dad won't be home I don't think
A	no
C	neither will
A	we'll go see them on Sunday anyway but I might probably phone them beforehand we're not going out till seven are we? so
C	no not going till quarter to seven
B	do we have a reservation?
C	yeah
B	thank you for reserving that I kind of just left it I didn't I don't really know
A	well no
B	I don't know anywhere
C	well we didn't it it was difficult to know which one to choose from here but er we decided to pick something in
A	yeah
C	otherwise
B	mm
C	there and back erm
B	so we can have a beer or something
A	oh yeah yeah sure yeah definitely
B	beer does complement curry rather well
A	it
A	sorry?
C	are you gonna take it out so we can have a look?
B	yeah open it up
A	I'm quite good at resisting things
B	very patient
C	I just wanna make sure it's not broken
B	no it works
A	I'll go and get my one out of the car cos er I need to er
B	mm
A	erm I'd say there's a brilliant incentive there
B	I
A	cos you're mum's gonna
B	oh okay so you're not here cos I've been worried
A	no no it's no it's not in that's not in stone but your mum is going to want you to be with her
B	I know I've kind of when we've spoken about it before I've assumed that you won't mind if I'm not here on Christmas Day and mum
A	don't tell her
C	well I want you
A	yeah erm there's a
A	there is another way of doing this
B	oh yeah come and pick me up
A	it would be massively audacious for
B	yeah
B	yeah
A	I feel like er I don't think she'd your mum didn't even give me a chauffeur's uniform
A	you know so erm I mean tongue in cheek but we haven't we haven't finalised anything and to be fair er I don't have this emotional baggage
B	no you
A	that mum has got
B	yeah I presumed that you wouldn't be so bothered
B	yeah
A	so she doesn't get upset and stuff like that cos I don't get
B	well tentatively I was thinking Christmas Eve Christmas Day at mum's and then Boxing Day and
A	yep
B	the day after at yours
A	yeah fine like I said it er cutting it down the middle and that erm is a bit like that fable where they the the the
A	and the one of the mothers er immediately goes for that and the other mother goes no
B	please don't cut me in half
A	no give it to her he then gives it because he you know the blah blah blah it's stupid to try and do things like that you know
A	it's more stress than anything else for er for the person collecting and for the for the other person being collected so no just have your your er your Christmas Eve your
B	I mean would that work? cos actually thinking about it if
A	well no
C	well we haven't
B	yeah
C	erm but normally we alternate which year we have one with my family Christmas Day and then the opposite swaps around but that's all had to change cos
B	no
C	cos we're too big
A	it's it's become too big
B	yeah
A	I mean we could potentially get an
B	yeah
A	so it's not a problem but it's too much work for them
A	they've earned their spurs they' now have earnt the place to do you know to go somewhere else not have it themselves but the brother's house is next door er which is the old family house I think you may have been there once erm so I mean we could potentially get an
A	cos now that
C	I doubt it because
A	unless erm
C	erm well they we went there last year don't forget cos we came over or was it
A	I can't
C	you see by rights it should be I think
A	yeah
A	I mean if I wanted to
B	becomes stressful doesn't it?
B	mm
A	if I wanted to
B	because we all want to be together but you just can't
A	yeah no
C	there's just too many of us
A	yeah
B	Skype Facetime
A	I could say well where was
B	yeah
A	he wasn't here so I could say oh well it's my turn now but to be honest
B	process of elimination well
A	er not going to Spain
B	yeah mum sent me an email saying you've gotta convince
A	actually I I actually had put that nut in his head
C	the more you try and put that into into er er saying no the more likely he's want to
A	yeah
C	and the other thing is surely it's better for him to go out
B	yes
C	as opposed
B	that's perhaps it doesn't need to be Christmas Day I mean he'll break up probably early December and not go back until maybe even February depending on what his course is gonna be so
C	but he was talking about her coming here wasn't he?
B	they're pretty tight then
A	er
B	if he's willing to introduce her to the family
A	well
B	then it's
C	well I don't not saying he will
A	I I I don't know
B	oh just to?
A	erm
C	erm
A	I had kind of put that idea in his head but I
B	it was you was it?
A	put that idea in his head even earlier by going don't go now go at Christmas but he went now and he's kind of
B	and now wants to go at Christmas also
A	and he wants to go at Christmas as well to be honest
B	I know
C	I think she's got to give him leeway
A	but it's a nice it's a nice change erm
B	it it's unfortunate that it happens the one year I'm back
A	it's musical chairs it's now you're at home and
C	yeah but that's precisely it
B	I think she just wanted everyone together though didn't she?
A	well yes it was
B	but as you said that
B	it becomes difficult
A	yes
B	I'll probably be back for like I reckon a week over Christmas so
A	yeah
B	whichever is easiest for you guys just tell me and I'll kinda split it
A	yeah
B	I won't be able to be home much longer than that I have four exams in the first week of
C	the thing is I'm not being funny it it's lovely for us to see you but what do you do all day?
B	yeah
C	we know that you've got work than you can be doing
B	mm
C	it's a waste of your time you know it'd be better to say come up for like a couple of days here and a couple of days there erm with mum and a couple of days with us and then say to us well we can come down to you
B	yeah
C	so therefore at least you can study and we can just have the day but you're not having to sit here wasting all your time or trying to work around other people
B	hopefully it'll be okay but I am a bit worried they've I have a mid er mid year assessment and it's the first week in January
C	do you want the blind down
B	erm if it can come down
A	it won't that that blind there it's not gonna go down is it really? not gonna
C	I can't see which is the blind?
A	it's that one
B	it's right on the line
C	can you bring it down
B	if's this one here does that oh this plant yeah yeah no don't worry about it
A	no don't worry about that that's fine that can take it erm
B	oh yeah that's good that's fine okay perfect yeah
C	yeah?
B	yeah
A	at the end of the day erm erm surely mum would like that but the thing you have to say erm is oh god that damn things taping isn't it?
A	you'd better not play that
B	nobody else is gonna hear it I mean nobody in our family anyway
A	mum shouldn't always get what mum wants
B	yeah
A	are you with me?
B	yeah of course
A	erm and if he wants to go away she has to think about him what he wants rather than about me me me it it's all good I can show my family blah blah blah we can all integrate and fuse and push all of our families together
C	we don't know that
A	no we
C	she might
A	that's a
C	then she's that's fine
A	then she should say okay have a nice Christmas and I'll see you when you get back not saying I want you here because you know I want all my children around me and stuff like that
B	I can't really comment can I? I mean when was the last time I was in England for Christmas?
A	no you can't you've got erm he's done his stints
B	mm
A	you haven't
B	I guess it's just unfortunate that the the year that I'm home he he is talking about going off
A	yes
B	I haven't got a problem with it but
A	yeah
B	erm probably would be a bit nicer for me if he was around because I don't really know anyone in the family other than mum and
A	yeah
B	kind of know
A	yes yeah
B	erm I'm not gonna
A	like I said
B	tell him not to go cos he doesn't
A	because all you'll be doing is serving your own self-interest are you with me? you'll be saying do this for me
B	what you want
A	exactly
A	well he is he is old
A	he may not be wise and he may not be a sage but there is those are his words
B	oh
A	so yeah so I said I'm quite erm as long as I get to see you some er the time erm it's like when I jokingly put I mean you're clever at words so you would have got the little cryptic thing I gave you about the
B	mm
A	erm I didn't know what you were doing but looking at it from just on face value I thought hold on a second I thought you were coming up to see me
B	mm
A	mum's
B	yeah I mean she told me ten o'clock and I just went I'll run it by dad and see what he says
A	yeah
B	erm you came back with er so I was like I'll just tell her now and
A	yeah
B	I said one o'clock to her and she she went yeah one is fine so
A	yeah
B	I mean it was a bit cheeky but at the same time I think she was probably thinking I'm seeing
A	yeah she probably doesn't realise it herself I mean or or she does I don't know erm
B	nah I'm sure she just thinks
A	but I said I I I'm not I don't have the emotional all those emotionals that it that she has that and feel upset and things like that no
B	it can be a bit tough for us in the middle though like trying to think I don't wanna you know put off you and I don't wanna put off you so yeah
A	yeah but I'm I she's a much tougher
A	cos to make to cos with when I'm talking to you you can tell by my intonation and my gestures if I'm meaning it or I'm just saying it as I yeah I don't mind well I do mind but and but I'm trying to disguise it and you'll know that but in an email you don't pick up any nuances or nothing like that so I thought if I threw a little diagram in you'll know that what I'm saying is I'm not that you know I'm not that erm I've just recognised it but if you want to go then or or I'll just say okay fine if it makes her happy then do it you know?
C	do you know when you'll actually finish uni?
B	erm yes I I finish the twelfth of December
C	oh right so you've got a fair old time off over
B	yeah so erm and as as will
A	mm
B	erm university gives you a fair bit of time off undergraduate
C	well yes because the idea is you get a bit of a job if possible doesn't it?
B	yeah
C	erm especially at
B	mm so yeah I'll finish on the twelfth and then I'm just I mean what you were saying is correct about like my studying but I think because it's not coursework because I've just got exams if I came home for a few extra days I think I could study here I might just have to go and lock myself in the room and do it everything should be on my laptop really I should have done everything by that point I just have to study
A	mm
B	I just have to keep reading about it and making sure that I I I follow it so I think I'll be fine
A	yeah
B	but he should finish around about mid-December I would say erm it's gonna come round quickly isn't it? really really quick
A	yes it will do it's ninety days
B	it's already October next week
A	ninety days till Christmas
B	oh you're counting down are you? has the has the Coca-Cola advert come on?
A	just do the math boom straight
B	straight answer ninety days
A	ninety days erm it erm with
B	mm
A	erm
B	I mean he should do if he's always got work that needs to be done
A	he's got work that is the slight
B	mm
A	but the other break
B	I'm a bit concerned with how he's viewing his finances in general he's given me a very kind of blas
A	yeah
B	you know I'm being lent so much money that it doesn't really matter I might as well just spend it and I keep trying to say to him if somebody had told me at the beginning
A	yeah
B	take the money don't spend it stick it in an ISA
A	yeah yeah
B	whereas undergraduates just feel like hey I've got this money where did it come from? like they just spend it
A	yeah
B	and then you think oh and I mean I've still got fifteen thousand he's gonna come out with closer to thirty to fifty thousand so
A	mm
B	if he takes the full amount which he keeps talking like that's what he's going to do and I'm like well no take the minimum you don't need to er to take
A	yes yeah
B	I guess if he's never gonna have to pay it back then
A	he should he should seek your wise council because there is no substitute for experience I said when I say to him erm about what he's going to and stuff like this it's like with the freshers' week I said I talk as though I've been on this I don't I only know from what I've heard and have a good time blah blah blah you know this is where where you your getting to know people and and the way it works and stuff like that and then you knuckle down erm I said but apart from that I I can't give you any experience er any advice because I've never done this before erm so I'm hoping that he will actually listen to you and seek your council because you've done it you've made the mistakes you know where the where the pitfalls are and you can spare him from doing these sort of things as so so if he wants to go and see
C	yeah but you'll probably find he won't he he's more chance that he might go early because the flights'll be that much cheaper if he leaves it right on top of Christmas
B	yeah
C	it's gonna cost a fortune to go out there
B	that's true
A	mm
C	so he might sort of say if he goes soon as he finishes he can perhaps have what? anything like a good ten days out there
B	mm
C	erm and sort of you know come back just as everybody else is going so it doesn't cost him quite as much money
B	I think that would be a better idea as soon as he
C	then he can sit down and study
B	as soon as the course finishes go out for a week or so come back for Christmas and
C	that's it and then you've got some time to finish your studies
B	it really depends on his
A	it'd keep your mum happy as long as that's when she wants him out there
B	mm
A	she might want him at Christmas are you with me?
B	mm
A	and then he's going to definitely
C	but you don't get what you want do you all the time?
A	er
C	you just have to
A	no but
C	so wait and see
A	I think he if he's going to disappoint me your mother or
B	yeah
A	so erm yeah so I mean
C	yeah but you look at it I'm not being funny he he's had and don't take this the wrong way he's had Christmases that haven't really been anything brilliant for the last two or three years because he's been on his own and an awful lot of that time there at Christmas so if he's got a chance to have a fun Christmas then surely that
A	I would go for well
C	well you'd go for that wouldn't you?
B	I feel quite guilty to be honest with you but
A	it trumps every time I said the only thing I'd say is if he's going at Christmas make sure that before that you go you've done everything it's it's nothing for you to come home to
B	mm
A	it's all done you're not smart enough to be able to go there and then do this
A	won't be too heavy
B	er
A	but I mean I fear that science
B	it's going to be that I mean the
A	yeah
B	so er
A	yeah
B	erm
A	I can't help him
B	no
A	I gave him some money boom boom that's it erm
B	I just hope he uses his money wisely he
A	mm
B	I was knowing that you know if you guys are assessed or mum and
A	mm
B	and I purposefully took a year out but only found out in hindsight that you had to have been living on your own for three years not for one year
A	yeah
B	erm and
A	mm
B	he's okay he's currently been living with mum but as far as apparently they're concerned he's been working so he's a mature student so
A	yeah
B	he will get more help because he's been assessed but he also seems to wanna take all of the money and and the impression he's given me is
A	yeah
B	just it's free money and I can just kind of spend it
A	it's not oh it's not free he'll end up having to pay a bit or or erm keep servicing the erm the interest without any of the equity and that could cost him an absolute fortune over over
B	I think he'll
A	his working life
B	I think he'll go travelling over the summer again I think he's got the bug a little bit now
A	he's got he's got the bug yeah I just wish I said about the girls and that's easy for me to say but I said focus on the mission girls that will all come later but sometimes people want everything now especially
B	my concern with him travelling he
A	yes he's not got you
B	he just he just already has a higher standard than I did at his age so
A	yeah he is I mean like your your mum at her age will happily go camping and stuff like that even at that age now he's going
B	no
A	no
B	do you know how much he he he got with some girl and must have paid about sixty-seventy pounds for a room a a wooden hut on the coast in Thailand it sounds lovely for about sixty-seventy pound really nice mini bar all that kind of stuff I got a very similar one for about eight pounds when I was there you know what I mean?
A	yeah
B	probably not quite the same standard but it was a beach hut
A	yes
B	on on the beach
A	he's got he's got standards
C	you're more far more mature in your attitude
A	yes
C	and have been over the years
B	mm
C	than he ever has been
B	mm
A	yeah and you're
B	he seemed to when it was good to see him when he was out there he seemed like or the first time he really seemed like he'd come on a bit when he was out there but
C	oh yeah he's he's come on an awful lot
B	but then he came home and mum has been like he's gone backwards again he just like didn't come out of his room didn't wanna kind of do anything
C	no
B	and I guess he was in a bit of limbo at that point
A	yeah kind of
C	he's been texting
B	yes
A	even when
B	he was so confident out there he was happy to talk to me he really it was nice to spend some good time with him but but yeah I agree I do agree he said to me he feels bad about it and he said you know I felt like I feel I'm behind I feel like I'm younger than other people but I've kind of been in limbo for the last four or five years now I'm kind of catching up I said I don't think it
C	yes he
A	I think in a way he's
