B	yeah
C	and I've given that advice to a few other people as well
B	mm it's good
C	who've also said thank god I never did
unknown_female	mm
C	erm but erm but yeah I always remember
B	and then and then the same thing arises when you kids start doing erm jobs you know school jobs
C	mm
B	then you think should I jump in? shouldn't I? should I jump in? shouldn't I?
C	mm
A	it's back to they've got to live their own lives and sort themselves out haven't they?
B	but I have on one occasion when one of them was at
C	oh right
B	waitressing and she was being constantly sworn at by the chef she was only about fourteen
C	oh that
B	I don't know it must have been a long time ago
C	I don't know
B	and there was someone called
C	oh yes that was that was right at the beginning yeah
B	the whole chain of restaurants and I just rang him up I'm I'm not taking this why should and I had a long you know very interesting discussion I said look you've got children would you allow your children to be treated like that? he said certainly not my so then why do you allow my children to be treated like that? and he said well I'm really really sorry but that's the way catering is I said that's no excuse
C	mm
B	and he was very decent about it but I shouldn't have interfered probably
C	mm
A	cos sometimes you just feel you have to don't you?
C	mm I know mm mm
B	but kids do get exploited sometimes
C	mm they do I agree I think if they're with a real exploitation like like I when I several times
C	several times I've you know sat there given them
B	sworn at the whole time
C	a lot of advice and say this and do that and you know I've never had to intervene never been quite that bad but erm but yeah
B	well no I'd learnt it from somewhere else it was all just passing down the chain it was just really useful
C	well yes exactly but it is certain things like that because
B	cos
C	yeah
B	I used to learn quite a lot from her cos she's very direct and
C	yeah but I had it you know there was a group of people that I was sort of I don't know six eight ten years younger than that I somehow seem to get involved and like really always enjoyed that the friendship I had with all of them you know you and
B	had to deal with the different teachers at
C	yeah absolutely all of those things I found I found
B	cos that's quite important isn't it?
C	really really useful erm over the years
B	mm and I find it useful also when they went to secondary school
C	mm
B	cos I used to worry about things
C	mm
B	you know what streams they were in or what they were
C	yeah absolutely all of those sort of stuff yeah
B	or how they did sport or whatever
C	mm but yeah so
B	yeah so I must try to get there more often on a Friday first Friday of the month
C	yeah
A	I'll come and winkle you out
B	mm like I usually don't come cos genuinely I have something on but I will
C	well you need to put it in the diary and then work round it
C	mm
B	right shall I press the button?
