A	new wave modern
B	new wave modern English right? but with a bit of
A	with a
B	new wave
A	yeah
B	with a blend of street
A	yeah I'm not so sure that's it
B	yeah I know
A	you know
B	er yeah I mean I had a few er oh are you selling it?
C	maybe
B	that one was my one originally
C	do you wanna swap?
B	we somehow swapped up yeah
C	fucking
A	is it an acoustic?
B	no
A	really? how do
B	I mean
A	get it to stay on the bridge?
C	this is one of the five
B	yeah
C	it doesn't affect the
B	it's pretty annoying you can't actually put that little hole
A	ah ah I see yeah
B	you have to chop the end of the string off to put it in
A	ah that sounds
B	but where do you currently live man?
A	where do I live?
B	mm
A	er
B	so country England town
A	mm
B	and
A	have you shown
C	oh man
B	how many years or months have you lived in England?
B	all your life so how old are you then about
A	yeah twenty-eight
B	so twenty-eight years how about
A	yeah probably
B	twenty years yeah
A	only a little bit mate
B	no but I mean do you consider that you speak it?
A	no
B	so you want me to write yes?
A	gangster language
B	if yes please specify for the details gangster
A	yeah like if I go down to
B	okay so
A	I mean they know what I I mean
B	that'd be a dialect though wouldn't it?
A	yeah
B	I'm gonna say you do
B	do you want gangster or?
A	no no er er yeah the language of love
B	language of love
B	I'm sure they're
A	I I do have a I do have a knack like communicating with animals
B	yeah
A	but I
B	I'll put that in there
A	but they
B	Doctor Dolittle
A	yeah but
B	that's it body language
A	yeah that's another one yeah
B	so do you speak any other language? body language
A	body language yeah yeah yeah
B	body odour and like that smells that you exude
B	did you go to college?
A	yeah I did yeah
B	yeah what's your job role?
A	travelling gardener
B	travelling gardener?
A	travelling gardener
B	is that genuinely your role?
A	that is genuinely cos I travel around the estate
B	cool
A	in a fucking something called a
B	I managed to get three and a half hours of recording yesterday with my dad and
A	that's alright
B	yeah we played a game you like this
A	what game?
B	Battlestar Galactica the fucking board game
B	it's a killer mate
A	are you like Battlestar's number one fan?
B	yeah I know my friend's bought me this cos we bought the Game of Thrones ones so they reciprocated
A	Game of Thrones mate why are you into Game of Thrones man?
B	this shit is insane
A	have you watched Game of Thrones mate?
B	yeah yeah
A	oh shit mate
B	oh was it good?
A	it's fucking good
B	don't tell me what happens
A	I can't mate I wanna but I can't mate you got three seasons to watch
B	I know
A	you gotta watch them
B	three seasons
A	oh mate
B	yeah
A	it's proper fucking good mate
B	yeah it looks alright
A	we could put it
B	eh?
A	are you gonna let me teach you some PJJ or are you still gonna be like?
B	you can teach me some PJJ I'm hungry
A	I'm lethargic when I'm hungry
B	I am
B	look at this shit
A	oh mate
B	McDonald's
A	didn't I use to play games with you before?
B	er I was
A	when I
B	I never play games
A	never play anything
B	there's all sorts of shit
B	the cylons
A	I mean how many have you won this game?
B	I have no I you play cooperatively you don't really win it as such
A	oh right
B	just to stop the cylons from
A	did you actually wanna play this game? are we gonna?
B	no no no I was just saying
A	oh yeah
B	you kinda have to
A	how long was that blonde woman in it for?
B	I dunno for the whole thing right? yeah
A	was she a cylon?
B	erm
A	the fit blonde one?
B	yeah she was in it yeah
A	but she
B	it turns out you weren't
A	like get a fucking Xbox mate
B	I'm retro what are you talking about?
A	retro
B	yeah
B	what's wrong with
A	what's
B	I don't like it it's just I had it somebody bought it for me
A	yeah
B	so I kept it
A	yeah that's really
B	are you talking about the pub now or the
A	no
C	the duke
B	is he actually the duke of
A	yeah yeah he actually is mate and he is the Lord of
B	the lord of
A	it's a place
B	yeah
A	but someone's written the duchess's car dirty old bitch
B	had to change that one then
A	yeah mate
B	are you good friends with this fella?
A	you don't really see him mate
B	yeah
A	to see all what's cos he's
B	yeah
A	or just unsafe do you know what I mean?
B	did he did he test you or?
A	yeah and I know he was alright
B	yeah
A	he was like I said well I said varying degrees but it's just not you got to call him your grace
B	really?
A	yeah and I was like it's just not
B	you have to call him your grace? what happens if you don't?
A	no well you'll just get fucking bollocked probably but anyway he's just he said to just keep him off your back as well
B	surely the only graces in the country are the monarchs not the fucking
B	I mean that's a pretty big one below how many monarchs are there? and then how many dukes are there?
A	there's only
A	yeah so you don't have to respect who they are it's just a rank so anyway
A	I'm like I ain't got a licence your grace he's like ah get one in time
B	I'll get you one
A	he's alright with me he loves shooting mate he's meant to be a fucking good shot
B	yeah
A	yeah
B	I don't know mate
A	but you know er a
B	that sounds like a bit of a wanker then if you ask me
A	why?
B	well cos if he's got thirty-five thousand hectares and I've got nothing then I I'm not particularly pleased with that setup
A	yeah but that I mean he brought that it wasn't inherited
B	I know but he's
A	he used to own land
B	no
B	I mean I presumed it was the coast if it was a beach
B	ah
A	so what they do is
B	to get round that?
A	and he's the
B	jesus
A	someone at work was like I hate people who are like don't pay their taxes and they just you know cheat tax and put money in offshore accounts I was like mate that's what a duke does that's why he's you call this place a charity and he's the head trustee so he doesn't have to pay inheritance tax
B	I don't have a lighter actually
A	I've got one here just need an ashtray
B	oh yeah that can'll do
A	we could open the window I mean door just get a bit of fresh air in
B	yeah
A	she won't come round anyway I know she gave
B	what is he gonna PJJ this woman?
A	yeah mate I'll PJJ you in a minute mate
B	great one
A	pardon?
B	great one
A	er you need to learn this shit mate
B	why is that? so I can talk to you about it?
A	no what'll happen if you're walking down
A	if someone takes your back mate
B	with a gay guy on your back
A	how are you gonna defend yourself? how are you gonna defend yourself?
A	someone takes your back mate how are you gonna defend yourself? you can't see them they can choke you they can punch you
B	probably just fall backwards
A	yeah but then you're falling more into their grip aren't you?
B	yeah into their loving embrace
A	you need to roll forward to roll them off you
A	or you need to
B	cool
A	remember that
B	I'm a pretty good runner
A	I'll show you another bit of
B	I always run
A	let me hold your wrist
B	what am I trying to do?
A	hold my wrist alright?
B	yeah
A	and like you turn it put it them into you
B	yeah don't
A	no but like
B	I bet the bouncer were none too happy
B	circles
A	it always works that circles always work
B	fair I'll have to remember that one
A	guy at work started kickboxing
B	mm
A	yeah you're not throwing anything no
A	but I mean if the guy is always
A	oh mate get away
B	sorry
A	I fart like a girl mate I hardly ever go and when I do go it's quiet
B	you fight like a girl
A	I fart
B	oh right
A	I never fart like proper loud ones
B	no no I don't
A	no I don't think so
B	I reckon people that burp less do bigger farts
A	I probably do burp after I've eaten shit
B	oh
A	I know that's
B	those Korean fucking jeans they're like
A	oh thought they might have been
B	fucking joke dunno sixty-eight kilos or something
A	sixty-eight kilos mate? fuck
B	yes something like that
A	I was like I
B	hundred? you must've been a chunk a proper chunk cos I got a mate who's quite a bit taller than you
A	no
B	and he's a hundred and he's quite big so
A	yeah yeah yeah
B	so you're fucking a hundred
A	I'm a hundred mate
B	with a bit of a belly on you
A	yeah mate I got a fat ass and legs though?
B	yeah
A	no some of it's fat
B	yeah
A	I've got boobies like a fourteen year old girl mate
B	I ain't got much fat
A	the guy at work is so thin yeah he's so fucking thin he's a fussy eater
A	like if you eat badly every day
B	you don't really go lower than about four percent do you as a man?
A	I don't know
B	yeah
A	but and I don't if I told you this if you eat rabbit everyday cos rabbit's so lean it's the leanest meat there's hardly any fat on it
B	if you just eat rabbit
A	if you just ate rabbit
B	yeah
A	you know what I mean not there's not enough fat and then you need
B	yeah
A	you can't rely on that you need fat to live
B	I've never tried rabbit
A	it's nice mate it don't really taste of anything tastes like
B	I bet it's good
A	you know that chicken's like mild doesn't really taste of anything it tastes of the flavours on it of other things?
B	yeah yeah yeah
A	it's like that it's like a white meat it don't taste of nothing
B	I tried crocodile when I out in Cambodia
A	yeah
B	that was interesting
A	yeah? I imagine it's like watery chicken innit?
B	no it's not actually it's like it was like pork
A	does it taste fishy?
B	the closest thing I can describe it to is pork but like a fishy pork
A	yeah that's what I imagine it tastes fishy
B	I had snake as well that was a bit weird
A	mm
B	and I had kangaroo that was good
A	one of my cousins knows how to skin a snake and eat it
B	yeah
A	mm
B	I
B	but I saw some eels getting skinned in Korea and that kind of hit me a bit hard
A	oh mate
B	just go out and do cos that's ridiculous I can't
A	yeah it's not nice seeing things like dying
B	yeah I don't really like it fair enough if you're gonna eat it that's fine but I got a bit of a problem with erm
A	well
B	mounting it up on your wall and that kind of shit
A	or mount it I shoot at work because
B	well you're culling them aren't you?
A	yeah basically it is and I'll eat it if they're good
B	I understand culling animals to a certain degree I'm not entirely sure I understand reintroducing things like wolves
A	well no they won't you know the guy who owns MFI?
B	what's MFI? was that like a music?
A	oh
B	is it an old shop? does it have a red logo?
A	no yeah yeah they sell like sofas and shit like that
B	oh no I don't know what you're talking about
A	and they sell like sofas and beds or whatever
B	yeah
A	and erm he wants to
B	why?
A	cos they're native to the country
B	yeah but I don't
A	you know he wants to re wild Britain back to how it was but
B	but do you think bears are gonna fare too well in England?
A	no
A	what squirrel?
B	do you remember when it was like? hang on a minute
A	mm
B	haven't been on it
A	squeaks a bit
B	oh shit
A	yeah
A	cos I was a bit fucking mashed then er
A	just lingering on the bike mate I'm twenty minutes late from that big group of bikes thinking
B	it was dark was it? what were they all doing out?
A	I don't know mate I was thinking what's this
A	I was thinking why have you got twenty-four seven? maybe they're on some sort of challenge or something
B	doing their cycling proficiency test
A	yeah I thought mate they were like street angels on bikes
B	sorting out
A	I've got a flat tyre don't worry the street angels are going
B	sweep on in and sort you out
A	mm
B	no?
A	no
B	yeah cool
A	yeah it was not that long
B	maybe at the speed you were going
A	yeah
A	yeah
B	how I'm gonna fare
A	I was thinking a bike's is a pretty simple design innit?
B	yeah
A	I wonder when it was invented though
B	er when it was invented?
A	yeah sure they could've made a bike in Ancient Rome?
B	I think the problem was rubber wasn't it? like something that they needed to roll the wheels on cos
A	they could've done it they could've done it with leather
B	they tried to make it out of like wood or something it was like yeah you'd think of leather wouldn't you? that would work
A	yeah my grandad used to run a bike made out of leather cos he was too poor to
B	yeah
B	I'm imagining the whole bike's made out of leather so
B	some weird little floppy bike you know
A	you saw a what?
B	it was a tiny little car and it had no doors it just
A	a car?
B	yeah yeah I'm just saying if ever I've seen a car
A	well
B	I thought that was my car and I would
A	oh right right right
B	it was like a little car with erm no doors it didn't use to have any doors it was like a little what do you call them? is it a hatchback when you can't there's no doors to the back?
A	yeah yeah
B	you just sit in the back so there was only the two front doors they'd been removed and there was just like a piece of rope that was attached like properly well done like and it hooked on to the other side
A	yeah
B	so you just undo the rope and get in your car and do the rope back up
A	where is this in a fucking theme park?
B	I've just it in Greece somewhere just on an island I guess it was just so safe and chilled on the island
A	yeah
B	they just had rope instead of doors and it's probably hot all fucking year round so I mean
A	yeah I know when I first went to Cyprus
B	yeah
A	it was
B	mm
A	but they fucking get well hot in the summer we had to put towels on them they're
B	yeah
A	like
B	did I tell you my friend's got a boat? she's
A	I think so
B	she's got with some guy recently who absolutely loves Depeche Mode but that's just random
A	how old is she?
B	they pretty much spend at the minute she's been out there for a few months and she's
A	how old is she?
B	how old is she?
A	yeah
B	maybe thirty thirty-one
A	oh right like a sugar daddy
B	yeah I mean her last few boyfriends have been kind of old as well
A	yeah
B	not like old old but like forties maybe always like ten ten years older than her maybe erm anyway
A	mm
B	and spend months doing it and I'm hopefully next April or May I've got friends that are teaching in Ankara in Turkey so
A	see I I keep saying to
B	I might teach there
B	if I taught there would you come there?
A	yeah well she's just worried about going there like on holiday mate
B	obviously if I taught there I'd be able to put you up I might have a place for you to crash
A	there's loads of history in Turkey yeah
B	yeah there is
A	Istanbul yeah what's the
B	that's how they said it when I was there so
A	mm they say that in Portugal everything's
B	yeah
A	so you know
B	Portuguese man sounds like Spanish and Russian had a baby
B	it really does I don't
A	ah man I'm trying to think of some of the words I said er
A	and what's thank you?
A	yeah oh no
B	or
A	they used to say oh er oh mate what is it? just anything
A	like
B	Portugese yeah
A	so weird mate
B	or instead of
A	no that's it you can say please in Portuguese and it's
A	I was like
B	I think I think like
B	but I guess it's kinda like the
A	from which?
B	but
A	er I'm trying to think
A	no no that was like please but
B	you've got the same as me mate a high beard
A	yeah yeah yeah
B	do you have to trim this shit?
A	I do sometimes yeah
B	yeah
A	but not always
B	yeah
B	mine goes really high like up here
A	yeah
B	you can see it on the
A	oh mate what is thank you?
B	I mean do you want me to look it up?
A	yeah please look it up it's gonna annoy cos it's not just thank you it's something which you can say like
B	actually I have a laptop now that it's fast enough
B	so I'm like
A	oh mate
B	oh I've just turned it off and you know
A	it's gonna proper annoy me if you find it
B	I'll find it
A	say thank you in Portuguese
A	no no look
B	you like those boobies don't you?
A	yeah it's quite a good
A	cos it's not much colour going on so
B	I looked for one of those yeah
A	yeah it's just like a grey scale apart from on the feet
B	yeah
A	it's a bit surreal
B	well what was I looking for?
A	ah
B	ah
A	they're just like they're gonna say
B	do you know like letters like R and L oh it doesn't work so much for R and L but like S and Z is exactly the same letter? and B and P and G and K are exactly the same letters
A	mm
B	yeah
A	like what the fuck do they
B	but if you put your hand on your throat here
A	yeah
B	and you go ssss
A	yeah
B	and then you go zzzz tell me the difference
A	ssss zzzz there's a humming when I do zzzz
B	yeah it vibrates yeah
A	yeah
B	but that's the only difference in in linguistics it's called voicing and unvoicing so S and
A	mm
B	but one is vibrating the vocal cords and one isn't you have a lot of those
A	mm
B	K is
A	isn't this the difference what of
A	between a vowel and a consonant is?
B	no they're all consonants
A	all they all come from your throat or one comes all from the throat and the other one is produced outside the mouth
B	every sound I just gave you was a consonant vowels are like A E O you know?
A	yeah and they yeah so they'll be pronounced differently
B	yeah
B	well they're
B	well they're all voiced and so consonants can be voiced or unvoiced
A	and
B	but vowels are all voiced
A	yeah
B	you can't make a vowel without vibrating the vocal cords
A	yeah yeah yeah yeah
B	erm
A	everything used to be consonants like the
B	I think you might be talking about the alphabet but not actually pronunciation
A	oh no no no well then in the alphabet no cos
B	because we always require vowels
A	well in the Greek alphabet
B	there's no language which has no vowels
A	well maybe they already had the vowels
B	but like in Hebrew and in
A	but in
B	in Classical Arabic it's written with no vowels like writing is just consonants and then
A	yeah well yeah well Phoenician
B	you can
A	Ancient Greek language originates from the Phoenicians
B	okay
B	that's
A	yeah yeah so the Phoenicians had yeah
B	that's the original
A	and they had mate they had like a hundred odd letters
B	mm
A	and it was all for keeping stocks and all shit like that but then over time
B	yeah
A	before the Ancient Greek one
B	mm mm
A	but there was no
B	well apparently
A	and I think that's why like
A	they started writing loads and doing music and there's like all the music and drama and all that shit
A	of how
B	every single alphabet in the world comes from the Phoenician alphabet every single one in the whole world there's not an alphabet that doesn't come from the Phoenician alphabet
A	erm
B	cos there're other languages if you go to the east
B	they have logographic languages which aren't
A	yeah but what are they called? they they call
B	it's not an alphabet
A	what's what's an insulting name for a Jewish person? someone from Israel?
B	I
A	semitic yeah cos don't you get semitic language?
B	yes that's
A	and I think that where it's split it's split into what we have now what we have now into the Ancient Greek and stuff and the other one went
B	okay
A	and then like later into I don't know fucking
B	yeah
A	is that what semitic is?
B	erm yeah I mean we were talking about alphabets though weren't we?
A	yeah cos you were saying Phoenician language was the first language and everything came from it
B	all
A	well that's
B	in the whole world
A	look up
B	but do you know like what do they have in China?
B	do they have an alphabet?
A	erm I don't really know what it is cos it's
B	it's called logographic it's when
A	just look up
B	I will do in a sec but let me just explain
A	so so we don't forget
B	it's like
A	mm mm
B	to represent phonemes which are the sounds
A	mm mm
B	effectively so we have one letter and that represents a sound we have
A	mm
B	it can be a combination of letters but you make letters to represent
A	mm
B	it's logographic they have a
A	mm
B	they have an image that represents a word and sometimes they can have extra lines that indicate pronunciation
A	mm
B	but in general it's er and that's logographic you then also got hieroglyphic which is more pictorial it's got like images that connect so
A	mm
A	yeah yeah cos erm
B	so what I'm saying is that
A	isn't cuneiform a major part of this?
B	cuneiform was one of the oldest languages in the
A	isn't that like one of the bridges for erm?
B	cuneiform is a type of writing
A	yeah but it's after the Egyptians isn't it?
B	but it's a type of writing it's like the clay slate or something that they wrote on and that
A	but I thought their
B	I think if you Google cuneiform I think it's a type of writing
A	yeah yeah yeah it's just cuneiform came up here somewhere cuneiform
B	yeah yeah
A	no
B	diacritic is any kind of
A	mm
B	if it's aspirated or er er let me take a word for example say P A T what's that word?
B	P A T
A	oh oh pat sorry I thought
B	pat now say splat
A	splat
B	if you notice in the English language the first P that you say is aspirated a puff of air comes out the second one it doesn't hold your hand in front of your
A	pat
B	pat
A	pat
B	can you feel a P? like a puff of air?
A	yeah pat yeah
B	now say splat
A	sometimes you spit
B	say splat
B	there's no puff of air afterwards splat
A	splat splat splat
B	so that would be marked by
A	yeah it could be maybe
B	by it's minimum
A	you went splat
B	it's minimal
A	yeah
B	you'd have to enunciate you have to go splat
A	yeah yeah yeah it's not P you're not like proper pushing the air out
B	that's called aspiration it can either be aspirated or not aspirated so a diacritic would put a little H above it
A	mm
B	and the H indicates that it's got an air puff it's like er
A	yeah
B	I'll show you in a second
A	yeah man
B	do you want me to show you?
A	yeah go for it
B	you might recognise a bunch of these words
A	I tell you what's weird yeah
B	oh
A	you know what I mean? or you're the top you're the best of the best
B	yeah
A	I but I said to my grandad how do you spell
A	yeah there's a few in the Greek ones
B	eh
A	I learnt them all but there's no there's
B	it's not a diphthong
A	when you read when I read
B	but a
A	but they use that as a word but when I asked my grandad
B	but er a diphthong is only a
A	he struggled to spell it
B	I understand that a diphthong is only a vowel
A	mm
B	that would be a monophthong a diphthong would be a double vowel sound like ow ear and then
A	a diphthong is in
B	a a triphthong would be a triple one like
A	mm
B	eh ah
A	yeah
B	ah eh are
A	a diphthong's in erm
B	but what you're talking about is called erm
A	yeah but they didn't have there's no other word like it er I couldn't find one
B	right it doesn't have
A	yeah it's not in the Greek alphabet
B	but we've got
A	so you've got the alpha
B	we've got plenty of sounds in English
A	yeah but you've got C H and when you see it together you know it's like
B	yeah but that's two separate
A	I know but there's yeah but if you if you said
B	but we can draw it that's what you're saying
A	yeah as in church
B	so you can't write in
A	there's no
B	Greek
A	the Greek like
B	they don't have bunch of sounds in all fairness
A	they got alpha yeah it's weird right look under Greek language
B	I was gonna show you this I've seen I know the Greek alphabet
A	yeah just let me show quick
B	ah
A	ah you'll show me this in a minute it's not going anywhere
B	I just need to see who I got this email from could be important
A	well you might be able to explain this to me
A	Greek alphabet
B	Greek alphabet
A	right so there's no
B	yeah
A	alright just click on this one
B	alpha beta gamma delta epsilon
A	okay so there's no
A	where are you?
A	mm
A	it's actually
A	yeah
A	and that's meant to be
B	ah okay that's cool
A	it's it's sort of K K
B	yeah that's a glottal
A	it's an
B	kind of thing
A	yeah
B	it's like a H
A	yeah you know like how
A	yeah it's so that's
B	it's a guttural something or other it's a
A	yeah it's right at the back innit? like when my grandad's trying to get me to pronounce words he's probably like that
B	yeah
A	I'm like
B	no no well that's because that sound
B	we don't have it in the English language
A	yeah that's meant to be like he
B	yep
A	okay? so any E sound is like you pronounce it as in you know for tea like the E for tea is no that's just the one way to pronounce okay? so eater
B	you can change the vowel
A	yeah but why why have that er?
B	why do you change the vowel though? is it for inflection does it change the grammar?
A	I don't know my my
B	or changes
A	grandad was saying like
B	it's just
A	yeah
B	have you even seen IPH?
A	oh what's that all about? why don't they have one
B	no have you ever seen?
A	but why? tell me why that's what I'm asking
B	I don't know
A	are you not curious? why that? why?
B	yeah I mean I have been I might be able to find it better in one of these books actually you might like these books
A	they're big fucking books mate
B	these are encyclopaedias
A	mm
B	right I'm just looking for the IPA chart it's in pretty much every textbook I've ever bought it's just I don't that I don't have my other textbooks
A	I see what you're trying to do here so
A	so instead of saying heel we'd say eel I don't think so like land he's gone land land land
B	what?
A	like here so you've got land land long land
B	yeah
A	as if it's like Essex like land
B	no that's a symbol
A	yeah that
B	that sound is an A sound
A	so why has he done that?
B	the same as in land
A	why why not just done A?
B	that's what I'm trying to show you there's a phonetic alphabet
A	no but I mean you pronounce that one with the A?
B	well it depends whether they're talking I haven't looked at the book are they talking about an old form of English?
A	no it's
B	is this spelling of the old form of English or is this the pronunciation?
A	pronunciation
B	are you sure?
A	erm
B	it may very well not be
A	oh it says dialects
B	so it's erm spelling
A	yeah
