B	you say that you were a really angry person until you met me but I was too calm a person till you met me I was a pushover I'm not afraid of admitting it I still am I'm working at
A	and you still are but
B	I'm working on it
A	the thing is I'm still an angry person but I'm working on it
B	and I think that's what
A	you know?
B	that's what we bring each other we complement each other because I teach you how to calm down and maybe think a bit more rationally or whatever
A	and I teach you how to stand up for yourself a little bit more
B	you teach me how to stand up for myself because I mean there are things that people have done to me that I have let go because I haven't been bothered or I've been too scared of confrontation
A	yeah
B	whereas no having that argument with
A	yeah
B	feels like even though I knew that I like what I've said to you from the start even though I knew that I would never be friends with any of those people regardless of what I said whether I was nice to them or not
A	yeah
B	but I'm working on it
A	but that really upset me as well and I'm so I'm saying this now but it really upset me that they were doing all these things to me and you couldn't stand up for me and then I took a step back and realised that you're not me
B	I know
A	you are not like that
B	but I
A	and you're that that's not a fault
B	no but I've
A	it's a fault of mine that I thought that of you
B	I've always always felt every time something happened and I er I couldn't not that you were insinuating because I know you didn't mean it to put me down but when you'd say or when
A	and you did though
B	that meeting that you had
A	you made a difference by being my friend
B	that's
A	but does it even matter about the meeting?
B	with that guy at university that's I said I was gonna use my voice but like honestly you saying that it's like it's not it's not news to me because I knew every time that you wanted me to stick up for you and I didn't do it it's something that I regret
A	but you stuck up for me in a different way
B	but
A	you stuck up for me by still being my friend
B	well I'm
A	and standing by me by and
B	I'm glad you see it that way because
A	you know
B	even even
A	you didn't stand up with your gob you stood up by being my friend
B	that's
A	and you stood up in a different way
B	I I guess that's just kind of how I use myself it's like I will always show support where it's needed
A	no it's who you are
B	not not only for myself though it's just for you it's for myself I'm not even capable of saying stuff for myself like when I heard
A	no and I understand that and it's like I mean
B	yeah
A	and everything was so perfect like you remember that little white board that we had?
B	yeah
A	like erm so and so in this flat
B	put all our names on it
A	love so and so in four 0 seven and it was so nice and then as soon as
B	not
A	no just not even
B	because I don't know if I told you this but
A	mm
B	got into the lift together and it was it was so awkward I mean I wasn't gonna say anything because well as much as I I don't have the guts to stick up for people that I love and stuff I have the guts to just remain silent so like I like I'm like my mum I'm very much like my mum I like to please people
A	yeah
B	whether I like them or not I like to be liked and that's one of my faults I I I need to be liked
A	mm
B	so that's probably one of the reasons why I always stay silent but when we go into the lift I didn't say anything and I didn't look in her direction and I was like this is awkward but I'm I'm staying silent I was like I don't need to please this person I don't like this person and she started talking to me and she was like hi
A	interested
B	like no worried like genuinely worried
A	mm
B	and I was like things could be better thanks like I was being short and I was
A	civil
B	I was proud of myself in that moment because usually I would be civil as fuck but to this person I just I felt like I owed her nothing
A	yeah we both do it's a habit yeah
B	but she was I could tell she was trying and I just wasn't interested and I was like this is my time to rectify all those times I didn't stick up for you like do you know what I mean? because
A	but I don't need you to stick up for me
B	no I know
A	but like in my head
B	and you're saying you're saying this now
A	in my head it's like
B	but at the time
A	I wanted you to but then
B	no
A	I think to myself I don't need anyone to stick up for me because end of the day I did nothing wrong I did nothing to deserve that the thing is with
B	no but
A	and that's all it were
B	hear me out like this isn't nasty at all you're saying this now but at the time I know you wanted to stick up for me I could see it in your eyes I could sense it in what you were saying even
A	mm
B	and that's when I tried to make a difference but I'm just I'm not that person no matter what someone does to me or as well as awful as it sounds especially to someone else because if someone does something awful to someone else as awful as it sounds they didn't do it to me
A	yeah
B	and I think in my head I have no right to be horrible to this person
A	mm
B	because of what they've done to someone else because no matter how close that person is to me or whatever I if unless they hurt me personally I physically can't muster that strength and that anger
A	yeah
B	to pull them up on it and I love you so much and I hope you know that
A	I know you do
B	I would do anything for you
A	of course I do of course I do
B	I hope you know that I just
A	er
B	I can't
A	I know
B	voice it
A	and I know that and I always knew that and like that's why I always stuck up for you not because of any other reason but I knew that you couldn't do it yourself and that's why I always
B	I can't do it for myself
A	that's why I always put myself out there that's why I always made it known that I was not happy with how
B	no
A	they were treating you
B	I'm sorry because I realise that
A	and I didn't do it for anything else other than I wanted them to stop
B	no because I think you need
A	doing what they were doing to you as well
B	you need to hear this
A	what they were doing to me
B	because half of the stuff that you've lived through with all of those horrible people is because of me because you've been sticking
A	it's not because of you
B	no listen it's because you've been sticking up for me and you'd always put yourself out there for my sake and defend me and I wasn't able to do the same for you and I'm so sorry that you had to live through all of that with the people and I wasn't there to stick up for you
A	do you know what
B	but I would always choose you over anyone else
A	I know you would that is
B	no I
A	but my point is
B	I know
A	you
B	I'm just sorry that I couldn't
A	what?
B	give you more
A	what? be angry at them make yourself a victim
B	yeah but I
A	or a target like me?
B	I didn't care what they thought that's the thing is like
A	I know but that's the thing you showed them that
B	I didn't care and I'm so sorry
A	don't don't seriously
B	no because you lived through so much shit
A	and so did you
B	I just hope you know that
A	the fact is that I stood up to them and they're bullies that's all they were that is all
A	through all this shit that I deserved
B	well of course
A	or didn't deserve you were there as my friend you're still my friend now you know? and you didn't have to be the easy way out would have been do what
B	I wouldn't have done that ever
A	exactly and that's your way of sticking up for me and being my friend
B	I'm sorry that I couldn't voice it is all I'm saying but
A	it doesn't matter
B	through you helping me and showing me that it's okay to stick up for yourself and it's okay to get angry at people it's not the end of the world
A	eh up then ginger
B	so because I had had quite a closed upbringing and was so different to your situation I just want you to know that you have helped me to find the voice that I guess I've always wanted to have but I've been too scared to voice if you know what I mean it sounds really weird but because what I lived through with
A	it is because I'm not being funny or anything but
B	but I think that's the worse I think that's the
A	it's the worst
B	it's the worst feeling I can have because I'd rather someone shout at me and me explain my side or me shout back than silence and I think you and seeing how the way you handle things and learning about your upbringing and just a completely different side to what I've ever lived through has helped me find it and this summer with all the shit that's gone through with
A	and I was I'm proud of you as well
B	and it was fine and as soon as I realised and I saw
A	yeah you worked it out
B	not even an awkwardness because she wanted to hear it and I was ready to say it it made me realise that I've got nothing to be afraid of by standing up for myself and that's because of you
A	do you know?
B	I had to live through this year of being naïve and being the sweet little shy girl or whatever to actually realise that life doesn't work like that you can't be nice to everyone and not everyone's gonna like you and I had to learn that but I learnt it from you because my parents have given me a sheltered upbringing and I have had that all through my life because I've never had to live through it do you know what I mean?
A	yeah
B	so like what I lived through with
A	yeah
B	and I'm gonna say you've lived because I know it was ten times worse for you than it was for me
A	I know what you mean
B	in the way that you want me to
A	do you know what? I hope you never have to
B	I
A	for my sake
B	I hope I never have to but
A	cos do you know what? like I
B	it's gonna happen all through life and it's gonna happen to me
A	of course it is
B	it's gonna happen to you it's gonna happen to everyone
A	the thing is like the thing that bothered me the most about the whole situation is that they didn't know me they was making all this judgements judgements about me they and from this one status that I put on Facebook that I deleted straight away which should have told them everything they should know I apologised to
B	yeah
A	and I made this effort and I've made this effort from September and blah blah like
B	no
A	anything they don't know me personally they don't know my likes or dislikes
B	but
A	all they know is what they see
B	having said that and all that you've lived through and living through that and
A	mm
B	rather than immediately defending myself what I do is I I mull it over it builds deep inside of me and then one day I snap
A	yeah
B	and I fucking I mean I fucking snap like no one wants to be there when that happens
A	mm
B	but
A	yeah
B	in that sense of things because
A	you just worry
B	he's
A	and it builds up
B	he lets it build up he
A	you're not bulimic
B	no I know I'm not but you know
A	I know what you mean
B	I inverted it on myself
A	I worried about you so much
B	but now I
A	when you told me that
B	feel like I'm I'm not gonna do that to myself anymore because it's not me that's the problem it was them the whole time
A	I'm so glad that you've you've told me what you've told me because like ever since you you opened up to me and told me that I've done nothing but worry about you
B	I'm sorry for doing that to you
A	no mm babe don't be stupid like
B	no there's nothing
A	and then ever since then
B	you can say to anyone
A	I know
B	when they tell you something like that like
A	but
B	I shouldn't have put you in that even though you are
A	no you're my friend
B	no but
A	if anything like that ever happens I want you to tell me like
A	don't no listen to me
B	you are my closest friend
A	don't ever feel like you need to be drunk to tell me shit like that ever
B	okay
A	because it just it I don't care whether you've got warts growing out of your fucking face whatever you problem you've got
B	I know it's just
A	you should come to me and tell me because
B	well
A	I might not be able to help but I can at least support you
B	I was so ashamed at it and the fact that it was happening and I was so ashamed that I'd gone back to that after having it happen before I was so ashamed at myself that I felt like the only way I could genuinely get it out was if I was drunk and I wouldn't have any inhibitions or anything but genuinely you are my closest closest friend and I would tell you anything
A	mm
B	and like I felt awful at the way I sprung it on you when we were both drunk we had no real way of dealing with it and I felt awful at the fact that that's the way it came out and I was like you deserved
A	it
B	more as a as my closest friend than saying that
A	it it doesn't matter how it comes out as long as you tell me that's all I ask like I can't help you if I don't know and like you can't help me I you don't know my shit and it's
B	it's happened exactly three times since I've been home and all of that was in the month of June
A	I'm so glad that
B	so nothing since July or August or
A	I'm so glad that you're okay though
B	a bit of September
A	cos ever since you told me all I've done is worry about it and worry about you and
B	well I feel like since I've been back in my home environment and I've been with
A	of course he is
B	but in different ways so like you are a very very
A	I don't think I'd compare myself to
B	my friends in France like I need you to know that like your opinion of me counts more than anything that
A	it's different it's different completely different
B	but I guess since I've been back with him and it's actually been me with him and it's not a limit the amount of time it's not a week and it's a good three months and it's a good you know of time
A	it's not even the same it's a nice environment
B	I've calmed
A	non stressed environment
B	I've calmed down and I haven't been stressed and I haven't had worries or since I saw my sister and it's been fine
A	peacocks
B	and like we make jokes about it but secretly I'd be dying inside I'd look at all those people and I'm like
A	excuse me hello
B	no I know you say that but people have different visions of their own bodies
A	yeah but
B	no but
A	like my weight
B	no
A	bothers me so much
B	shut up
A	and I can't
B	no
A	no but seriously
B	no
A	I can't even
B	shut up
A	begin to explain how much
B	no
A	how much it bothers me
B	you need to be quiet now
A	but how much do you think it bothers me
B	no I'm
A	going to the gym and seeing that seeing them girls like that?
B	I'm talking now I'm talking now you put yourself down so much but the thing is you always compare yourself to me and I'm not saying that in a nasty way
A	I don't compare myself to you I compare myself to fucking ridiculous things like celebrities and
B	I'm not putting you down by saying that but I know that you do it I see you doing it when I come in wearing an outfit for a night out and you're wearing yours I see you looking at me but the thing is
B	okay your shoulders no matter how much you're like oh my shoulders are too big shut up because you're not
B	they are perfect in comparison to your body and your boobs and your waist goes in so much and you have perfect curves in an arse it's like it's like looking at Iggy Azalea
B	but you have the tits that go with it
A	mm
B	and it's so irritating because
B	I've always wanted boobs
A	tits
B	but a bum as well because I know that I'm petite but I'm a kind of curvy petite
A	well
B	that's really weird because
A	it's not weird
B	most petite people's I I think of petite and I think of
A	you've not got small boobs
B	but it's all in proportion whereas mine I'm average I'm not gonna lie I'm average
A	mm
B	I'm alright but I've got the curves that go with it but not the kind of arse that goes with it
B	like everything's kind of just out of proportion with my body but that's the kind of thing that when you look at me you don't see my insecurities but it's the same with me I look at you and I don't see your insecurities because I don't know what the fuck you bang on about all the time
B	because I literally look at you and I'm just like what the fuck are you talking about now?
A	and I feel the same when you
B	that's what I mean it's like we have to start understanding each other rather than looking at each other and we're like just block it out because I'm not gonna lie sometimes when
A	same
B	I look at you
B	and I'm just like I'm just gonna sing a song in my head cos I'm just gonna look at you and put wiggle wiggle wiggle next to it
B	and just watch you look at yourself and just be like yeah
B	that's fine and then you turn around and look at me and I'm like yeah yeah I agree I'm just like what's she talking about?
B	have I agreed to having a threesome? what have I agreed to?
B	I just I need I'm making a joke out of it but this is dead serious
A	yeah
B	I need you to stop
A	I need you to stop
B	and hearing this from me okay
A	I need you to stop
B	I've gotten over
A	about your shit
B	my problems but I've lived through problems and I need you to stop before you get to where I was
A	do you know what a weird thing is? do you know up until
A	and then this one girl don't even know her name and don't even remember her Bebo name
A	she were on Bebo
B	I used to love Bebo
A	same yeah
B	oh bitch
A	and from that moment on I've been insecure
B	yeah
A	I don't even remember her name like
B	but there's a difference between being confident in yourself and being arrogant and being confident in yourself and being insecure you just have to find that balance
A	mm
B	it's like
A	everyone thinks I'm confident until I'm a friend
B	no
A	and then they realise that I'm not
B	that that's what I thought about you and why I was so
A	thank you
B	but I think one of the reasons is that I've always been pretty confident in myself like I have always just like not cared well I say that apart from a few hiccups along the way I've always just sort of not cared and I've been like this is who I am and no matter how much I diet and no matter how much I do sport my body just never changes
A	fake it until you make it
B	exactly
A	like you fake like
B	the same I would never ever think that about him
A	but how confident does he come across?
B	mm
A	because he fakes it and he's always said to me fake it until you make it
B	that's
A	that is his catchphrase like if you were
B	I've heard that
A	gonna be a TV show presenter that would be him
B	and fucking cheesy
A	no but seriously
B	I can imagine him as a sport commentator
B	on like a news channel it's like remember guys fake it until you make it
B	I can actually see him doing that
A	go like that and winking
B	yeah
A	like Anchorman
B	yeah
A	cos he's not manly enough
B	but no like I know we're all girls and we all live through it and everyone has their own problems and their own insecurities but as much as I'm such a hypocrite saying this because I don't actually believe it in myself but I will always put it out there
B	like to
A	she said that to me as well
B	and I'm not gonna be rude
A	yeah me too
B	but
A	I would never say that to her
B	I will always promote to her be like if you're confident in yourself guys will feel that guys will think it's sexy it only becomes a problem when you show that it's a problem
A	mm and voice it
B	exactly so it's like if you tell people that you are happy with the way that you are if you like you're happy the way you are no one will give a shit like literally no one will even notice
A	we should like go to the
