A	erm that's like raw beef it's quite nice
B	yeah
A	I can't go down
B	that's for main though what are you getting for starter?
A	oh for starter I think I'll get the salmon yeah or the beef
B	salmon? and then turkey?
A	yeah
B	I might get risotto
A	and then I'm gonna get the chocolate thing for pudding
B	yeah chocolate mousse honeycomb ice cream that sounds amazing
A	mm
B	although cheese I love cheese and biscuits
A	yeah but you can get cheese anywhere
B	yeah
A	they will be nice though
B	had mousse last night though
A	did you?
B	yeah did I show you the photo?
A	no
B	it's like erm
A	oh yeah you got pudding as well yeah
B	ah yeah it was like chocolate brownie with peanut butter and salted caramel ice cream this is like salted caramel sauce homemade chocolate and a comb with mousse in
A	mm that looks good
B	so good
A	I haven't eaten there in ages actually
B	yeah
A	it does look really nice so is your friend seeing anyone at the moment?
A	yeah
B	yeah yeah she's erm she's been with him for like four or five years I just get the impression that he's a bit sort of controlling
A	oh is he?
B	yeah like erm on what she like you know? she can't even have a Facebook account which is fair enough cos I mean Facebook does cause a lot of trouble but it's not for him to say do you know what I mean?
A	yeah
B	erm so yeah
A	no that's not very good is it?
B	no
A	I think yeah if he if she cheated on him then maybe you could understand it but
B	yeah
A	it's a bit odd so when's erm
A	have they sorted it all out yet?
B	twenty-ninth
A	twenty-ninth of?
B	December
A	oh really? well that's really soon
B	yeah I know I really don't know what to wear because I was gonna buy a new dress for the occasion but I mean
A	yeah
B	so I think can you wear black to a wedding?
A	yeah I guess oh
B	I just I didn't I thought you were meant to wear colours cos I might wear this or my blazer
A	you could
B	with my black dress I wore for the law ball
A	yeah that'd be nice
B	with my fake Valentino shoes
A	yeah if you like dress it up a bit with a nice necklace or something I'm sure that'd be fine
B	yeah I don't wanna spend money just to
A	I need to get a dress for my mum and dad's wedding
B	oh yeah what are you gonna wear to that then?
A	I don't really know yet
B	so er is that alright then?
A	yeah
B	okay and I'll wear the shoes I wore to the law ball
A	yeah yeah I don't really know what to wear at all
B	are you gonna go like proper fancy?
A	well I'd like to wear like a nice dress but I don't think my mum's gonna wear a wedding dress or anything
B	no
A	she'll just wear like a nice eveningy dress
B	I'll wear erm
A	no they're both nice I don't know
B	yeah yeah
A	I don't know
B	probably not white cos obviously
A	yeah
A	no I think she's quite open to colours really
B	ah
A	she wants to go on like a crash diet first though so
B	does she?
A	I don't think she'll be buying a dress soon although it's only February it's not that long away
B	yeah you'll have to go shopping with her
A	yeah
B	I need a coffee to wake me up a bit
A	yeah I'm feeling quite sleepy I don't drink tea or coffee though that's the only problem
B	I think I think I'm like allergic to caffeine cos it makes me really ill
B	like I love it I love coffee but I just get really headachey and feel like car sick with it and
A	mm
B	yeah
A	my mum gets really bad headaches actually
B	but I love it
A	she has to have like a coffee to get rid of the headache
B	what?
A	I know
B	that's a bit strange
A	it's not very good really
B	that is really weird
A	so where's
B	erm
A	ah
B	so that'll be really nice cos it's a nice er golf club isn't it?
A	yeah
B	I love it there
A	oh that'll be nice
B	yeah
A	yeah I wonder if erm if
B	oh yeah I personally like obviously I'd prefer to before I had a baby but I wouldn't while I was pregnant you'd wanna be like your
A	yeah
B	I dunno I'd feel a bit
A	yeah I know what you mean
B	I'd do it afterwards I think
A	oh my god I can't believe it a guy in my year his girlfriend's had a baby and they didn't even know she was pregnant
B	yeah that's insane you find you hear about that a lot don't you?
A	I don't know
B	like you go to the toilet and then just pop out a baby
B	like could you imagine?
A	I think it's like quite rare
[ANNOTATION]	most people are aware of their pregnancy	Entailment
B	yeah
A	but yeah it's in the news a bit
B	I feel like I'd know I I feel like I'd have some kind of inkling surely?
A	I know it's hard to believe really isn't it?
B	yeah
A	but I mean they'd they'd just got a house together and they're engaged and everything so I think it was like a welcome surprise but
B	yeah how long have they been together for?
A	oh er like just over a year so not that long yeah
B	so not long so yeah I feel like obviously I was with someone for seven years but I it annoys me when people are together for like six months and then jump into everything and then they wonder why it doesn't work out
A	yeah
[ANNOTATION]	couples who move in too soon do not end well	Entailment
B	but I mean I I
A	no no but at the same time there's like no need to rush into things I don't think
B	do you know what I mean? cos
A	why? how long have they been together for?
B	maybe like two years
A	mm that's not long is it?
B	but they've they've had a
A	yeah
B	and they're living together and stuff I don't know I mean they seem happy but
A	yeah well it works out sometimes
B	I just feel like I like I didn't show much like he's done the honeymoon period for like six months do you know what I mean?
A	yeah yeah
B	I just think people don't know the real
[ANNOTATION]	many people move in together after six months	Neutral
A	yeah well looking after
B	yeah
A	like it's really nice looking after them but it's lovely giving them back again
B	I kind of don't know if I want them ever
A	really?
[ANNOTATION]	speaker B wants a baby	Contradiction
B	well I feel like sometimes I do like when I think of names I'm like oh that'd be kind of nice
B	but they just annoy me
A	yeah
B	like fitting in with school the boring school routine like every morning you can't just have a spontaneous weekend away and just takes the excitement out of everything
A	yeah
B	it's just boring and mundane like I feel like there's a lot of good things out of it you know it's obviously a very rewarding experience but
A	yeah
[ANNOTATION]	caring for children is enjoyable	Contradiction
B	I don't know
A	no I definitely don't want children yet I want to go travelling and things I know you can take like children with you obviously but it's a lot harder
B	yeah not really well can you imagine in the heat and stuff them whining? I can't deal with that
A	yeah oh did you get that video I sent you of
B	yeah yeah
A	she's such a cutie
B	yeah
A	yeah when we were on holiday
B	see it is nice like in that sense isn't it?
A	yeah when we were on holiday she was just like recognising like word
B	yeah
A	the word letters and things
B	yeah
A	erm but yeah it's crazy how fast she's
B	would she
A	no no no it's crazy how fast she's come on
B	ah
B	really? oh wow
A	yeah yeah she's a little brainbox I think
B	yeah she is like the class clown isn't she?
B	yeah
A	I don't know how she'll be getting on at school on her first day I like took her in cos I we were down there which was nice
B	yeah
A	and erm straight away she was like out in the play yard bit and there was like this big sandpit filled with water and she like persuaded her little friend to start splashing in it so
B	what?
A	they got covered in water before they'd even started the school day it was quite funny
A	yeah they've sent us over a massive Christmas list of everything they want
B	what?
A	yeah
B	isn't that a bit cheeky?
B	cos I mean
A	really?
B	and I think that's really cheeky
B	like and and also like have you seen in America they
A	oh yeah
B	like you put they put it on your list or whatever what's it called? there's a name for it
A	oh I don't know but yeah I know what you mean
B	you know what I mean? and I think that's rude to let you
A	yeah yeah
B	I I think it's just what I I dunno I'm not gonna contribute to their holiday like if they can't afford to have a holiday then don't get married like
A	no you shouldn't request unless it's like erm money towards charity or something instead of a gift you can sort of understand that but
B	yeah
A	yeah
B	erm
A	yeah well I think that's fair enough
B	so yeah
A	I don't I don't think my mum and dad will be asking for any wedding gifts at all
B	oh it's polite though to get something isn't it?
A	mm they're all there now aren't they?
A	a log basket probably
B	where on earth are you gonna get that from? you'll have to google maybe Amazon they have everything
A	well
B	oh yeah
A	so she sent us this one that was like
B	I don't know where we got ours from actually
A	she sent us this one that was just like a black plastic bucket
B	what?
A	yeah and then this one that was like made out of fabric
B	you want a nice wooden one like you seen in the in the
A	yeah well we've had a wicker one for ages and it's been really good but
B	yeah but ours is wicker I think
A	yeah
B	it looks really like modern
A	but it's starting to break away now it's very sad
B	and a mop
A	how romantic
B	and he was like oh it's for the house you know? you said you wanted one and she was like yeah for the house but not for me
B	I would I would just be like what is this?
A	yeah
B	take your present back then
A	well my dad doesn't really do presents I think my mum just buys herself something and
B	yeah
A	then he gives it to her
B	I just find men really hard to
A	mm
B	mum's fine like I'll get her skincare or something but dad I just he doesn't use anything like we got him this really expensive like eighty pound leather like bag for work and it'd be really nice you know? to take his work in and stuff
A	yeah
B	and he just takes it in like erm plastic bags
A	well I think yeah men are just a lot more practical aren't they?
B	doesn't appreciate it yeah
A	yeah I never know what to get my brother he's a hard one to buy for got no idea at all
A	yeah well that I think that was more
B	unless you look on Asos in the
A	it was more
B	oh was it?
A	but then I think they're they asked what we wanted as like an afterthought I
B	oh yeah
A	for my birthday and Christmas
B	did you send them it?
A	yeah so that'll be quite handy I still haven't
A	yeah
B	I'd find that awkward
A	well they've got me pretty awful presents for the past
B	oh yeah obviously yeah
A	ten years so I think I
B	yeah
A	deserve a jacket last year was awful I opened it up and I'd got these pink fluffy earmuffs with sequins all over it I was like oh my god what do I say?
A	I was like oh thanks and then I think I sort of like just put it erm on like the side of the carpet
B	mm
A	next to
B	would you not know that she wrapped it for you?
A	well I don't they were obviously more suited to a younger
B	yeah
A	child like
B	she just got you that?
A	oh and some other things but yeah that they were the
A	it was awful
B	and my nan used to go to the market and get me like plastic battery operated airplanes and helicopters
B	I was just like I was like
B	my mum used to hate my nan's gifts it was so funny she used to give them to charity
A	oh
B	and then nan used to make it really obvious that she didn't like
A	did she?
B	yeah
A	why? what would she be like?
B	she'd just be like have you got the receipt?
A	ah
B	so
B	yeah
A	like she spent ages trying to find like a nice present in John Lewis
B	yeah
A	she got them like this like posh candle thing
B	ah
A	and then erm like this set of like pâté and like chutney and stuff she thought like surely they'll use that?
B	oh that's nice mm yeah
A	and then anyway a
B	yeah
A	and erm her boyfriend returned home with like all this pâté and chutney that
B	yeah
A	and erm he was like oh yeah they they they weren't really using it so they thought it might come in handy for us like that's so rude
B	did she say you do know I bought that then?
A	well yeah I think like they knew it was her like
B	why would you give it back?
A	I know to the person that bought it you
B	unless they forgot
A	no no they can't've forgotten
B	you wouldn't do that though would you?
A	I'm like pâté and chutney it's quite a
B	yeah that's a nice gift yeah
A	yeah and they could've always given it to someone else
A	and now she's like I don't have a clue what to get them like
B	why doesn't? yeah she should just ask him and get er him to ask or
A	yeah
B	something I used to do all the shopping for
A	did you?
B	and I enjoyed it but like he just he just never did it so I was like fine I'll do it cos it's a joint thing anyway so I just did it anyway
A	yeah
B	and then he was like all offended cos they loved it and like he wasn't getting any credit and I was like well you didn't help in the first place
B	so
A	oh I still haven't got a birthday card off my brother and
B	really?
A	yeah
B	that's awful like if you didn't give them one or something
A	I know yeah
B	all hell would break loose
A	I know I sent we sent them a Christmas card to
B	yeah
A	they'll probably've received that but they still haven't sent my birthday card
B	that's really bad
A	yeah I thought so it would've
B	yeah
A	I think they'd've quite enjoyed doing that too
B	oh well it's not worth it anyway
A	it'll be nice to see them at Christmas what are you doing for Christmas?
B	I'm going to the same place I did last year the
A	yeah
B	erm we're there for three nights like we got a good deal and like all the food's included so there's like afternoon tea on arrival and like carols
A	ah
A	yeah
B	er like a four course Christmas lunch and then like cheese and crackers and stuff
A	oh that'll be nice
B	and then on Boxing Day I'll go to the gym like I did last year and like erm get a massage and go in the spa
A	oh lovely
B	erm and we'll
A	yeah yeah
B	cos I have such a small family but it's nice for you with the girls isn't it?
A	yeah
B	but I don't have that so
B	yeah
A	oh my god I mean it's just it's like any other meal really like there's no need to get
B	there is a lot to do but yeah
A	so stressed out about it it just sort of spoils
B	I know that's why I insist on going away now because it was quite cold actually and we spent all that time
A	ah
B	and I was just like it's there's no point really it's nice to be waited on
A	yeah
B	we were gonna go back to New York like cos we er got a good deal but
A	did you go to New York at Christmas then the last time you were? oh wow
B	yeah like actually this was like a couple of years ago
A	I've always wanted to go to New York
B	two thousand and eleven or something?
A	yeah
B	something like that two thousand and ten maybe it was quite a long time ago
A	mm
B	but it was just amazing we went to the Hilton on Christmas Day
A	oh wow
B	erm and ice skating and stuff Central Park
A	ah lovely
B	but erm yeah I'll do it again
A	and was it really? was it really cold?
B	there was a snowstorm so like all the cars were covered up completely
A	oh wow
B	and we couldn't go to the Statue of Liberty that's why I wanna go back cos we didn't get to do quite a lot of stuff cos the weather
A	yeah yeah
B	all the subways were covered in ice
B	really?
A	for quite a long time she just said it was so cold
B	oh wow
A	like you just couldn't warm up
B	yeah yeah
A	in the winters obviously
B	yeah it's boiling during the summer it's like proper seasonal there
A	yeah yeah yeah
B	I like that having actual seasons
A	yeah
B	whereas it's just all cold here
A	and how much were flights to New York?
B	well
A	mm
B	it's quite a lot isn't it?
A	yeah it is quite expensive
B	that's why I was like kicking myself because it was fifteen hundred for a four star hotel right by the Empire State and flights
A	wow
B	for like four nights this year but obviously travel with like the whole ISIS thing isn't
A	yeah it is a bit
B	so
A	dodgy I was a bit weird about going to
B	well yeah
A	a likely spot for an attack
B	there's loads going on like there isn't there?
A	yeah
A	yeah like the building we went for breakfast in is like one of the really high  rise buildings so
B	yeah
A	they have like security scanners and
B	yeah
A	you know? like walk through scanning machines which is good
B	yeah
A	like it makes you feel a bit more secure
B	yeah
B	ah
A	just before
B	just
A	yeah just
B	she's probably quite young
A	I think she goes to the cinema and stuff and she went to the theatre with us when
B	did she?
A	it was funny actually
B	does she not get really bored though?
A	no no she was fine actually
B	oh right
A	yeah we went to see a play and erm it was a bit of an odd play actually it wasn't really for children it was like marketed towards children but it was a bit scary
B	yeah yeah
A	and they had like people like coming up the aisles like going over to the children and stuff
A	and
B	yeah
A	and left little
B	yeah I can imagine her yeah I can imagine her doing that
A	it was funny
A	but yeah they were both really good
B	yeah
B	yeah
A	a bit creepy
B	well I find that with erm what was I watching the other day? oh you know Wallace and Gromit?
A	yeah
B	I was watching that and it's actually really dark like I didn't really realise
A	yeah
B	I haven't seen it in a while for like for children to watch it
A	yeah
A	yeah a few like children shows are like that
B	Disney movies they're quite dark messages Disney movies
A	yeah I really want to see Krampus at the cinema that's like a Christmassy film
B	I'm sorry but Christmas is a joyous time not for a horror movie
A	yeah it'll be good
B	it's not for me at all
A	you're such a little scaredy cat
B	I hate horror movies literally watched House of Wax when I was like twelve
B	and I still have nightmares about it I really do not like it
A	oh my god
B	I find torture like chopping off limbs so unnecessary
A	oh yeah
B	like the James Bond movies have just got so violent there's no point like
A	yeah
B	I just don't get how people can do that to other people it's horrible
A	yeah
B	hate it
A	no I used to be fine with horror movies but they do scare me a little bit
B	mm
A	now it's like The Ring and stuff like that
B	some of them are fine it's just the chopping off limbs I hate
B	like you know? like Saw can't deal with that
A	yeah
B	but if it's just like I don't know
A	did you?
B	I was laughing the whole way through it was like
A	well some of them are just pretty stupid aren't they?
B	yeah
A	no I think we should go and see it
B	yeah no I won't be
B	no Christmas is meant to be like you know? health and oh The Holiday was on last night I was watching that
A	oh was it?
B	yeah
A	oh I missed that
B	it's my favourite Christmas movie
A	oh oh I love all the Christmas films
B	yeah oh I'm just gonna actually remind my mum to record Masterchef
A	oh is that on tonight?
B	yeah it's on every night
A	oh right
B	she's got
A	oh does she?
B	yeah
A	what's she doing with
B	well I don't know what the weather was like over there but they they trust us that much they've given us a key to their house how nice is that?
A	oh that's good
B	yeah
A	do they live in
B	erm what's it called?
A	erm
B	you know? just outside
A	I never drive up that way
B	thingy bridge
A	I really don't know
B	I really er my
A	it's not like
B	no no it's like just er just past
A	and not it's not
B	no it's before you get to
A	oh I don't know I'm not sure
B	yeah well they own their own business don't they? but it's erm
A	yeah
B	it's lovely it's so nice it's probably like eight hundred thousand
A	mm good grief do they just?
B	they have like a pond and
A	do they just have the
B	just the
A	mm
B	but that's doing well obviously as you know
A	oh yeah
B	so yeah
A	I'm still waiting for our free meal there
B	yeah I know well we get free coffee but
A	yeah free meal would be nice
B	I mean I don't know if we went in for dinner they'd probably give us a discount I'm sure
A	yeah
B	but erm yeah
A	ah so how often are you seeing her now? it seems to be all the time
A	yeah
B	well
A	mm
B	and then obviously when I'm home erm I'm only
A	ah
B	but yeah it's a nice little arrangement
A	do you think you'll get like a dog any time soon if
B	think it'll have to be when I move out because obviously the renting situation
A	yeah
B	so that's a shame
A	so did they say a definite no then?
B	she didn't no she just didn't get back to us
A	oh
B	so I assume erm you know? for the amount we're paying and like we're obviously really close like my mum buys them Christmas presents
A	does she?
B	like they're really close like they they meet up and stuff because
A	oh right
B	like her and her husband and my mum and dad like you'd think she'd you know?
A	yeah be a bit more laid back
B	yeah exactly she knows like we're not gonna do anything that's gonna oh well it's fine
A	oh that's a shame
B	I'll just get one myself
A	yeah
B	but she's so funny
A	ah
B	a little puppy came in yesterday erm to the
A	ah
B	she's a lovely dog
A	I really want a dog
B	mm
A	so have you thought about where you're gonna live next year if you stay in
B	er grad college
A	are you?
B	I wasn't gonna pay but I I think
A	mm
B	cos my internet's so bad I just can't really do you know what I mean? and er I
A	yeah is it expensive?
B	er I think it's just the same really as the dorms but it's it's a nicer standard
A	yeah it looks really
B	you've got the
A	is it quite new? the grad college?
B	yeah yeah I think so they've updated it yeah
A	yeah yeah I haven't been in but it looks nice
B	you know? it's a couple of thousand pounds more in debt than I already am so it won't make much difference
B	to be honest I probably won't pay it back anyway
B	erm
A	oh right okay so similar to mine then?
B	mm
A	what? and then you'll do your LPC after that will you?
B	well the LPC qualifies me as a solicitor but erm the masters isn't a full masters so you're paying for that with the element of risk that you might not get a training contract
A	right
B	so if I do a masters I can do anything with that and then if I get a training contract then they'll pay for me to do the LPC
A	yeah that's good
A	so you'll apply
B	so I think I'd prefer to do that really than the
A	you'll apply for the training contract before you do your masters will you?
B	yeah
A	yeah
B	but you have to do
A	yeah
B	it's a bit ridiculous
A	yeah
B	yeah
A	I'll have to erm start applying for assistant psychologist post
B	yeah when are you doing that?
A	well
B	mm
A	I think I
B	yeah
A	then we graduate in September so I guess like over the summer I can start sort of applying for things
B	yeah
A	and see if anything comes up there's actually been I I actually got two interviews like just I'd I applied for them like just before I started my masters cos I thought
B	yeah
A	well if I did get one
B	yeah
A	like I'd probably go for that instead of doing my masters
B	yeah
A	but yeah as soon as I started I got two interviews in like the same week
B	mm
A	it's just typical isn't it? like you
B	did you not go? no?
A	well no there was no point then cos I'd paid all my fees and everything
B	just yeah but you don't know though that you they could've said well we'll have you after your masters if you impressed them
A	no I don't it it doesn't really work like that
B	yeah
A	I think they needed someone there and then really
A	but yeah yeah it was
B	where were where were they at then?
A	I think one was in
B	mm
A	and then oh I think one might've been in like
B	oh you said that
A	yeah
B	oh right yeah would you move there then?
A	I don't know like it's a bit of a commute isn't it? but
B	yeah yeah
A	yeah maybe
B	yeah people like live in
A	I think
B	cos it's so much cheaper
A	yeah yeah
A	I think I'll just have to apply like everywhere after I graduate though and see
B	yeah
A	but there has there's there's been more jobs available round here lately I've noticed
B	has there?
A	yeah
A	for assistant psychologist posts
B	oh right whereabouts then? like round Edinburgh way or?
A	no round us like
B	oh right
B	yeah
A	like
A	yeah so it's looking a bit more promising really
B	I think it's improving now isn't it? cos
A	yeah hopefully
B	mm
A	we'll have to see and then I think a few people on my course are like gonna do PhDs but
B	oh yeah? do you not? oh no you're doing your
A	yeah well if I did a PhD that would be like three years
B	is that different to the doctorate?
A	yeah
B	would you pursue that if you didn't do the
A	no er I think if you want to do PhD you're kind of er wanting to go into
B	oh really?
A	yeah but the doctorate is for your clinical or educational training
B	oh right
A	so you're training to be an educal educational clinical psychologist so
B	yeah I would not want to be a lecturer
A	no
B	have you even got to
A	I'm not
B	oh is it?
A	but we weren't stopped
B	I might nip to the loo as well
A	yeah we weren't really stopped for that long were we?
B	no I thought it was gonna be half an hour
A	yeah
B	maybe it means like near the we have to stop
A	the train erm back will probably be delayed by a bit as well I think
B	I hope not cos it's gonna be quite late isn't it when we get in?
A	do we change on the way back?
B	I don't think so
A	no er I didn't think it said a change but
B	I think it's just direct
A	yeah you used to have to change at
A	we can just look it up on our phone it'll say if there's any changes or not
B	yeah okay
A	but I didn't think there was
B	I think no I don't think so I'll have a look but
A	is your mum okay to
B	yeah yeah
A	pick us up then?
B	that's fine I just didn't want it too late if it's delayed by lots it should be fine
A	yeah they generally catch up time anyway though actually
B	yeah
A	it's generally not too bad
B	erm would it say if there's changes?
A	yeah it should do you
B	just
A	yeah oh that's good then
B	we'll have a look nearer the time
A	yeah
B	er no he's got er oh no he's just handed in his dissertation for his er like fourth masters or whatever he's on
A	oh right
B	so yeah
A	oh what's this one in?
B	and then I think he's doing a
A	oh yeah
B	so yeah
A	so what does your dad actually do?
B	oh
A	oh that's cool
B	and then he like does health and safety and he lectures at times and stuff
A	oh
B	so he does quite a lot like it's quite varied
A	yeah
B	and he's in the labs and stuff occasionally
A	ah
