A	it's kind of like stags when they do it they don't eat for the whole thing and they have like a harem and they have to defend it from other stags so they have to sort of all their energy is spent on fighting and and having sex with the deer
C	so they don't eat
A	they don't eat and so it's as the time goes on it it'll get more and they can't defend their harem as well
B	and the ladies are in a separate cage from the men so
B	and there's like keeps hurling herself at the cage and trying to get a shag through it she's like his their own aunt
D	oh god
B	scandal
D	but mice
D	you know like mice can breed within like forty-eight hours of being born or something
B	really?
C	oh that's fucked up
C	shut up
D	like as a like child having hamsters and suddenly one day you've just got like sixteen hamsters
D	cos they're like go in the sawdust and then they all just start fucking breeding and then you like go to clean it out and there's hundreds of hamsters
C	oh that's making me feel a little bit sick
D	mice fucking
C	yeah
D	this one though is so funny this time lapse and this little mouse just going at it
D	it's like
C	I wanna watch that one
D	ah I can it was such a good documentary I watched it was really weird I was like staying in
D	and
B	sexy sexy one
C	hot
D	sex and I just googled sexy animals
D	maybe I
B	sexy animals
B	she like named all of the rats after cos she doesn't really like her dad or his family like
B	cos he's last
C	do you know what? I might drink that little bit of white wine I think I'm just gonna no I
B	the
C	the bottle I just feel like I'm
A	what about some red?
C	no no no
A	some grappa red drink
C	no no I just I just wanna complete the bottle
C	I just wanna I don't mind I just like
C	no I just wanna complete everything
C	I just wanna complete all the aspect
D	googling sexy animals is quite funny
C	I just wanna complete everything
C	yeah everything seems to be completed
B	that's turn in that's gonna turn into
C	I know
C	as long as it's yeah
D	there's loads of sexy animals
C	I don't wanna look at sexy animals you can't just search
A	the other week I kept searching erm
C	no
A	babies eating ribs
C	oh no I don't want anything to do with
D	babies eating ribs? that's so funny
B	babies eating lemons
C	man you can't just fucking google anything alright?
C	that's the rule
C	no
D	look at this look at this look
C	no
D	no this is fucking great
C	no I've seen them before
C	oh man that's so fucking
C	ah
B	millions on Youtube
C	I'm so tired I
A	the reds
C	oh I don't wanna watch any videos
B	but the lemon one is funny
D	I love baby humour like babies falling over and getting kicked in the head is the funniest shit
C	I don't like baby humour I don't like it I don't like it it's too closely related to cat humour which is boring
D	cat humour is hilarious
D	like
D	I always get into these situations
C	right
D	where I just like sit and watch like You've Been Framed and watch like cat videos on Youtube and like
D	erm and
A	I sent I sent a video to You've Been Framed
B	he feels he watches You've Been Framed he's like mine is funnier than that one
C	come on which one
C	we I was on that but I didn't know
B	really?
C	yeah hang on
B	you get two hundred and fifty quid
C	I never got any money for it
A	no only if it's your video
C	no no no no okay so what happened was in a dress rehearsal when I was
C	when I was ten right I was Dorothy in The Wizard
B	yeah
C	I was Dorothy in The
A	I've seen them all
A	he looks like an old man
C	and like I was and I don't really remember cos it was a dress rehearsal and I was really small
C	whatever but apparently like halfway through the the production the whole stage just falls over
C	and I'm at the beginning of I'm I'm at like the front of the screen going like
C	and then like they fucking sent it in to like You've Been Framed and it was on it but I didn't even know
C	I know that was very like I only found out like four years later or something I was like fuck
C	yeah big bucks that's right
D	fucking
B	what was he saying before? I can't remember you were well
C	babies ducks
B	and humour cat humour
D	oh no I have this like quite often I have this like way weird epiphany where I've been like watching not
D	and I'm like I'm genuinely happy right now and I genuinely had this thought like actually I could just be on the dole and just watch these videos all day and like be totally fine
D	I'd be like happier than I am now like working and trying to like do stuff that's fun and like dude I'll just get like a council flat and watch
B	like the guy in The Matrix who's like oh I'll eat a steak even though I know it's fake right? then you're essentially happy
B	do you know what I'm talking about?
D	no
B	when he gets put back into The Matrix then he's like I don't care that it's not real I just wanna eat a steak and enjoy it
D	I can't really remember what happens in The Matrix
D	but erm
B	erm
D	I am genuinely happy when
D	that or the other really funny the best thing in the world like like remembering childhood shit with your siblings
D	like I never laughed that much in my life when I have like no relationship with my brothers whatsoever but every now and then we're just like remember that time? and we're just like ah
B	yeah yeah
D	can't stop laughing
B	that's good
B	and
B	they're just like fucking like not
A	the thing is we is we saw a dad doing that he had two kids but he had one like lolzy one and one non lolzy one
A	he was just like following
D	just get like a Gopro on their like
B	yeah go on walk up there
B	try and get up that hill
B	and like waiting for it to like smash his face over
B	make a mm Youtube phenomenon
D	Gopro
C	that's brilliant
D	I came up with a great concept which is go bro just put the like cam on the bro it's like go bro just make him do broey things
C	go bro go bro go bro
A	but
D	I've
D	like bros that aren't like quite bros but they like try and be bros but they're not very broey
A	the most helpful website I go on for school is called Philosophy Bro dot com
A	no
D	that's pretty good it's like how to be a bro but
D	it's fucking amazing
D	it's like
B	what else do bros like? word up Plato yeah? well basically what he was on about
D	so great and so glate great
B	where's
B	he's gone down gone down where's he gone? fire?
C	I think he's like overwhelmed or something
B	is he or are we just being boring?
C	I don't know I think it's he's just like had a really long weekend and is just like
C	yeah
B	to you? to both of you
C	I wasn't CC'd in which is a bit which is just like I was like
B	embarrassed
B	why does she get to be angry?
C	because she's an angry person that
B	mm
C	so she works for she works
B	yeah
C	and when we told her she didn't like
B	yeah yeah yeah
C	she was like like you know
