A	oops when I when I went to the seminar on on
B	everyone does it though
A	I know but I mean there was only three of us at the time
B	really?
A	yeah but only me erm I don't know what the girl's name is which is kind of awkward erm and
B	what's her
A	erm
B	which one's
B	oh oh that one
A	and she's not the short one she the other one
B	yeah cos
B	she's the other one
A	erm both of them didn't turn up how can I speak with
A	and I was like you what? you what? I was sat by myself it was so awkward I had to sit in the middle of them two
A	I was sitting here and
B	uhu
A	and it was all just talking like all nicely close and I was drinking my hot chocolate
B	oh that's horrible
A	it was so awkward for me I don't know about them two but it was awkward for me and then
B	oh okay
A	thankfully yeah and then I don't know what her
B	I don't know
B	oh
A	yeah
B	as soon as I came into the the
A	yeah
B	she was like hello
A	oh my god haven't you?
B	no er like my friend I I can't I never say her name right
A	oh that's terrible
B	but erm erm well she was like oh you finally came
A	oh no
A	she noticed
B	I felt so bad
A	that is so awkward
B	I'm gonna I'm gonna come in like the past couple of weeks I haven't been coming in
A	oh my gosh
B	yeah yeah last week I was too tired I tried to go to sleep cos I went out the night before
A	er
B	I went to the
A	what on Tuesday?
B	on Thursday
A	oh right oh oh yes you're erm I forget your seminar's on Thursday not
B	mm
A	Tuesday oh yeah so you went out Wednesday oh yeah I remember that
B	ah so much drama
A	yeah that drama
B	you know what you should do? just pick it up with your hands and eat it
A	then I'll look like a bloody beast
A	my dignity
B	mm
A	I have stacks of salt
B	why?
A	I collect salt because my mum only buys low sodium salt
A	so I need so I need salt
B	what's low sodium salt?
A	basically it's not salt
A	because salt's sodium
B	who would do why would they do that?
A	cos salt gives you high cholesterol
B	mm hm
B	why?
A	I don't know man it's rubbish it's so nasty and I swear it lasts so long in my house
B	you know what you should do?
A	because no one uses it
B	you should just like
A	just throw it out the window I live on the ground floor she'll see
A	erm isn't that bad luck?
B	no that's over the shoulder it's good luck
A	oh oh it's good luck
B	I think so
A	and it think it's cheaper than normal salt as well
B	what?
A	like you know what's that salt company? is it
B	I don't
A	what is the salt? it's the red one
B	oh the red one
A	yeah
B	the really big one
B	yeah
A	we used to buy that one
B	it's
A	see see that's what I was saying
B	mm
A	yeah anyhoo so we have to erm get stacks of salt and everyone
B	is that a cloud?
A	yes it's rubbish
B	ah the internet
A	British British salt that's a British salt
A	mm
B	where like Ross got like salt water taffy?
A	what the hell is salt water taffy?
B	I don't know that's why I'm asking
A	oh
A	what is taffy in the first place
B	is it like a chewy sweet?
A	oh like oh yeah
B	guess what I dreamt about last night?
A	what?
B	sweets
A	sweets?
B	yeah like in some weird place you know like you know like there's usually the brother of the king who's like a bit mad
A	the brother of the
B	this was in my dream okay
A	okay right
B	and then he like brought me to this room and there was like this giant 3D map of this kingdom
B	and
A	oh my gosh yeah
B	like why revolution was bad so I was like am a part of the revolution? and my first
B	and I and then somehow like it moved to like in the streets I was just wandering around and then I saw this like that that same
A	hold on you was in the streets but it's a kingdom?
B	yeah like in one like one of the little towns in the kingdom I don't know how I got there
A	oh my god
B	and I saw that same man but he like climbed up this ladder in this garden and he was
A	wow
B	and I was like he was picking all the green ones off and I was like why aren't you taking the yellow or the red ones?
[ANNOTATION]	A man climbed a ladder.	Entailment
A	Saxa
B	oh okay is that what it's called?
A	yeah
B	oh yeah yeah yeah
A	oh yeah I know yeah
B	so he was like ah the green ones are the best and then I said why why are you here picking all like gummy bears off the trees? shouldn't you like be in your Hampton's palace
A	your Hampton palace?
B	you know like the Hampton's like in New York?
A	oh my goodness
B	but it was like a palace version
A	I don't even understand what happened at the end like? that was it?
B	I woke up I woke up my alarm went
A	you're really odd what was you watching last night?
B	nothing because our internet switched off
A	oh my lord
[ANNOTATION]	The alarm was set to wake him up in the morning.	Neutral
B	it was horrible so
A	you watched Jane the Virgin?
B	isn't it amazing?
A	what the hell's that?
B	basically there's like she promises to is to not to not have sex till marriage
A	yeah
[ANNOTATION]	Jane the Virgin was watched.	Entailment
B	she does
A	oh
B	mm hm
A	awkward
B	and she's engaged at the time
[ANNOTATION]	She's engaged.	Entailment
A	oh no
B	and the father of the baby that was the only chance he can have as a baby because he had cancer before so that's all the sperm he had left
A	oh no
B	so his scheming
A	oh jesus wait is this a show or is this a movie?
B	a show this is a show
A	oh my lord have mercy
B	you should totally watch it
[ANNOTATION]	The father had lung cancer.	Neutral
A	mm mm that is too much that's too much drama already
B	I know and oh my gosh they're together now ah
A	who's together now?
B	like the virgin and the father it was so cute
A	what happened to her fiancé?
B	he lied to her because the wife of the father was having an affair with the father's best friend and like the fiancé knew about it and didn't tell the virgin girl
A	hold on were they all okay with this little situation that was occurred?
B	what was gonna happen was like the virgin Jane she was gonna give the father and the wife the baby
A	I broke my fork
A	I've got a spoon
B	like she was gonna give them the baby it like
A	oh
B	she thought they were a happy couple
A	oh
B	but because they're not a happy couple
A	oh wouldn't that be lovely
B	like she got like like bad fiancé man cos the fiancé man is a police officer detective man
A	oh lord
B	and like he was looking
A	yeah
B	who the father's best friend is connected to so that's why he took a photograph
A	oh
B	and that's how he knew that the wife and the best friend man were having an affair
A	oh cos he's a druggie man oh no
B	yeah and there's loads of murders there's been like at least two murders now
A	oh lord
B	well I'm already on the seventh episode
B	because this is a drama
A	I can't deal with dramas you know it gets me like it gives me like anxiety
A	I get emotional
B	what would you do if you got pregnant right now?
A	right now? er oh I have to move to Mexico
A	my mum and my dad would be dead no I would be dead first then they would die of a heart attack
A	why?
B	like I I quote I will castrate him and then feed it back into his mouth
A	eh oh lord
B	yeah cos I like to pet my daddy's little girl
A	oh my god you're
B	that's just my dad like my mum
B	I don't even go there
B	it's scary mate
A	some craziness will happen
B	mm hm mm hm
A	and a job
B	oh yeah
A	oh yeah
B	oh yeah
B	I want to teach English abroad
A	oh yeah you did say that
B	and then probably I'll eventually
A	what do you mean English abroad?
B	uhu uhu
A	okay so wait what country do you want to start?
B	I'd like to go to Korea you know
A	I knew you were gonna say Korea
B	and like China and Japan but first I think in my first year I'll go to somewhere in Europe
A	yeah
B	so in case I get sea like seasick homesick I can just
A	seasick
B	come back and it will be cheap cos like a ticket out like to Asia is like a is like a grand
A	yeah it's so expensive
B	that's so expensive
A	my dad is trying to go
A	and of course he's going more places for like the same price and anyways erm but don't you have to speak those languages?
B	not necessarily
A	oh really?
B	like the company that I want to do it with
A	yeah
B	they advise that you just speak English in the classroom so the students have to learn English
A	that's really
B	but erm they said if you want to know
A	yeah true
B	like if I wanted like alcohol
A	of course you would say alcohol oh my goodness
B	like and wine or
A	so you think they're gonna have Haribos? I'm really hungry like I think I'm
A	no thank you not those gross potatoes I mean what is this? sweet potato and
B	because they don't have Haribos in the Philippines I found out
A	see I told you would they have Haribos?
B	I couldn't deal with that
A	oh my gosh you seriously are addicted to Haribos
B	oh my god
A	of course everyone should I love those ones
B	I don't like the red packet what's that called?
A	the red packet? Starmix
B	that's the blue packet
A	er oh yeah that is the blue packet
A	no I like the red packet cos it's got the little men
B	I don't like those
A	I like the white men isn't that funny?
A	that's actually the best flavour the white ones and the red ones
B	I don't like those I only like the gummy ones
A	no I do you know what a lot of people don't like them because they're like a soft hard
A	like they're hard but then they're soft
A	and eat them
B	no
A	I don't know what that mix was called though
B	oh ah I've got loads of them at home cos I you know have you seen the supermarkets? they have those big giant tubs of Haribos
A	oh yeah
B	I bought one of those it was for Halloween but no one came so I ate them
A	oh that happened to my mum she bought one but it was a green box and it had like Halloween like it was all you know Halloween sweets yeah we had to eat them all
A	yeah
B	okay
A	that's not good for my diet
A	they
A	they're
B	mm I have loads of sweets at home I only just realised
A	I'm sure you do
B	shall I send you a Snapchat of my snack corner later?
A	you have a snack corner?
B	yeah I do
A	oh lord
B	I'll send you a Snapchat of it
A	yeah send me mm
B	but I have a feeling when I get home I might just jump straight into bed
A	we have work to do you know we have well I have eight erm
A	deadlines
B	there you go
A	erm from now up until the end of January
B	I have
A	good come library with me
B	alright
A	we'll do some work
B	yeah I'll do
A	I'm doing my stylistics essay ah that actually scared me sorry anyways we're doing a stylistics essay
B	okay
A	and then we're erm going to do a no I wanna do an analysis like I've been you know writing all over it and I've got some points
B	oh can I
A	the one like you
B	no what parts are you studying?
A	erm
B	cos I'm doing a lexus
A	my bad
B	as long you do figurative language and syntax on lexus that's what I'm doing
A	okay I don't I don't know this one
B	oh
A	I do I only know this one and and them too
B	cohesion and coherence
A	no
B	they're mine
A	no cohesion and coherence is crossed out I can't do that I only know the other three
B	well what have you got for speech and thought presentation?
A	what do you mean? I've got everything in the whole erm there's a whole thing look it's it's erm there's a whole speech business here
B	but that's Wuthering Heights mate
A	yeah oh are you not doing Wuthering Heights?
B	no
A	what?
B	yeah
A	what are you doing?
A	oh oh shit box
A	mate oh sugar I thought you said
A	I thought you said
A	I thought you said Wuthering Heights
B	no mate
A	oh I am so pissed
B	well now you did all that work now you have to do it
A	yeah it's this one's actually quite interesting like it confused me at first but oh man yeah no wonder you can't do any speech there's no speech
B	no
A	oh there's a little bit at the end
B	so I told my friend to read like this chapter cos he did this A level and I was like where was it? it mentioned
B	and
B	looking for more decorators
A	oh lord
A	oh really? I thought
B	that guy's creepy as fuck
A	this sounds like erm you know people who say I'll redecorate your face
A	I thought that's what he was
B	oh that's oh I've never heard of that but that could work
A	you can use that
B	I could use that
A	yeah that's quite funny I'm actually really pissed
A	like I was ready to you know get together and talk about ideas we haven't go no ideas
B	mm mm
A	that is the same
B	no I I refuse to do Wuthering Heights
A	it's really erm I wanna read the book
B	but it's all about death isn't it?
A	you see it's quite a hectic book I had to do a I read the summary erm you know so I could get the background info
B	mm hm
A	and it's mad it's too much going on basically
B	does she die?
A	the
B	Cathy don't she die?
A	who's Cathy?
B	the girl
A	oh the woman yeah yeah Catherine dies
B	yeah and doesn't he
A	yes he does all that and he wishes her erm
B	that's fucking weird that's fucking weird that's fucking weird that's fucking weird
A	I know like he goes crazy okay let's let's look at this right basically at the beginning there's this man I don't remember what his name is
B	man
A	his surname I know what his surname is Mr Earnshaw that's it Mr Earnshaw goes to somewhere finds this little black boy called Heathcliff brings him back raises him with his two kids Hindley and Catherine Heathcliff falls in love with Catherine
B	but aren't they little kids?
A	yeah but when they grow up when they grow up they fall in love with each other they're like well tight
A	he erm Hindley's very jealous of Heathcliff because the dad likes Heathcliff better than Hindley so then the dad sends Heathcliff erm Hindley away to college so then now everyone's all bliss then thingy dies the dad dies and then Hindley gets the Wuthering Heights mansion so when he comes back he makes
B	wait what happened to Heathcliff now?
A	Heathcliff is the worker now mate he's
B	doesn't she see him?
A	gone bottom he's at the bottom now she's all about social
A	whatnots yeah so she forgets about him she starts hanging out with
A	I forgot what his name is
B	some bloke
A	this guy but his surname is important because they're gonna come up again anyway let's call him
A	because that's what that's what his mansion's called okay so she falls in love with him
B	why?
A	because he wants to take control over Thrushcross Grange
B	but ain't that weird like seeing like the girl you love with your brother-in-law?
A	it's very odd
B	but when they see each other all the time
A	yeah
B	unless they have like secret hanky-panky
A	they're four four miles away from each other
B	do they have secret hanky-panky?
A	no they're not she don't love him no more
B	bitch
A	but anyways so she marries he's she's gone he's back in the place by himself oh the
B	okay
A	and then he makes Catherine and the son stay at Wuthering Heights like they're prisoners there but I mean they can roam the house but they're like trapped basically erm also he's got Hindley's son when Hindley died Heathcliff got erm he assumed what do you called it? assumed custody of
B	oh
A	Hindley's son so now he's made Hindley's son become the field worker and he's uneducated so
B	man this is complicated
A	I know that's what I said it's messed up isn't it? right so so he's now the worker he's got his son and his daughter-in-law trapped
A	Catherine's both I think both erm Catherine's dad dies too so now Heathcliff's got control of Wuthering Heights and Thrushgrange erm
B	that place
A	mansion he's got
A	but then oh then he starts going crazy because Catherine oh I remember Hindley died because he was an alcoholic erm he starts getting haunted by the ghost of Catherine and he like goes crazy and then one day he just walks out into the what do you call it a marsh he just walks out into the marsh and dies
B	oh I've been to a marsh I fell down a hole
A	oh jesus
B	it's really quite scary
A	well he died
B	well he deserved it
A	but he did deserved it yeah he was a bit of a crazy man
B	that sounds really well complicated
A	yeah it is complicated but the thing is the person who's talking the narrator is either this man called Lockwood
B	oh okay
A	and then Lockwood's writing it in his diary
A	it wouldn't have made sense right now it makes more sense like I have more
B	well that sounds so complicated
A	like if you're reading it you oh
B	why do people always say then that Heathcliff and Catherine were like two of the great like literature's greatest
A	yeah
B	greatest love couple
A	yeah they were at the beginning that what it says
B	that sounds bull that sounds bull
A	their love was so passionate and so strong
B	but she winded up and married some other bloke
A	yeah I know
B	that's bull
A	I know
B	people say that er like
A	who who's got
B	people say that they're like a great no that
A	no he's odd
B	like Jane Eyre and Mr Rochester now they now they were a good couple
A	oh
B	and so okay people say Elizabeth Bennett and Mr Darcy but I prefer
A	who the hell is wait what book is that from?
B	Pride and Prejudice
A	oh yeah yeah yeah
B	Pride and Prejudice woman
A	I don't like read these books
B	no no no the best the best couple is Mr Tilney no no the best couple is Emma and
A	that's lovely
B	no but the greatest guy is Mr Tilney from Northanger Abbey cos like he likes
A	Northumberland Abbey?
B	Northanger Abbey cos like this girl I've forgotten her name I think it's Catherine
B	and like she she likes like horror and Gothic and then like she believes horror and Gothic is going on like she goes to visit Mr Tilney's place and she goes oh my god his his dad killed his wife
A	oh lord
B	and she like literally like follow a Gothic horror book and he's like no that's all in your head
A	oh no is she crazy?
B	and like notes from people like joking around but she doesn't realise they are joking around
A	oh no
B	and like so she she's really naive so she believes it at face value and he's like no it's okay but he likes her anyway he finds her really
A	even though she's mental
B	she's not really that mental she's like only a teenager and he likes that part of her that she's like really like naive and like cute and
A	you're really connected to the story isn't it?
B	I did it at A level like I will admit if I didn't do it at A level I probably would have hated it
A	well well I
B	Frankenstein?
A	do you like Frankenstein?
B	no I fucking hate Frankenstein
A	really? I never read Frankenstein
B	don't
A	I wanna read Dracula
B	I wanna read Dracula
A	like I love Dracula
B	didn't you?
A	no I didn't read a single classic book we read I think the only kind of classic book I read was
B	didn't
A	his surname's James something James
A	no
A	Henry James Henry James
B	who's that?
A	exactly but his he's like a really famous author or whatnot novelist
B	I ain't heard of him?
A	and it's like he's like really old his book was terrible it wasn't terrible it was just
A	erm
B	oh sounds boring already
A	trust me it was so dead I think we even wasn't meant to do that book I think my teacher did it by accident
A	yeah I'm sure it was that book that was by accident erm anyhoos it was basically I think it was about this girl I'm sure she lived with her mum
A	and he kept they kept on seeing each other you know courting and whatnot for a little while
B	like
A	no I think he did something or he I don't know something happened I can't remember it's so rubbish but something happened though and she decided not to marry him and the book ends with her growing old with her mum
B	oh okay
A	oh you're so silly that is not gonna happen to you
A	that was the worst book like I didn't I don't think anything was interesting
B	did you not like
A	the early nineteen hundreds
B	do you like a normal book like Great Gatsby?
B	nope
A	erm we did mm Virginia Woolf
B	you don't like Virginia Woolf
A	no and it wasn't even one of her classic novels it was a longer essay and it turned into a book what is that?
B	eighteen eighty
A	oh well I guess it is eighteen hundreds it is rubbish erm
B	compared to Jane Austen
A	mm
B	not my not my Jane
A	erm what else was there? what else did we we did John
B	seriously I've not heard of any of these
A	nobody has
A	that's why what are you talking about? that that that one was so difficult to read because and it was so like boring it was I don't even know but what was it about? basically it was about this girl who I think she lived with her dad
B	oh
A	he was on his bike or what not erm oh what happened? oh she basically met this guy on the beach or something
A	erm and then she had sex with him and then they never saw each other again I think
B	oh okay
A	that's the only thing I remember erm
B	wow wow
A	yeah I know that they
A	too much it's a bit awkward reading it with my er teacher as well erm and then she started getting sick and like she was looking gross and whatever and she went to the doctor
B	was she pregnant?
A	no she had HIV
B	oh
A	yeah and then she
B	did she not use protection?
A	no
A	I'm dying so you should die too it was so horrible what he was saying to her and erm and then she left the husband the the
B	wait why didn't the guy get HIV that she her boyfriend?
A	because they only had sex one time and then I mean he just didn't get it he was lucky
B	mm
A	I like it was a dead wedding anyways I think her mum I think she was estranged from her mum I'm sure she was
B	mm
A	it just had too much going on and it they always switched scenes and just character's voice changed like it was too much
A	yeah that was
B	I did Macbeth
B	Death of a Salesman
A	oh you're lucky Birdsong sounds dead
B	yeah
A	see you did good
B	Thomas Hardy's fucking poetry dead man
A	as least we all know about Thomas Hardy
B	erm and Browning's poetry Browning was amazing it was all about murdering people
A	oh lovely I do love that
B	it was great but Hardy mate get a grip what he's
A	oh so
B	the second year okay no
A	oh my gosh you have so much work
B	so so fucking pissed so I did Jane Eyre and Agnes Grey Agnes Grey is by the other Bronte sister that people forget
A	erm Charlotte Emma Emily Anne
B	no
A	how many did I say right?
B	Charlotte is the one who wrote Jane Eyre Emily Bronte wrote Wuthering Heights
A	oh Anne
B	Anne Bronte wrote Agnes Grey
A	yay
A	I remember her name was Acton Acton something when she did her
B	yeah I can't remember what else we did
A	yeah I literally have you read things
B	yeah
A	even Thomas who? Thomas Hardy
B	yeah
A	I've heard of him like have you heard of oh
A	Bloody Chamber?
B	all about like having sex
A	Bloody
B	well that and feminism it's all about this it's a feminist
A	oh course
B	what's the other one? it was like Bloody Chamber Frankenstein Northanger Abbey and another really bloody book Gothic book
A	oh oh right
A	oh that's fun
B	and another one did I really I I guess I didn't really like that one
A	obviously shame
B	yeah I really didn't like it so it's I popped it out of my head
A	oh my gosh
B	probably some
A	well you had too many you had fun
B	no the author was called Marlowe I can't remember what his book was it was about like a man who liked something about like wanting to live
A	forever?
B	something like that yeah
A	oh really?
B	I think it was about that
A	oh gosh
B	yeah like he made a deal with the devil
A	oh no
B	or something like that yeah
A	er oh
B	really good
A	that sounds interesting
B	but like he's the guy that people think wrote all of Shakespeare's plays
A	oh really?
B	yeah
A	oh that's fun
B	yeah I have all this useless information
A	but still you had fun
B	oh oh can't remember my friend's name who I forgot she's doing English lit
A	now
B	apparently they have to read a book a week
A	what?
B	yeah like they they got sent she said that last Thursday they got set a book to read and when she turned up to the week the
B	I didn't do that let's
A	no this is why I don't pick literature it was
B	yeah
A	and doing all those books I've never heard of in my life and you know I couldn't do it again
B	oh I I couldn't do that like I think English literature
A	yeah
B	it would take the fun out of reading
A	that's the problem
B	it would be like they would make me hate reading
A	and you have to rush like I hate rushing
B	yeah
B	yeah
A	I don't wanna make notes
B	yeah
B	because they don't want to over analyse as well
A	over analyse
B	it's like oh they're closing like the curtains the red curtains what does that mean?
A	mm hm
B	or the opening of the red curtains like some I remember reading that somewhere it was like the loss of her virginity
A	see
B	I know it's so annoying
A	stress I don't miss literature I think this
B	yes
A	like it's not too bad because when I'm looking at
B	yeah
A	which is cool erm and my
A	no
B	you know what you're gonna do your dissertation on?
A	I've no
B	no
A	lord don't say that what am I gonna do? I don't want to be an English teacher
B	no
A	yes
B	I was gonna like talk about how English words are
A	oh awkward yeah
B	I really need a Korean like do you remember
A	well you need to write like ten thousand words in that
B	yeah I know so
A	can you do that?
B	no I probably could of on K-pop
A	oh true that
B	mm
A	and then we have a little bit only a little bit of time left
B	I don't know cos like my friend
A	mm mm
B	they're already talking discuss and discussing dissertation ideas like
A	we're supposed to be doing that like I don't understand why
B	yeah
A	like ah
A	like I mean too much topics for stylistics I think it's cool I don't think we've had that much topics to do
B	no
A	for sociolinguistics I don't think we even have a topic what have we been doing?
B	during those research methods
A	we can replace the the beginning of the year what are you talking about? like all of the
B	I know
A	we should just come in
B	but I know I'm gonna start doing it during the summer cos shit
A	your dissertation?
B	yeah
A	yeah my friend
B	wait they don't do a dissertation I thought they did like a special project?
A	yeah he's going erm to er teach a school teach at a school that's what he's going for a couple of months or he said he's still got a thousand word seven thousand words due
B	oh no
A	yeah I think he really said he's got to or if he doesn't do his project that what he's got to do instead
B	oh
A	I mean having a dissertation in maths oh seven thousand words by December
B	yeah you've got to start that shit
B	I know but we'll also have other classes at the same time
