C	I got really really passive aggressive with a baby the other day
B	like what did you do?
C	no not with the baby with the parents I was at the
A	why of all the carriages?
B	oh my god
C	they should make
A	baby carriages
C	I think it's the same on planes as well
A	it's just like this isn't it?
C	fuck first class make a crèche class
B	yeah
C	or babies are only allowed on planes at a certain one flight a day
B	no it's like this isn't it? have a crèche class
A	all those people the people with babies sit at the back or something
C	no it pisses me I
C	so they put the baby in front of me
B	so you had
C	and I like honestly I had a twenty-two hour journey with this baby just
B	what's your worst flight experience?
C	this got worse basically actually you know what this I had quite a few bad ones this was bad like basically the baby threw everything at me I'd wake up just covered in like whatever it had
B	oh my god
A	like why didn't they swap why didn't they swap with you?
C	and then the parents I have no idea and they'd like look at me and like you got to be like you can't turn around and be like your baby is fucking horrible it's not cute anyway and then so we had to change in
B	oh man that's bad
C	once this is actually the worse I still have now comprehension how this happened I was getting a plane to
C	so then I had to oh that was a really bad plane experience but the worst one of all time is I was going to
B	yeah that's
C	jamming it
B	people do that with the touch screen it's like it's like you do not need to touch it that hard
C	yeah it's like it's called a touch screen like you don't touch yourself that hard do you
B	not poke poke
C	not the
A	did you why did you say anything to her?
C	no I just kept looking at her
A	you got to say something on planes
C	oh plane journeys are always terrible I hate I hate it
A	I think they're funny man
B	I used to love them but now
A	that's the best bit man
C	I used to love it cos it's just like it's the best bit
B	the best bit of life
A	the one our one to
B	yeah it was fine
A	especially when they were
C	I never had I never had like do you know actually the worst ever the worst ever I'd been to
B	oh my god
C	and I woke up and her husband was like looking at me and I I freaked out I was like I'm so sorry I really apologise I'm like so sorry but she was like and I just feel straight back asleep and woke up again in the same
A	I did that on the way to
C	the
B	yeah no no I haven't seen it
C	it's the one where like the girl gets her like legs eaten off my a killer whale
B	I watched it on a bit of that one plane actually
C	oh my god it is like Marion Coutillard or whatever she's called and I woke myself up by doing I was really drunk it was in
B	yeah
C	what's it called?
B	DVT well that's the official
A	actually I have had a bad one
B	what?
A	when I went to from Heathrow to
A	and like I was woke up and I didn't have any hand luggage or anything and I couldn't they were so fat I could literally not like couldn't get the attention of anybody
A	and I didn't there was no TV on the plane there all the magazines were in Spanish I didn't have a phone I didn't know what time it was but I didn't know how long I'd been on the flight or anything I couldn't work out I was like had nothing to do I didn't know how long it was going to go on for and I was just stuck there between all these fat people like staring at the back of a plane seat like doesn't that sound bad to you?
B	yeah that sounds awful
C	yeah that sounds pretty bad
B	I had one that was really bad but it was kind of lolzy after a while I had a kind of if you can't beat them join them attitude I was like oh well better to enjoy it where like there was like a couple and they were quite chubs and erm they pulled down this like when they get on the flight they like immediately got out this massive like M and S like bag stuffed with food and I was like oh sweet they bought food for their whole trip it was like no man they ate it all on the plane
C	cheesy dizzles
B	all these like weird snacks you know and erm anyway the guy had a er Ipad and he was playing Fruit Ninja and he he was just sat there doing this like the whole trip right and I was like
A	out
B	and after a while he was just like I know right? after a while I was just like yeah man good
A	I went I went on a quite bad one to
C	no way
A	and like by the time we got on the plane people could barely walk like half the people on the flight were like wasted
B	oh my god I had a really funny picture there
C	being an air hostess must be the worst job in the world
B	I think some people really like it but yeah I agree
A	I think it I think it was it's got he's like
C	yeah it used to be like quite glamorous in the seventies
A	do you know that guy that
B	Ryanair people it's just like you work in shop
A	my mum's you
B	yeah
A	he was talking when he was over once his dad was an air pilot in like the seventies and they used to go to
C	yeah
A	and he like was based on New Zealand or whatever so every flight was long and
C	that where most
A	he was in New Zealand yeah
C	cos there's like loads of land to fly over
A	they used to do like shit loads of smuggling
C	really?
A	like cos they had a had a memory of his mum like sewing in the pockets to like stash gold in into the dad's flying jacket and when he put it on he could barely walk cos it was so heavy with gold
B	it's like gold lining I was on a flight once in erm something happened to this lady like she got sick or whatever but I couldn't quite see but it was like in front of me and em that thing happens which always happens in cartoons where the like air hostess goes on the voice on the voice over and she's like is there a doctor on the plane? is there a doctor on the plane?
C	I've been on a plane where that happened
A	I have
B	yeah so then this guy is like er I'm a doctor and like she's like are you? and is like goes over like I couldn't see exactly what was happening but like he like leans over he's like there for a while and then he goes back to his seat and then she goes to is there another doctor on the plane?
B	and some guy is like yeah I'm a doctor it was funny he was able to help
A	yeah I might next time someone asks that like me
B	are there any more doctors on the plane?
A	doctor of philosophy
B	yeah
C	did you did you see that Derren Brown when he like there was this guy that was terrified of flying and he like it was over a really long period of time and then he like hypnotised him and then he got on the plane and they faked like an emergency on the plane and they hypnotised him not to knocked him out and put him in a flight simulator and he had to like land the plane it was really amazing like so they like hypnotised him and then like they're like we need someone to like
B	and then he wasn't scared of flying any more?
C	but apparently like he didn't it wasn't to do with like to overcome his fear of flying
A	probably just make it worse
C	it was just like a TV show
B	that's crazy
C	have you ever thought you were going to die on a plane?
B	no er a couple of times I've been like er you can you know when it gets like
C	I've been yeah
B	I've never like really thought it though
C	I've got like shit scared where it's just like dropped and like turbulence I've just been like fuck
A	my brother's too scared to go on planes
B	ah
A	there's another story about erm when Justin Bieber took his private jet to the Super Bowl his pilots had to get their oxygen masks to come down cos of the when they were flying so they could weed smoke on the plane
C	JB JB
A	now now he can drink legally it's gonna be crazy
B	when can you drink legally in
A	like I can drink in
A	I'd forgotten it
B	my friend just looked at me like what? are you fucking kidding me? how old is he?
A	but the funny thing about that is actually forgot it after all that and when I went downstairs to the
A	like I'll be back later to get more and I'll bring my ID but I've just got to go now and the guys like okay er fine
B	oh he said okay yeah fine
C	that one's ours
A	that one ours
B	that one's ours
A	we drank a hundred Becks a hundred bottles of Becks
B	we drank so much Becks man Becks on the beach
A	the whole
B	Posh and Becks
C	are we near the beach now? look at those colours
B	looks pretty beachy
C	beachy
A	it looks nice down there
B	look at the graves graves graves end innit
A	they're all bent over though
B	cos they're old
C	quite a sparse grave yard innit?
A	it's pretty remote
B	it looks like giants
C	it's where they put all the yeah tall people
B	extra leg room
A	there's a really funny Curb Your Enthusiasm when they have an arguments about that who's going to be next to who in their plot
B	yeah I don't want to be next to you for eternity
A	oh yeah and he doesn't
B	yeah that random chick whose like the alcoholic erm alcoholic chauffeur's dad who died or whatever
A	oh yeah that's so funny when he becomes a limo driver
B	I know cos I can read it on the thing
A	not everyone can read though
B	erm what
A	not everyone can read
B	especially not those kids you had to teach erm do you reckon there's a coffee bit on this train?
C	yeah but I think we're nearly there
A	that's the that's the end no we came through there didn't we?
C	oh no that was the toilet
A	yeah we walked all the way through no we've got an hour left
C	we've got an hour left?
A	yeah
B	what?
C	nah
A	it's a two hour train innit?
C	no
A	yeah we only stopped at three places like two pages of stations
B	what?
A	see what time it is
B	I want a snack there is coffee there
C	I want a coffee
B	where's the coffee man?
A	I want coffee go and explore a bit
B	you can't have a train this big and no coffee
C	oh yeah it is an hour left if you find coffee can you get me a coffee?
B	yeah I'll get you one
A	get the window seat
C	got a window seat I thought
A	I think we are I think we're just going to like dawdle our way the rest of the way
C	yeah like go along the coast
A	yeah
[ANNOTATION]	Person A is going to have a sandwich	Contradiction
C	from everybody off school bus
A	Kent is next to Devon right?
C	I don't totally not totally not
A	is it next to it?
C	London
A	and then what what about on there?
C	I don't know let's have a look oh let's have a look
A	we're going to
C	see we are right by the beach
[ANNOTATION]	Person C had forgotten about the social security	Contradiction
A	yeah that's the ocean over there
C	shit
A	let's sit over there man
[ANNOTATION]	Person A offered him to sit there	Neutral
C	get a sea view
A	what can I do with this?
C	yeah
A	well we it'll be nice to look out the window though
C	you know what though you can get the train from
A	yeah we stopped at
C	did we?
A	yeah it's a slow one I think that's
C	up at
[ANNOTATION]	Person C is going to have a sandwich	Contradiction
A	but it's so unlike her though
A	yeah I guess more like
A	it looks well good
C	the sea is pretty cool
A	look at the cliffs
C	yeah cos we're gonna it's all like the white cliffs innit like Dover and all that
A	that's why people call it
C	oh really?
A	yeah it's the white cliffs so like when the Romans come they decided to call it Alpa
C	interesting
A	is this the train line that got totally fucked in the storms last?
[ANNOTATION]	Person A is asking about the train like that goes in the storm	Neutral
C	no that was in Devon it's like
A	we should go there as well that's what's good about having a car you just go anywhere like England's a small country
C	yeah and then you just like sleep in the car
A	yeah you know I'm convinced that people you know those
C	yeah
A	I I think whenever it
[ANNOTATION]	Person A said that he convinced that people	Neutral
C	I like loads of times I got Zipcars it just stunk of weed or people just like dealing weed you know cos it's like you're not going to get the number
A	yeah take prostitutes in there and stuff
C	doing like massive drug deals yeah
A	yeah
C	totally like moving shit around like if you get caught you can just leg it and like not last summer but the summer before I went to so many places and just like stayed in my car
A	yeah
C	drove all the way to the the
A	you can sleep outside as well if it's hot
C	yeah we stayed there's this really amazing beach called
A	and you go through the drive up drive in to like Europe and you can go anywhere
C	yeah I've never really I've driven I like driven in Europe but I haven't driven like across Europe
A	yeah that's like when I was younger my my dad went to a holiday where we just like drive to
C	yeah
A	bit boring
A	yeah it sounds good
C	no?
B	no nothing on this train
C	you see you see
B	are we on the right train?
C	yeah
A	yeah
C	it just like goes around the coast basically
B	it doesn't say
A	I'm sure it is
C	devotion
B	they didn't say
A	it is to
B	they didn't say
A	it did it did earlier
B	they said
B	I checked
C	checked it
B	er
B	are you sure it says
A	yes I'm sure
B	I don't mind we can go somewhere else as well
C	apparently
B	let's go there
C	it's not going to it's not going
A	it doesn't say
B	yeah obviously
A	it is it is
C	we got them but he checked our ticket
A	we didn't we didn't we didn't get on the wrong train because its twelve thirty-seven and it said to
C	yeah
A	when he just
C	yeah it definitely says this is the South East service to
A	let me see that map
C	and
B	yeah where's the sandwiches? that's what I want to know
A	I reckon it I reckon it still goes to
C	yeah I reckon that's
B	no way man
A	alright I bet you a fiver babe
B	well when's
A	well
B	yeah but if it was stopping at
A	not necessarily that could be wrong
B	what does this say?
A	cos that's the map
C	yeah
B	no did you?
A	no
B	that's that then
A	have they got an Apple Store in
C	probably they've got a Primark
B	shall we just go somewhere else?
A	what do you mean you want us to go and get off?
B	no I mean if it doesn't go to
A	it goes to
B	what? no
A	we're on the train that goes to
B	well maybe let's check it
A	fiver
B	but I don't want to go to all the stops to find out why don't we just check
A	cos I know for a fact
C	next stop we'll get off and see what it says not like off just go to the door
A	I can see that going wrong
C	I'll just poke my head out the door oh sick look at that tunnel we just came through right through there
A	we definitely
C	yeah
A	anyway so are we doing a bet?
B	uhu I didn't know train tracks could go down
A	do you want to do a bet? makes it fun
B	mm
A	why not?
B	what are you basing it on?
A	I base it on my sense of certainty
B	yeah but I just want to find out you know
A	I'll find out if you do the bet
B	no
A	we got on a train at twelve thirty-seven to
B	I've got no reason to think that there's like to strongly believe that we're not going to
A	there should be an app for what train am I on?
B	yeah
A	he definitely said it out loud
B	he might have said
A	no cos I was listening
B	when at the beginning?
A	yeah
B	did we miss it?
A	and even if we go up
C	we're going through another tunnel
A	we'll go on a boat get seasick
B	mm mm
A	it's what is this?
B	mm?
A	what is this?
B	they wouldn't let
C	why not?
B	too drunk
B	I always get ID'd at that Weatherspoons
A	not old enough
B	it's like I run a business
A	I know
B	I know these guys
A	I was like
B	it's hard to get into Weatherspoons
A	when
B	yeah
A	it's like in his eyes
B	erm actually on that very same Weatherspoons when I was leaving to go to
A	did she get in?
B	yeah
A	oh man is it going to be this slow all the rest of the way?
B	so how are you going to find out
A	wait till we get there er I'll go on the app
B	I think any of these towns will be these little places will be lovely
A	I don't want to go to I want to go to
B	check if it's going there then
A	what are you on about?
B	oh never mind oh well
A	we missed the stop
A	yeah
unknown_female	it is definitely going to
A	yeah thanks
B	thank you
A	can I have a fiver now?
B	no I didn't bet you on it I just wanted to know for sure
C	now we know
B	I know better than
unknown_female	alright
A	can I have a fiver?
B	you wish man no way
A	the fact that I was going to do a bet on it should have been enough
B	it was
C	people are really into fashion
B	you're well you're wilfully surrounding yourself by them
C	by them? oh
B	by them
C	not wilfully I just need to have a job oh god it's so it's like the most boring shit in the world
B	obviously and it's retarded
C	everyone's really thick
B	and they really really care about nothing
B	I mean they do
C	I think it's just cos it's it's really easy
B	some of the most like highly strung intense and angry people I've ever met it's like you're talking about nothing
C	that's the thing it's really easy to talk about oh my god did you see that and it's like yeah it's amazing it's so cute and you're just like and they get to like speak any like all you can talk about is like an understanding of why they did something you're like that's like that because of that but there's no like there's nothing deeper than that obviously there's like massive like cultural social shit addressed but they never obviously engage with that
B	yeah yeah
C	like did you see that Celine thing yeah it's like that Alexander Mcqueen thing last yeah
B	yeah but did you see Madonna fall over?
C	I met the girls that pulled her cape off
B	no way? what happened to them?
C	apparently she was just totally chill about it she was like oh don't worry
B	no way
C	yeah cos we were doing this film with these like
B	that's not what I read
A	what happened to them?
C	no we're doing this film with like these like Japanese lesbian couple that are like they like they're like voguers and they Madonna recruited them and cos they were over here they were over here doing that and then we like
B	that's who pulled the cape?
C	well they were part of the crew of dancers and literally they just
B	she didn't care
C	apparently she was just like it happens
B	wow Madonna zen it's all like Kabbalah innit?
C	yeah it was really funny I was hanging out the other day they came to like say hello at the office
B	mm
C	and there's like one that's like the dominant one and then this other one because they're like Japanese everything is like so over the top so the dominant one like literally looks like a like erm what's it called? like a
B	S and M
C	like an S and M like mistress or like a maid or whatever like a dominatrix
B	yeah yeah yeah yeah
C	and the undominant one like had a teddy bear
B	wow
C	and she like pulled her round and then they like you know like have you been to Japan?
A	no
B	no
C	there's like quite a thing like there's a lot of like older
B	makes them tea?
C	no she just like looks after them it's like having a family member that travels with you or whatever she's so cute and she was like obviously like in like her mid forties and she and you know Japanese people love whisky and every she made us take so many photos and she'd be like whisky
C	and but you know and she wears like she had three baseball caps on
B	what?
C	yeah and like a massive backpack and like a huge like oversized like Mickey Mouse jumper and like huge trainers that were like snow boots
B	seriously?
C	it was so funny and she's like I am godmother
B	what?
C	it was so odd
B	what were you doing with them?
C	and then
C	anyway
C	and he's like
B	yeah take care of that
C	got it got loads of Coca-Cola Zero
A	castle there's a castle
C	no friend's one's in
B	where's
A	I've been there
C	dunno
B	where is it? in
A	that's where that's where the house at
A	when I was a kid I used to go to a house there
C	yeah that's what's it called again
A	yeah
C	yeah my brother's like best friends with her
B	how weird
C	she's got like stuffed monkeys in her house and stuff
A	yeah it's weird it's weird I quite like it's like
C	whose house is
A	yeah
A	no don't tell him that cos he'll tell
C	I don't even know
B	what did you pee in
A	I don't know
B	a corner
A	I got lost
A	a moody cat there was a cat as well
B	frightened
B	actually there was some confusion being caused
B	let's go there but I bet it's closed on Sunday
C	I've been there on Sunday
B	yeah I mean I don't I don't mind going wherever
A	I want I want I want to go to
C	let's got to
A	I haven't been there
B	he's never been he's never been
A	I've never been to the other place either but
B	I've never been to any of them
C	I've been to them all
B	done them all
C	see this is what you can do when you got a car man went to all of them I went to
C	honestly I went and then went to find somewhere better but can't find anywhere better went back got to be somewhere better wasn't
A	it's like when I
B	it's true
C	is
B	I really liked it I really liked
C	I was thinking of going
B	but I oh it will have changed a lot recently you know I don't know what it'll be like now I
C	the thing is Thai people are really savage
B	no Thai people are really really friendly Chinese people can be like tougher Thai people are very calm and like there is like Buddhist culture and it yeah
C	but that whole like
B	they've got a very mild manner it's really striking in
A	did I tell you that I think I did tell you erm my friend
B	yeah this is funny
A	and he brought his wife back to
B	the other one did speak English
A	and he just thought no one would
A	so he probably was like obviously never really his wife at all just like his
C	my housemates dad just moved to
B	is this that girl
C	no this is
B	you've lived with so many people
C	I did not understand the extent to which like British and the US military use like mercenary forces
A	yeah
C	and they've basically like
A	yes I like my mum has a friend who used to be a ABC correspondent for Middle East and had all these connections and was friends with people like Imran Khan and we like go to lunch at his house there's always like mercenaries and stuff this one has got a private army like twenty thousand people who are like they're getting paid so much money
C	I think it's like certain people enjoy killing
C	no we won't be
A	can you get good fish?
B	I don't know I've never been there
A	that's good I mean like fish and chips or
C	I well wanna get fish and chips
B	there must be so many
A	I want to have a snooze on the beach
C	yeah but it's cold and stuff
B	it's cold and stuff last time we went to
C	it was so funny
B	I go one the train and like just fell over straightaway
A	it was pouring with rain
B	it was so rainy we still had so much fun though
A	while it's called
C	we just went to a pub then that's like
B	we went to a bunch of pubs walked around in the rain heaps ate some dinner and then we got to stay at this place and then the rain stopped and we went down to the beach
A	we nicked the we nicked the balls I already told him like I was like it's so unlike
B	no it's not it's not like me it's really not erm I did do it though
A	while while she's booking you a cab
B	I did do that however it's not it's not it's not the kind of thing I normally do anyway so then we went back stayed at this like cheap hotel the night
A	stayed at Premier Inn
B	stayed at Premier Inn and erm and then the rain stopped and we went down to the beach and we saw shooting stars and went in the water and it was really nice
C	did you go out cos you know at
B	it was like torrential
C	to like where they've got the like like big poles in the water and there's like a platform so they're like really far out but I think you can stand up on them in the middle of the ocean
C	we
A	you didn't go in?
B	I did
A	oh yeah you did
C	night swimming is really I love night swimming
B	yeah me too
C	have you seen that crazy like erm kelp that they've just discovered?
B	no
C	that like basically it's like erm florescent so like if a fish like swims passed it all like illuminates it's really amazing
B	like by phosphorus
A	we went night swimming right like in
B	oh yeah ha ha we went night swimming in
A	you were fucking wasted
B	wasted and erm went in and then like I don't know what it was like man or war or some shit but like some crazy like jellyfish like stung me
C	oh shit
B	it was like I felt like my legs were being cut off and we just like walked a bit
C	did
B	and then we like ran out like screaming I had these like welts went to the pharmacy and like to see if they could help me and he looked at my legs he went hey Madonna
A	I think it was actually lucky you were so off your face I think if you were sober it would have been like a lot worse
B	why? more painful?
A	cos you remember how drunk you were? until we made friends with the people who owned the restaurant and they just
B	I remember that
C	I hate Ouzo
B	I remember having the hiccups
C	I've never been to Greece
A	it's good
C	I was meant to go to
B	I really liked it
C	I hear it's really good to go like yachting in like
A	yeah my friends they did that in
C	yeah just swim in
A	and they
C	yeah the problem is all I want to do is go on holiday and just
B	we're all gonna run out of battery do you know that?
A	do I know that?
B	did you know that?
A	yeah I'm used to it man
B	you're like what is battery?
A	can't wait to try and fix this
C	what? you can't wait to fix it?
A	try and fix it yeah I'm trying to fix the screen myself maybe as well
C	it's well easy to do it actually like
A	apparently they
C	oh really? I had to fix my whole laptop just like Youtube guides
A	yeah did we send you that? did we talked about the one we saw for fixing the bent one
C	you sent me something but I haven't watched it
A	they're just like stoned and they're doing a tutorial video
B	they're really funny
A	they are funny they are funny
B	ow
A	ow
B	yes it's hardly at
A	still like forty minutes
B	it's
A	it's still a long time to go
B	what?
C	we've got half an hour still
A	if we took the other train
B	but the other train was stopping at
C	we'd have had to wait for an hour but we'd be there now
A	really?
B	no
C	yeah oh no we'd be there
B	we'd get there the same time
C	yeah we'd get there at the same time it's just less time on the train
A	you're not going to run out of battery cos you have like seventy why does it go down so fast?
C	yeah its looks like
B	it's funny it is
C	why?
C	I didn't know it was International Women's Day today
B	huh? what?
C	any words for International Women's Day?
B	any words?
