A	so what shall we do go swimming?
C	definitely can't go swimming
C	it's got one of those crazy beaches though that's like shallow for fucking ages
A	oh yeah
C	so you can just like walk out for like half an hour
B	like wade
C	and just like that's
B	what do you do wade?
A	what's that?
B	I don't know sounds like
C	wade them
A	did you just drink that?
C	yeah
C	I accidently on New Year drunk a half pint there was like this buffet and I had like a pint glass and I was so drunk that my friend just kept putting the buffet in it and I never realised
A	what was the buffet?
C	like sausage rolls and like
B	like food and stuff
[ANNOTATION]	they are talking about food	Entailment
C	little
A	put booze in it
C	yeah true
B	it doesn't even have a straw that's lame
C	I know it's like definitely was like sausage rolls hitting me in the face while I was drinking
C	so that was gross and then I lost a wrestling match to a girl
C	then I fell in
[ANNOTATION]	they are talking about food	Entailment
A	you fell in a what?
C	I tried I made a date with a sixty-year-old woman to go skinny dipping on New Year's Day
A	it's a great line
C	and exposed
A	to the village
C	yeah we were at like
B	for New Year?
C	yeah
B	where?
C	in
B	what where?
C	she's got this this house that's insane so it's like you know the
B	mm
C	it's just like basically you go down this like National Trust path that's like five minutes' walk from the cliffs it's in like National Trust land it's next to
A	yeah
C	but her dad is like this
[ANNOTATION]	they are talking about diet	Neutral
A	and like a not like a good one
C	yeah he's no he's like he's a terrible businessman but still makes like millions of pounds
A	what like morally bad but
C	no he's just bad a he's just bad a business and no one likes him
B	oh shit
[ANNOTATION]	they are talking about one person that is businessman	Neutral
C	so he basically anyway but he was having like this affair with like a couple of women in the village
B	ah
C	yeah and then my friend
B	does
C	yeah
[ANNOTATION]	they are talking about a couple	Neutral
B	and she doesn't care
A	as do you
C	no she doesn't care like well he's not married to her mum but erm but my friend
B	mm you'll still haven't told her you've ruined her dad's life
C	yeah
B	have to get round to it next
C	I mean it can't be that ruined like there's been
B	it can't be that ruined if it was already bad
C	yeah
B	can't ruin something that's already
A	so what kind of like
B	I've never been there
C	didn't go inside
A	no I don't mind
C	there's this
A	got a pool table in it?
C	dunno there's this arcade
A	what you just sit there?
C	you just sit there there's not even a screen even you just sort of like sit on the motorbike and don't go anywhere it's like a motorbike on treadmill basically it's pretty shit I went to
C	and none of the machines work in the arcades but they don't put out of order things on them and I was like I
B	it's well out of order
C	it's well out of order and I complained cos I'm like in to complaining these days
B	and didn't want it
C	yeah no I didn't and my friend got the same ice cream and got loads of pistachios on it and I moaned and they overheard me moaning and they're like do you have a problem? I I like really I was like that's really unfair you got loads more pistachios and then the guy was like do you want more pistachios I'm like yeah and he bought me another ice cream with loads more pistachios on it and then I got the bill and he charged me for two ice creams this is such a boring story
B	he charged you for two ice creams?
C	yeah and they were like seven pound each so I like complained and then he gave me another free ice cream and I was like
A	so you got you got two you paid for two and you got three
C	I paid for one and I got three
A	oh
C	and loads of pistachios so then I was complaining totally works so I complained about the arcades
B	where where were you?
C	at
B	erm yeah also if you get if you if you like
C	really?
B	well like cos obviously his staff were like totally took it it was quite funny actually like I'll make it a short story but she she he had this member of staff working who was always always always stitching him up like come in late not show up and like sort of lie about it to get out of shifts and stuff and then the
C	yeah
B	she didn't change it in any way but the main thing that she did wrong just cos it was like supposed to have been in January like twenty
B	he was like
C	hasn't happened yet
B	no cos it's like a leap year it's like the one so it actually doesn't exist
C	oh
B	it's like so I got this email that you sent either three years in the past or when you're in the future but either way like it didn't come through yeah anyway so he was like look we were like you can't have the shift off and like you've obviously sent me this like really awful lie like she didn't say anything she didn't go to work to the shift and then
A	physical warning
B	not matter what physical warning
A	you have to do a warning can you do like a written warning and then like just ten minutes later fire them?
B	I don't think so I think I don't know actually I don't know bit there's a definite like clear thing that you have to do and he didn't do it so
C	what so then he?
B	so then she wins man he has to pay her stiff
C	how much?
B	well it's like they're closing the restaurant in three weeks anyway so it's like the rest of the shift that she would have done
C	oh is it at thingy?
B	Railroad yeah so that's three weeks' worth of work erm and then I think you have to do like severance pay so he reckons about six hundred quid could be worse but like also sucks just to have to give it to her she's like
C	what a dick for actually pursuing it as well
C	I'm sure like you know when like mad like people in really urban corporations get like fired cos they're like fucking prostitutes and then they get like two million pounds severance I'm sure people just do that on purpose
B	hard to get another job then though
C	don't need it when you get get like
B	you have to open a street food van or something maybe a hotdog van selling hotdogs I once heard the best erm like announcer on the train it was like the lady was like maybe she was erm but she she she was like talking about what they had in their erm the in the snack cart and she was like and today we have special get one sandwich get one Kit Kat free lucky
A	lucky
B	everyone's a winner on this train
C	mm
B	we went we had dinner at
C	haven't they moved to
B	no he hasn't he's still based in here but he's always
C	what was he saying?
B	just saying
A	he said that he's a green man now
B	he's a green man now so what? don't you have that turn of phrase here?
B	unless you mean alien no erm but basically he's had this like thing ever since I've known him but I think even longer like he got really really stitched by his agency with like you know how they send your book out and whatever you wrap up like a debt to them
C	oh yeah
B	he was earning a shit ton of money and then he was like you know can I have some money back? and they were like no you owe us like a hundred and fifty thousand pounds he's like what? I've been like doing like really well for ages for years
B	and they're like no no no you owe us loads of money so he was working really hard doing loads of like campaigns and shit to the trade farers and then like when I got back from
C	yeah
B	so anyway they've got him right by the ball by the shackle and arms you know and
C	by the shackle and arms?
B	by the shackle and arms yeah
A	by the ball single ball
B	yeah ball
B	and then he's finally cleared it now so apparently in
C	yeah to invest there the ones like agents are so fucking retarded I deal with them every day and like they lose their like clients so
B	really?
C	yeah like one the other day we were like
B	yeah
C	but it's also like you kind of balance it out though it's kind of fair like the way we do it cos like we put like loads of money on like corporate jobs so then like when we work with photographer so say if if we worked with
A	it's sunnier now
C	like we do all this editorial stuff for him but like pay for it and like so he doesn't have to pay anything to use that portfolio
B	that's what that's what they were saying like I think that's what the
C	yeah but agents don't do that production companies do that
B	I think that they they were covering for like editorial but they were charging him for it cos they were like oh when you wanted that thing like and we sorted it out for you this is how much it cost but they never told him that you know they were spending this money on his behalf erm
A	yeah
C	it is amazing the amount of money the amount of shit we buy and just charge random people but I kind of like
B	like
C	yeah like the cold press but we lay we
C	a pink carpet across the entire office which cost two thousand pound to get fitted and then buying the carpet on another job cos we had to get carpet for this other job it was AWS some like fashion chain
B	when you said you were getting a pink carpet I meant I thought you mean like  a red carpet like for her birthday just laying down a pink carpet
C	oh no no we've got like a pink carpet actually
B	yeah you need a pink cake? get a pink
C	yeah got a pink Lamborghini pink limo erm
B	that's so naughty how do you pretend that's part of the job? the carpet
C	because there's like loads of people like some people ask you for backups some of them will ask for backup but it's like Robin Hood like you stick like
B	oh I see
C	you steal from your stuff from those people
A	that's right you
C	you steal from those people and then like
B	bring out the pink carpet
C	then you're like other ones you like give them free shit you like help them out it's like you do a job for Zara and charge them like five hundred grand and then you give and then you do a shoot
B	roll out the pink carpet
A	bit of castle
C	we're not
B	oh yeah how was that?
C	and she's gonna basically her parents are gonna inherit a castle
B	yeah I've heard of that
C	and I was like so she's basically gonna be a princess if you get a castle
B	are you are you pissed off that you broke up with her now?
C	yeah like honestly I was like fuck let me know about the castle and maybe
C	that's my biggest incentive of people other people is like what I get out of it a castle land
B	what are you going to
C	no but erm
B	erm let me know how it goes with the castle maybe we can get back together
A	I want to get a castle as well actually how fucking cool
C	but she was saying when she was like
A	but you become a princess how do you do that?
B	marry a prince
A	I was
B	George you could hook up with George
A	first gay king yeah gay king
C	don't think it'd be the first
A	look how sunny it got well good
C	oh look at that cool light? there's a Tesco in
A	must be their depot
C	that's so cool
A	what is this place?
B	I don't know man
C	do you know how many mines there are in Spain?
A	a lot
C	there's not that many mines in England I don't think like
A	had
C	I dunno there's a witchcraft museum that's in a mine
B	where's that?
C	Cornwall the witchcraft museum
B	is it any good?
C	never been I've been to the
B	pretty magical
C	pretty pretty magical
A	how long do you think it takes to learn to drive?
C	ages
A	I didn't think that
B	it's like it's like a week it's like a week in like
B	so I'll take that one fifty quid
C	d'you know what though horse
A	yeah see I think that's what it'll be I thought in car might be a bit like that
C	I mean you can learn to drive like it's easy to drive but like you have to learn so much shit
A	the theory test?
C	no the theory is easy that's just like common sense
A	and it's like when to look in your mirror and like due to have to develop those sort of habits
C	yeah it's like no one
A	cos I did a
C	cos it's really
A	motorbike one and passed that and you've got to do stuff like look in the blind spot every five seconds
C	yeah it's just basically all the stuff you have to do is really like counterintuitive
B	you could probably do it do it now when you've got when you're young you can learn things in ten minutes
C	yeah but I reckon it would take about six months
A	what?
C	well you do like one lesson a week
A	I'd rather do like three a week and do it in like a month
B	I want to go to boot camp
A	it's a grand though you can definitely do it for cheaper than that
C	having a car is the best thing in the world
A	exactly that's what I was thinking
C	you can literally
B	you you learn to drive I'll get a car
A	and then also I can get a bike and have people on the back
B	I ain't getting on the back of that
A	you liked it in
B	what are you talking about you nearly killed me on a push bike in
A	yeah that's cos I was drunk I wouldn't drive a motorbike wasted
B	people were like what the fuck people were literally like
C	dude
C	when I was in
B	oh my god
C	and they still hired it to me
C	fucking idiots
A	you still hired the same one can I have another one please?
C	no yeah I got a different
B	yeah
A	that's like remember the one we got in
C	I'm getting a car next time we go
B	which we don't we didn't find out until it was nightfall and we were like
A	on a cliff
B	on like his precipice of like curvy and lost like definitely definitely miles even from the next turning like didn't know where we were no signal no headlights
A	and
B	I don't know left or right so I was being the eyes
A	she's like right I'm like that's the cliff on the right
B	I can see the bend and so I was like telling him which way to go but I fucking like fifty fifty on left and right really like when I get I'm like he's like are you sure? we could so easily have died but then we finally saw some lights in the distance we were like let's just go to that
A	we'd been doing it for like an hour or like two hours
B	it was cold we were just in bikini like it was cold and it was just so stupid
C	both in bikinis
C	got roll
B	we were like yes we'll just hang out here get the bike in the morning drink some wine eat some squid so and then we were like
C	yey squid
B	can they had started packing up the restaurant and we were like okay do you know if we can can you book us a cab to go home the guy's like what? no what are you talking about  a cab? oh man we have to drive these fucking tourists home
A	he drove us home
B	he drove us all the way via his wife and like his daughter and his new baby and he had to be like sorry I'm not coming for hours cos these bloody idiot
A	it was like a hour drive as well
B	took us home but then I gave him a bunch of money in the end and I think he was like mm not expecting that cos like it was
A	yeah he was pissed off and like just like not like wasn't mean
B	wasn't mean it was nice erm and then we went bank the next day to get the bike and he was he was happy to see us
A	I like the little bike
C	they're so fun
A	they're so fun
C	they're seriously so fun
B	we should go
A	are you talking about our
B	what?
A	talking really quiet
B	oh
A	you're talking
B	erm yeah we should do that you know for a bit
C	get those like cool like euro scooters that you like pedal to start
A	nah
C	they're really cool the one's that like all the rude boys have in France
A	they're not that fast though
C	that's good
A	you can go like sixty though
C	you can go quite fast on those scooters
A	yeah you can only get like forty and actually if you're trying to get somewhere it's kind of annoying to go that slowly it takes ages
B	what are you doing next week? you should come to
C	work
B	oh yeah ha ha
C	got a job
B	really who?
B	and what are you going to do with her?
C	she's just doing this photo shoot
B	do you reckon you'd get a headache off that?
C	no he wore the special hat
B	Neurofen Plus for that pirouette on your
A	it's in this part of England the sunniest part?
B	which part?
A	the part near
B	oh yeah he said the weather was always nice in
C	yeah
B	where are we going? I mean where do you we go via where else do you we stop?
A	tell that story to
B	oh yeah cos he knows them it's really funny erm but the only person who was smart was like
B	erm I had dinner with
A	is that what do you call her?
B	her name is
A	I thought you said
B	that's what we call her messing around
B	just so immature but erm
C	he's got a kid?
B	he's got two
C	how old is he?
B	they're like fourteen and he's like forty
C	and he's like really in to hats
A	in
B	yeah hats and trainers that's his thing
C	oh that's so bad especially if you're fourteen
B	yeah
A	yeah
B	yeah erm so anyway she's married happily married to him in
C	do the kids live with her?
C	dude
B	and they were talking about
C	they're very into their lives
[ANNOTATION]	Person C think that they are just busy with their own work	Entailment
B	so we're like
A	they're into being adults
B	yeah
C	but they are really into their lives
B	yeah they want all the stuff they're getting all the stuff anyway so we're like sitting down to dinner and the waitress is coming over and we're about to order I was like anyway me and
A	oh you were a saying you could like you could see in her eyes like
[ANNOTATION]	Person A is going to dance	Contradiction
B	ensnare
A	how did it take me six years five years to snuff the life out of
B	it took me five years to ensnare her
A	you know when I met her she kept talking about this person called
A	the way she was talking about him about him about him
B	it's true though the way she sees it is like what
[ANNOTATION]	Person B is going to dance	Contradiction
[ANNOTATION]	Person B is going to dance	Contradiction
[ANNOTATION]	Person B is going to dance	Contradiction
[ANNOTATION]	Person B is going to dance	Contradiction
[ANNOTATION]	Person B is going to dance	Contradiction
[ANNOTATION]	Person B is going to dance	Contradiction
[ANNOTATION]	Person B is going to dance	Contradiction
B	funny
C	it's quite an easy way to live your life though
B	what? marry and
C	yeah no be
B	yeah he doesn't have to think about anything she knows exactly what he likes and what he wants and what he's going to do she can just tell him and like boss him it's not it's not it's not very nicely done through either it is like aggressive she puts him down quite badly
A	I don't understand why that's attractive for a woman you know
B	what?
A	just like step all over them like trample over them like
B	no what attractive to him?
A	well or to her to have like a wet blanket type thing?
B	yeah I guess they've found a way that works I don't know know
A	I like this train journey it's got like a ride
B	yeah
C	kind of like a ride
[ANNOTATION]	Person C is going to get a sandwich	Contradiction
A	it's got lots to look at compared to like the
C	what's between
[ANNOTATION]	Person C is going to take an ice-cream	Contradiction
[ANNOTATION]	Person C is going to tace an icecream	Contradiction
A	swamp
A	there's one really cool there's a quite liked it when I was getting there in the morning and it was early and the sun was coming up and it was like
C	a big puddle
A	it's like a puddle from there to here
C	between
B	puddle
A	there's one really nice house
C	are you going to
[ANNOTATION]	Person C is asking about the decision that person A gonna take	Neutral
B	yeah I'm the slave bitch making the cake aren't I? she wants me to do the food and all it's like in erm
C	what?
B	I know
B	I don't even want to go if I can't take
A	I don't really want to go either
B	I know obviously
C	are they paying for the wedding or do you have to pay for yourself to go?
B	you have to pay to go
A	even though you're making the cake?
B	yeah even though I'm making the cake I think I should be allowed to bring you at least it's like
C	just put him in the cake surprise
B	but like but then it's like if someone
B	it's like then you're just going there to like be part of his like performance you know people should be allowed to bring their partners I don't I don't know her friends like
A	I'm not your partner man
C	I I when I went to
B	well she's got a castle now innit? he's off
C	but I can't believe did you know
B	no they met at
C	but has their relationship always been that? that she just tramples all over him did she just pick him at
B	erm I don't think it took that long
C	yeah I know
B	it's you know some people like they just it's like they know they don't even like each other she does and she does respect him like
C	yeah
B	but now I'm just like woah woah woah woah woah are you still joking? cos it seems really real now it's funny you know erm
C	yeah
B	and erm she makes these like amazing dresses like really really detailed and she was talking about it she's like yeah about me and
C	yeah but I thought
B	and she wasn't joking
A	I don't want it to look machine made
B	like not handmade what's the word? I was like machine made? she's like yeah it's actually
C	but I feel like
A	what kind of person?
B	what a bitch?
C	I mean cos he's not really that completely a gay guy but he's like the worst greedy like bitchy gay guy in the world
B	yeah he's got a
C	but actually he's a really nice guy
B	he's got he's got a sweet side but he is actually a bitch
C	not but he's like
B	he's would he would do dodgy shit if he could get away with it
C	but I feel like he's very conscious of it like it's totally constructed
B	he has moments of remorse but he he'll fucking throw you under a bus though don't don't don't mistake that I've seen him do the sneakiest shit to his friends but like you know he'll still consider them friends and really love them but like he's definitely a bitch I don't know man he smokes too much weed or something
B	like it's not very glamorous is it?
A	that's
B	that was so funny I when you were when you were gone on the water run erm I bought this like weird thing from
A	flying girls?
B	yeah who when they like
C	it just hurts that they're like trying to take off the
A	I'm considering the wedding like
B	and it's going to be cold its like not
A	it won't get that it won't be cold
B	in October
A	it's hot in like my mum was there like in February and it was warm it'll be hot it'll be warm in October probably cos it's way in the south
B	she said it was going to be cold but erm it's that your ticket where's mine?
A	I gave it to you oh no that's yours there you go
B	sorry
A	railcard is really good
C	I might buy one on Ebay
B	can you get one onEbay?
C	yeah like a fake ones
[ANNOTATION]	the railcard bought online is fake	Entailment
A	it's they're yeah they're letting the erm the
unknown_female	tickets please thanks very much yeah lovely cheers thank you that's great cheers thanks a lot
A	they've erm they're been outsold by the voice of the
C	yeah
A	you get like five hundred pound Tesco voucher for like
C	so lame there's
B	Tesco points
C	I bought I used to when I first went to uni I bought loads of Subway stamps I bought like whole rows of them
A	off the internet?
C	yeah and then they stopped doing Subway stamps but like cos you used to get a like stickers rubber stamps and I used to buy like filled cards and basically ate just ate Subway for about a year and I was vegetarian so there was only one Subway option veg patty
[ANNOTATION]	subway offers different meats	Neutral
B	what cheese?
A	probably wasn't vegetarian either
C	veg patty
B	er veg patty
A	so the other the other day I I had some Mcdonald's vouchers on the train and I went and got a Mcdonald's with them but
C	I really want to get a Mcgrill
A	a Mcgrill?
C	it's got like about a billion spices in it that's illegal
A	it's not illegal
C	I thought it was illegal too just
A	I'm not defacing it I'm just folding it up did you see that thing about people in Canada  like drawing that Star Wars guy they've done it on so many nuts that's it's kind of a problem now
C	really
[ANNOTATION]	McGrill contains many spices	Entailment
A	what's he called Spock they drew Spock on the president everyone's being doing I for years er since he died or something they're on overdrive
B	Spock apparently died
A	yeah I don't know
C	oh yeah he died the other day didn't he?
A	yeah Leeroy
C	yeah he died
C	what did she go for?
[ANNOTATION]	spock died last year	Neutral
B	she got wasted and booked the flight
A	hangout with
B	is that a real name?
A	I don't know man
[ANNOTATION]	it is a real name	Neutral
B	has he?
A	yeah he has to he's Israeli
C	yeah it's like my friend
B	oh
A	you can't like it's all like you can't not do it
C	she got home like she pleaded like compassion or something but she still had to be in for a year
A	yeah you can do stuff like he would they must have used like a radio operator or something
B	did the radio?
[ANNOTATION]	spock is dead	Entailment
A	like it kind of makes you complicit in such like terrible things do you know what I mean?
B	what does he actually do now?
A	erm he's like
C	erm
B	huh?
C	doesn't he like doesn't he work for
A	he's just like a
B	but we don't
A	what?
B	we don't
A	no like on the back they wanted to put tickets on it
B	what?
A	some feminists were trying to get the
B	on Charles Dickens?
A	yeah
C	plonk and
B	shut up
A	plonk it
A	who's on the twenty pound note I don't even know or the fiver
B	the queen
A	yeah on the other side though innit? let's have a look you got one?
B	no I only got that one bought a juice didn't I? twenty quid
A	it's a tenner
C	yeah yeah my laptop got robbed
B	and the police was like this is all pointless and like they
B	go go look for those
A	what is marked bills anyway?
B	when it's like got an invisible like you know one of those
A	I thought it was in the numbers of the
B	oh in the serial number
A	you get like a bunch of bills and numbers and like a number like between
C	are you reading a book
A	what book?
C	blah
B	blah blah blah blah finished
C	blah blah blah I remember I got really busted actually in my primary school cos you know there's like workbooks so like I had these really good orange pens so I just coloured all the pages in orange finished finished finished and then they used to hire hire? I used to hide cos like you know you used to get like pen pots with like the foods on we had like the tables and each able had like a name for then you'd have to do a name so we would be like instead of
A	why? babies
