C	haircut
C	I've got to phone and thank obviously at some time
B	there was quite a rude lady on the train I thought I mean she she was seemingly disabled so I can't really judge she was in a wheelchair but she definitely got out of the wheelchair and like stood up and walked around and did some stuff but she was in the gantry where people get on and she sat in this like electric wheelchair but she proceeded to recline it as far back as it went and then people at Gatwick airport were trying to squeeze past her bags and she's just lying there with a book like just full recline just taking up the whole thing
[ANNOTATION]	they don't know she was disabled or not	Neutral
A	that's ignorant isn't it?
B	I thought it was a bit
A	by people that
C	yeah
B	it's a bit I don't know she just looked kind of fat to me I don't know if she was actually
A	oh perhaps you remind them of something
C	maybe
B	oh has he got lots of monkeys?
C	oh I got a
B	hey the likeness is uncanny it has to be said
A	is it?
B	mm except he's seventy
C	yes I was about to say she must have I I forgot to mention that that has she gone to her dad's cos I think his birthday's the same day as mine
B	she did want to that was the original plan before we came home we said we'll both go to see our dads on on their birthdays but they've gone to Belgium actually erm he's really into flea markets
C	okay yeah
B	so they've gone to some famous flea market in Belgium but he's
C	yeah fifteen years yeah
B	I mean her mum's her mum's only fifty-five I think so
B	there's quite a difference between the two of them yeah
A	yeah
C	yes
B	but he's got a whole other family
C	half
C	step is is through marriage but no blood
B	no she's in her forties with like children
C	oh good lord
B	she doesn't see them very often I think her dad's calmed down quite a bit as he's got older
C	yeah it has it does have a tendency to do that to you
B	I mean he has no teeth
C	oh I've still got mine
C	apart from the ones that I lost in an accident
B	yeah
C	that wasn't my fault
B	it's kind of
C	oh
B	so she told him to have the rest removed and get dentures so he did but then he found the dentures were giving him a gag reflex so he never keeps them in
C	yeah
B	so now he's and his mouth has changed shape now because he doesn't have any teeth so
A	yeah
B	his dentures don't fit either
C	no the jawline'll
B	so she feels kind of responsible good oh that was my water thank you
C	that was
B	have you been out on the bike?
C	er not probably for a month now I haven't no I've been erm
A	more than a month
C	I've been erm doing the gym bit cos my mate come round er last Friday er don't know if it was the beer talking or not he goes cos I had like a short sleeve shirt he goes your arms he goes have you been in the gym? I said well I'm doing the basics they're looking bigger
B	muscle or fat?
C	muscle
B	muscle
C	but erm unfortunately here there's this is what really I need to address but because I've got such a weak core
B	cos your back
C	yes
B	erm never been into swimming have you really?
C	I don't mind if I'm at the sea but I don't like to go to a
A	excuse me to interrupt but are you remembering who these are from cos you know what he's like he'll say to me what
C	yes yeah money from my sister so far er money from your parents
A	yeah cos you had your cakes
C	yes
A	from
C	yeah she sent me a text this morning I text back
B	who are the Lindt balls from?
A	me
C	from yourself
B	they're literally the best chocolates in the world I think
A	yeah one of the good ones from what I can see that's mum and dad
C	yeah
B	in Korea this I don't know how much they are here but a box like this is about fifteen to twenty pounds in Korea
A	no they're about you can get them for a fiver if you're lucky
B	oh right a whole box like that? but erm they were going out of date in kind of like a it's a version of Tesco's that they have in Korea called Homeplus and we watch them week after week get cut in half cut in half cut in half in the end we were able to buy them for a pound a box like that
C	oh good lord
B	kind of munched them it's terrible
C	I'll put this in here
B	but of course dad so you're not eating sugar are you dad so this is very
C	well yes now you can have some
A	no no no I give up with that one completely
C	would you like one?
A	want one for your cake?
C	oh yes as well so I'll have a couple of these as well
B	thank you very much I won't say no definitely not
C	it is from your mum and dad
A	yeah
B	have you ever frozen these? do you like cold chocolate?
A	yes I do
B	they're quite good frozen quite nice
C	so I've got wine and money from your mum and dad and
B	blueberry
A	yes
C	yes they're nice
B	mm blueberry muffins
C	I might have the muffin first actually so nice
B	how's the weather been the last few weeks? cos it's been really nice in Brighton
A	on and off it's been quite chilly sometimes
B	yeah the last week it's got colder I I'd say but prior to that was it colder or
A	but today it hasn't
B	what you've had the sun out?
A	oh gosh yeah
B	Brighton's been just very close and cloudy all day like really overcast
C	sun here
B	yeah
A	couple of times your dad got the central heating on in the morning
B	it did brighten up as I took the train but it was really thick on the coast today
A	I mean two or three mornings we got up and it was just like there's a fog
B	mm
A	it was heavy mist
B	in general though it's been quite nice in Brighton
C	you're about a degree and a half further south than here
B	yeah
C	yeah
B	certainly makes a difference
C	I think
B	being on the coast makes a difference
C	at night you've got warmer temperatures
B	yeah think it's erm it's a bit milder there I think overall I looked at the temperature charts the average lows in winter are like three
C	yeah
B	I mean it's not really that cold
C	especially by the coast you won't get so many frosts
B	no there won't be frost probably won't be much snow either will there I doubt
C	not a great deal no be inland
B	not usually by the coast
A	do you want okay dad's a little bit backward in coming forward
C	seven
B	seven
A	seven
B	then yes I'll have a coke if that's alright
C	mm
B	are these homemade?
A	yes
B	oh fantastic I do like muffins
C	yes blueberry's nice
A	mine used to turn out alright this is my recipe that everybody uses but I can't make them now
B	oh it was your recipe?
A	yeah yeah
B	have you ever had them with white chocolate? blueberry and white chocolate that's good
A	yeah erm oh also you can put anything in them really just the
B	my friend my American friend
A	oh
B	every time we go round he makes blueberry muffins or something
B	they're very good
B	everything's set up in my flat now thank you again for everything like between the families we were just really I think
C	mm
B	where did this all come from?
A	no that's good
C	that erm tamarind I've forgotten that I'd put it in for you
B	I tell you what it's good in shepherd's pie
C	right
B	I don't have any Worcestershire sauce and Worcestershire sauce is made from tamarind
C	oh is it?
B	I didn't realise yeah
C	no neither did I no
A	I did
B	er so I used it in substitutes pretty good
C	yeah
B	I just used some mustard and some of that
C	you can get that erm tamarind stuff from Tesco's
B	I have actual tamarind now
C	oh right because like with that sauce cos it says erm open and eat with use within a couple of weeks or something like that
B	mm
C	is I I also put an ice cube tray in there cos like again I forgot to you're probably thinking well you had an ice cube tray
B	yeah no I've been using it it's good
C	was erm like over put for ice obviously it's straightforward to use or like your tamarind use when you want to do and then just fill up then you've got tamarind cubes then are you with me?
[ANNOTATION]	They think that the substitutes are just as good as the real thing.	Neutral
B	yeah
C	you go pop and
B	I've been using the sauce in the cooking but otherwise I've bought some tamarind concentrate
C	okay
B	which when you open it lasts for months it doesn't doesn't really go off
C	okay that's good
B	right I've still got a lot of the
C	yes
B	probably
C	but it's grown
B	and you could sell I mean these leaves in Sainsbury's you buy like four leaves and it's like three pounds so
C	yeah it's good
[ANNOTATION]	They prefer to use a store bought sauce.	Contradiction
B	so we're gonna be like thirty pounds worth of
C	did I?
A	it got the blight and you had to throw a whole
C	yes threw away a bit of it yeah
B	do you know what the blight is? is there
C	er yes that gets suffers from erm caterpillar which is on the caterpillar but it suffers from erm oh what's it called?
B	you know specifically what what it is?
C	yeah and then afterwards pin them off
C	oh it's in the old oh it's arrived
[ANNOTATION]	They need to order more of the items	Entailment
C	erm sat my new satnav
B	mm mm cos you got lost on the way home
C	yeah it's very it was misbehaving it wasn't just on the strength of that it it was erm starting to I can use it round I can feel it feel my thumb on my way round Bedfordshire with it to go to places where erm it will get you where you're going but it's not I don't trust it any more as in that's the fastest route
B	no
C	it's taken me around
B	were you with dad at the time when
A	no I was
B	no yeah
[ANNOTATION]	They think that the nav will get them where they need to go.	Neutral
C	thank you my love that's a very nice present
A	it's from it's from the boys
C	I know yes I know
A	as well
[ANNOTATION]	They needed the present they got.	Neutral
C	yes
A	they've put a good bit into it
C	yes thank you
B	erm
C	I will thank
B	so are you
[ANNOTATION]	They think that the present is appropriate.	Neutral
B	did you get done on the congestion charge and all that?
C	I don't know because we were there on a Saturday I mean
B	oh you shouldn't do
A	no you shouldn't do
B	oh okay
B	I didn't know I thought you know last time you picked me up from the airport we were going all round all round I thought you're getting old
[ANNOTATION]	Person B is going to do some hair cut	Contradiction
C	no no no no no no
B	mm
C	I was consciously not stopping in the grids which I would here because I know that the erm if you do the the cameras are set to take up and you get the fine then er the speed limits you weren't gonna bust those you couldn't get that fast
B	no
C	erm then it was the erm er the congestion fee
B	mm
C	and that was it really
B	yeah
C	so I thought well I think cos we're there on a Saturday rather than a Monday to Friday erm
B	should be alright
C	and I wouldn't wanna be paying for the privilege of going for a traffic jam from basically south London all the way it was just
B	no it's terrible
[ANNOTATION]	Person B think that paying for the privilege is awful	Neutral
C	it was heavy traffic so er right do you want one more of these?
B	no no no I've had enough sugar thank you
C	I'll put them away
B	I'm looking forward to the curry
C	cup of tea put my cards out er another bag for you
B	that's quite a collection of cards this one towers above
C	yes yes I know all all go in the erm in the lounge I might have another one of these actually cos they're
B	no no erm maybe after the curry
A	another of those buns
C	they're nice
B	when will you come up when will you come back up to Brighton?
C	well probably New Year yeah cos obviously want it a big warmer yeah so
B	have you been to Brighton much
A	once I think but I couldn't tell you remember
[ANNOTATION]	Person A hardly remember when he were in Brighton	Neutral
B	it's quite nice
A	is it?
[ANNOTATION]	Person A is going to dance	Contradiction
B	yeah it is quite nice
B	my erm my area's not bad
C	no it's not bad at all
B	I don't live in a bad area
A	don't you?
B	erm some of the neighbours are a bit crazy but erm they leave us alone but I've heard a bit of shouting in like outside
A	is it sort of
B	I think genuinely crazy not like you know people fighting or anything I think we have a crazy lady that lives on the other side of the road
C	how about the one erm who your neighbour who got lost a
B	no I bumped into them once but that was it
C	ah
[ANNOTATION]	Person C  was followed by the guy was taken picture by him	Contradiction
C	mm
B	the building's nice the rooms are nice there's a good quality everywhere like
C	mm
B	I haven't really seen too many I haven't seen any problems or any rough looking people around there's one area where I go shopping where it's cheaper like Aldi and it kind of seems a bit more like Bedford around there
C	yeah
[ANNOTATION]	Person C agrees that around cheaper market you see less problems	Neutral
B	but otherwise it seems a bit more you know the class is a little bit higher I think
C	mum's been down hasn't she?
B	she visited yes one afternoon but not for very long erm
C	that's a long way to go for
B	I know yeah I thought so
C	were they just passing? were they going to Devon?
B	oh they were just passing yeah erm she'd intended to come Saturday and Sunday but erm something happened with
C	oh right
B	they had to come down on Sunday they were probably there for about four hours
C	oh right so they were there for a reasonable amount of time
B	I I cooked some scones and we had cream tea and then we took
C	okay oh
B	yeah
C	came okay
B	so it was
C	well she can if she trains
B	yeah
C	I mean she can't drive by herself
B	no no of course
C	but if she trains it's not a problem you can pick her up at the station
B	it's nice there though I've got I'm only fifteen minutes from the sea really as the
C	yeah that sounds
B	no fifteen minute walk yeah just go down into it
C	yeah
B	erm
C	it's all downhill isn't it from your house?
B	yeah it's all downhill
A	what's the uni like?
B	university's I think quite nice the campus is nice it's very well facilitated it's a lot
A	oh art deco deco whatever
B	yeah it's this glass plate university thing
C	oh right yeah
B	same as
A	the digs er for
B	yeah is it nice?
C	we didn't managed to saw the uni but we saw his where he is it's
A	oh it's lovely it's like little holiday village
A	it's set amongst the trees
B	what a great place to live for a year
C	mm
A	oh absolutely
C	yes
B	I never got to live on campus I was always off campus
C	yes yeah you didn't did you?
B	no it was erm
C	mm
B	erm and you could only fit probably normally a British university will only fit the first year on campus anyway
C	yeah
B	you can't and maybe some international students but we could probably only fit about half of the first year on campus so
C	yes yeah
B	the other half had to kind of live but I actually I had a good time and we we were still in university accommodation but just off off campus
C	yeah
B	but the course is really good people are really friendly and nice it's quite intense
A	how many are on your course?
B	erm there's only twelve of us on the
A	and that's you and
B	yep erm
A	there's only
B	and out of the twelve only three of us are British erm we have two people from Saudi Arabia we have
B	we have a Polish person we have a Dutch person we have cos it's linguistics so they've been studying linguistics in their own country
C	yeah
B	and they've come to kind of do it in England I'm actually taking some third year undergraduate courses erm you can choose to do one postgraduate or two third year undergraduate modules so it's actually kind of more work I have to do more study and I'm effectively splitting more of my time so I have to go into university more I have to read more and do all that kind of stuff
B	erm just because the module was more interesting I
C	ah
B	that's what I er I'm doing a module in pidgins and creoles and then I'm doing a module in syntactic theory which is basically cognitive science so
C	yeah
B	I'm doing a cognitive science module er but they're with they only run them for undergraduates in their third year
C	yeah
B	the level's quite hard I mean
C	yeah
B	I'm doing more because I'm also doing my postgraduate modules as well
C	yes
B	but erm I'm actually with undergraduates so my classes are a little bit bigger for those two classes probably like fifteen to twenty students whereas in my postgraduate classes probably only about six students in each class cos although there's twelve of us that's split between a bunch of different modules so
C	mm
B	but it's good we also have a mandatory three hour erm it's called roles they do like they get researchers to come in and give speeches about linguistics every couple of weeks so we have to go in and do that as well so I'm actually doing quite a few more hours than I was doing at my undergraduate
C	yes at least you don't have to like go and only have a few hours of tuition and you've got to go and research everything yourself
B	yeah
C	cos I don't think with
B	I mean he'll have to do that as well obviously
C	yeah but he he needs to have obviously front end like the business end of of
B	well the next step up once you go to PHD is not taught at all it's just research
C	yeah
B	all research so they're preparing us for that now so although I have three hours a week for each module they tell us that we're expected to do between ten to twenty hours additional on top of that per module
C	yeah
B	so I I'm currently putting in about seven hours of study a day
C	yeah
B	maybe eight hours
C	oh
B	I have reading wise I do four modules and every module has a weekly reading list and then a wider reading list on top of that but the weekly reading list is about ten books
C	yeah
B	per module and maybe one to two chapters in each book so total is about forty to fifty chapters a week that I have to read
C	oh
B	which is ridiculous so there's a lot of reading and then we come in and basically if you haven't done the reading you can't talk about in class what what you've done the reading about
C	yes
B	but we've been doing erm I was analysing German today and in my syntactic analysis class I definitely feel more like I'm doing a linguistics course so
A	here
C	I I would imagine that you're glad that this is a one year course and that this intensitly intensity you wouldn't wanna go in for three years
B	no not at this level no
C	too too onersome
B	if I had the money I think
C	yeah
B	and then it's I guess easier because you're spreading that same workload over two years
C	just spread the load yeah
B	but it would just cost so much to stay in England for two years doing that
C	yes yeah indeed yeah
B	erm
C	yeah
B	it's good the lecturers are nice it's quite a high standard
C	I mean cos you're like you said because you're doing your
B	mm
C	he's going to be older than quite a few of his peers
B	yeah
C	because er they're gonna come fresh out of school and they're eighteen where he he's a little more seasoned he's bimbled into work
B	he's travelled
C	he's travelled he's he's been to quite a few places if you think
B	for his age yeah
C	for his age I think he's been to he's been to San Francisco he's been to the Canary Islands he's been to German he's been to France he's been to
B	Korea
C	Korea
B	Japan
C	Japan
B	Cambodia
C	Cambodia Thailand
B	mm
C	that for a person his age yep this isn't like just going over to France and Benidorm or something you know this is travelled so
B	mm
C	this will make him quite an interesting person
B	whether or not undergraduates care though I think is the problem I found in my undergraduates courses they're like they didn't seem to it doesn't faze them that I've been living out of the UK for six years
C	yeah
B	I thought that was quite an interesting feature but they're no
C	no
B	no interest whatsoever just
C	no
B	but erm there are a few people on the MA course that are fresh out of their undergraduate
C	yes
B	so I er I there's the only other British person is called
C	mm
B	but erm
C	mm
B	no it's nice if you well when you come up I'll er we can take you up to the campus what's really nice is that it's only a ten-minute train which is lovely and it's only a ten-minute walk to the train so
C	right
B	I feel like I can get to and from university very quickly
C	how far is the actual university from
B	it's about seven kilometres from home
C	right
B	so
C	yeah
B	but
C	mm mm
B	there's no like cycle paths or anything
C	mm
B	erm and also with my classes Monday I've got a long day I'm in from ten until six
C	yeah
B	so I don't really feel like cycling
C	cycling
B	no
C	at the beginning and the end of that no
B	no and then and also I have to take in three folders three sets of books my lunch all that kind of
C	no no
B	Tuesday and Wednesday I'm in at nine o'clock so I don't really feel like getting on my bike that early
C	no
B	either maybe I will once I'm more in the in the swing of things and Thursday I'm off then Friday is the only day that I could but this week I couldn't because I knew I was coming home so
C	well at least it's it's for a year and not that you're not enjoying it but it it it that
B	yes yeah yeah absolutely
C	you'll be like you know you can
B	they've already got us thinking about that
C	well
B	trying to come up with a dissertation thesis
C	I wouldn't
B	mm
C	er I phoned him about erm where are you? erm cos he hadn't
B	mm
C	I said I'm not sure if
A	Wednesday I think
C	I think christ you know you're leaving it right up to the
B	mm
C	the wire you're coming home and then erm you're going to as you know I think it could have been the Thursday cos I said to him about erm erm coming on Friday and he said well mum was kind of you know erm coming to see me I said not a problem I said erm come on Saturday with your bike I said but I'll come round yours on Friday we'll load up cos what I didn't wanna do was erm have to go to his to load up on Saturday okay I'm not trying to avoid your mum but
B	mm
C	erm load up and that when and then we've got it's a detour to go there it's not straight to Canterbury it's the going the wrong way
B	mm
C	when when we went to yours with a van actually going that way was no no not out it was on the flight path so that wasn't a problem so he came Saturday morning erm and I'd gone to his Friday afternoon after work loaded up got it back here that was to see if
B	cutting it fine definitely
C	yeah and me thinking
B	I mean I told you in Cambodia he cut it fine quite a few times
C	yeah
B	I kind of part of me wished that he's missed his flight or missed a bus or something so it had taught him a lesson but
C	he hasn't he's got to instil a discipline
B	it will fly for the first year he'll be okay that mentality he'll get through and he'll get an okay grade but come the second yeah and definitely the third year he can't be like that you have to be extremely organised
C	yeah
B	especially once you get to MA level there's no way you could be unorganised
C	yes
B	there's absolutely no way
C	you're the
B	told him
C	you haven't got a clue what you're talking about you what game? You've never played the game and I'll be going well actually you're right
C	although I did study I I had day reliefs for seven years at college so I do know the disciplines of it
B	mm
C	but not like you do and he will accept it from you more than me cos he'll say er you've done it so I'm gonna I'd be I'm wise to not take council from you
B	my concern I think part of what they test you on in a degree I'm not saying what you're graded on but like with regards to the working world when you get a job you have to you know they they're expecting longevity you get a job they don't want you just changing job every six months every year so
C	no
B	I think half of the reason that a degree is as long as it is is to prove that you can focus on something for that long
C	and keep with it
B	and keep with it
C	yeah
B	and that's where people fail because I've got friends that take it almost right to the wire I've got friends that are doing really well for two and a half years
C	yes
B	and then that last half a year and that worries me with
C	yes
B	that he won't stick through for the three years
C	I would rather slowly walk through the erm course than lie down for most of it and find out that I've gotta run like hell for that last hundred metres
B	and sprint right at the end yeah
C	yeah the tortoise and the hare
B	he might pick that up now it took for me to go to university to learn that because let's face it prior to me going to university I was a terrible student
C	yes no yeah yeah
B	I didn't turn up I didn't do anything
C	yeah you've learnt through experience like I said I'm hoping the the female in Spain who seems quite a nice lady seen photographs of her very nice erm that her or the ones on the course now will deflect him from mediate him
B	yeah did you meet did you meet his housemates or
C	er one of them
B	one
C	yeah erm American girl
B	oh okay
C	yeah so cos
C	I'm in the toilet I can't get out and I'm thinking oh crap
B	did you get out? obviously
C	well actually yes we did but it was like oh god are we gonna have to bust the door down or something? that's a great start erm oh by the way er we've bust your door cos the the Mrs was
C	and and the girl departed up the stairs
B	you weren't embarrassed were you
A	no the
C	I think you were just relieved to get out the
A	well yeah I just thought cos there's no way I could go out the window was there?
C	no
B	you were considering it obviously
C	that was well that was my
B	how did you do it?
A	it was one of those it's not like erm you know like if you've just got like a handle like that
B	yeah
A	and where the lock is it's just that little button that you twist
B	oh okay yeah
A	and I think your dad ended up pulling the door from the other side which cleared it so it would flip back but I couldn't get it to flip but it wouldn't turn it just
B	oh god
A	I'm thinking oh gosh here we go
B	but you made it out?
A	just
B	isn't there somebody on your side of the family at university?
A	no she's finished
B	oh she's finished
A	yeah yeah she's finished er
B	she was doing drama wasn't she or something?
A	she was but she changed she's working for
B	brilliant
A	erm
B	oh wow
A	doing a course so
B	so quite a few people then
A	so then all the family now are doing something or other
B	that's brilliant
C	spoke to I rang
