B	they're fucking big mate
A	I know I know they are I don't know
B	they're big time
D	Rihanna was fifty quid that's what I can't understand like Rihanna's like up there
[ANNOTATION]	person D cant understand Rihanna's	Neutral
unknown_female	yeah that's
A	that's about as it gets what between fifty and seventy for like that upper echelon
D	oh the Beyoncé tickets were like a hundred plus
A	ah yeah I suppose
C	they're like they're like rocking horse shit aren't they? if you get one of them
A	Drake was like sixty I didn't bother with them he was in
C	thingy was in
A	he was in
B	really?
C	yeah he was at the
C	yeah
A	fucking hell
[ANNOTATION]	they are not sure about age	Neutral
C	where
A	has been
C	Lethal Bizzle can stay where he is he couldn't give me a fucking Lethal Bizzle ticket
B	I want to make you sweat
C	who who sings that?
D	he he bored me
B	who Snoop?
D	yeah
A	I've never really been a fan of him
B	I think he's a bit of a tool to be honest
C	is a
[ANNOTATION]	person B is not sure about is she honest or not	Neutral
B	he's fucking too thin isn't he?
A	yeah
B	he is borderline fucking
C	he's the world's biggest fucking dope head isn't he?
[ANNOTATION]	they are talking about weather	Contradiction
A	mm
B	that's like you know erm er
D	Badass innit?
A	he'll probably change his name cos he was I think like seventeen when he started
B	yeah he can't be going round
[ANNOTATION]	they are not sure about age	Neutral
A	he's younger than us
B	called Joey Badass
D	Joey lies
A	but he's making a lot of money so he can do what he fucking wants
B	well he can to be fair
C	oh my god she's proper pregnant isn't she?
A	hevo pregnant
D	I'm impressed with her actually
A	with a pointless child
C	any reason in particular?
D	she drinks so much
A	she has got a pretty important role though
B	yeah what what else is she gonna do? she wasn't doing fuck all would she if she wasn't doing all this shit
C	that is a fair point
A	work work for her money
B	ah
C	she's got to
A	did they win?
D	yeah
C	cool they won did they? I saw it was one all
D	I was over the moon the other day in uni I bet on er Blackburn versus Bolton Blackburn to win they scored in the ninety-fourth minute
B	Lukaku
A	fuck me
B	Romelu
A	so strong beating his way through
C	he's a bit of a racist noise to make innit?
A	no it isn't mate it's a grunt same grunt that toothless same grunt that toothless Joe makes in the gym
C	toothless Joe
B	ha
A	that's a handball why is his his hand doesn't need to be there
B	yeah he did yeah
A	shocking that
B	Romelu
D	I hate placed penos down the middle
C	it's a brave decision innit?
A	yeah
B	I like
C	look how fucking
D	he's been there for years
B	ha
B	oh they went up in thirteen seconds didn't they?
D	how many?
B	thirteen seconds
C	great ball
B	oh
C	that's great play innit?
D	that'll be UE UE
C	yeah
B	what picking the ball out the back of the net?
A	probably
D	that was Kevin De Bruyne weren't it?
A	he played shit from what I saw
B	he got two goals though
A	did he?
C	they word
A	he was playing awful when I was there
B	Nicklas Bendtner's there isn't he? at Wolfsburg
D	is he?
C	what's he doing there?
B	he's fucking todge
C	yeah todge
A	todge
A	you want to lay down mate?
B	no it's alright I'm gonna and get
A	no you lay down mate
C	I was meant to get through a hundred and twenty-six pages when I came home ph
A	nah mate ain't happening
C	I'm through one
A	have you have you seen the new tech they've got
B	who?
A	these two
C	our flash new toy
A	can I show him on my phone?
C	you can show them on the phone
B	what have you fucking got now? Mr Mr and Mr I've got no money but I'll buy the fucking
A	this is with vouchers
D	this is with our vouchers
C	Mr and Mrs er
B	I said Mr and Mr didn't I?
D	so you enjoy your few pints at the pub and I'll be here doing nothing this this came free of charge mate
A	we spent a fiver
C	give it a go
C	he fucking does
