C	sorry
A	keep that quiet
C	alright
A	hence I didn't say anything about any else either
C	yes
A	and that so I thought oh she's eighty now it was her eightieth birthday?
C	er no she's older than that she's born the same she was born in thirty-two so
A	well she told me she was eighty so I wasn't going to turn and say no you're not Mike says you're not
C	no she's not she's lying about she's lying about her age
C	she the same age as my dad so she's probably be eighty-two
A	well she said she was eighty
C	she
B	thirty-two
A	no
C	sorry?
B	it sounds a while ago now doesn't it? nineteen thirty-two
A	it does yeah thirty-two it does
B	phenomenal
A	remember last night he had to like this
C	has it got its own fat on? alright okay
A	so last time I had to scoop it all off cos it was so oily
A	oh sorry no turn it off
B	no I'll do it I'll do it is that alright I'll just turn it down a little bit
C	sorry?
A	doesn't matter
C	oh does it not work very well on that one
A	no you have to keep to just keep it
C	oh there you go
A	yeah you have to keep going keep pressing it
B	pile of rubbish
C	I'm getting there
A	just turn it off if you don't want it on
B	no no no I'll keep it on I just wanted to turn it down a little bit for the recording so that's Neighbours isn't it? from a long time ago
A	I don't know cos I was talking to your dad and I went off
B	there you go that's a bit better so how have you been feeling?
A	erm pretty good thanks I've had a couple of ups and downs sometimes my eyes don't feel as if they're
C	ooh that's fine
A	lining up and that sounds really silly but they're as if they don't work together
B	okay
A	so and it makes me lose my balance a little bit
B	okay I understand
A	apart from that it
B	that's good
A	it is good
B	you're looking really good yeah I'm so pleased
A	I'm not looking all that good I absolutely hate
B	yeah you are I'm liking the shock of white hair
A	mm
C	when I read it when she had it it said that erm radiation on the head I mean you see it in films when they've been bombarded with radiation there's two things you
A	that's what your dad said
B	yeah
C	and then they go
A	I wasn't sick one once from the radiation
C	no but I'm saying I'm saying like radiation poison poisoning so
B	were you not?
C	radiation to your head is going to affect your hair
B	yeah
C	so erm
B	but it's all coming back it's just changed colour
C	yes but it said yeah it lasted but it said that um there's a possibility that if you have it on your head your hair won't come back rather than if you
B	no no of course do you still wear a wig from time to time?
A	I I do occasionally but the only trouble is
A	it's been too hot for starters
B	yeah
A	and it really makes it like as if you've got an wooly hat on
B	yeah
A	and my hairdresser said that if because it you sort of like this because it's it's hot erm it will rub the hair cos you'll
B	yeah
A	because you've got so much hair now there's not really room for hair plus you know I know they wear them in in theatre you have the bonnets don't you? they pull on really tight and then you put your wig over the top but because it's rubbing my hair she said it's gonna you'll lose it faster than it grows
B	yeah yeah I know
A	so I I just tend to
B	it looks good to me just changed colour
C	the thing
A	mm
C	the hormones she's on femara also a side effect of it is thinning hair so you know of
B	yeah
A	I'm fighting against everything
C	you're kind of fighting that
A	we'll get there
C	now what's this called?
B	did you say your printer doesn't work at all?
C	yeah the printer works
B	if I could print a bank statement out I'll bring it to the bank and
C	yeah the printer works it's just the scanner's not working any more the scan we we'll scan it's the it's a software problem not a hardware problem
B	yeah yeah yeah cool
C	erm
B	I just need to print off one thing or with the student loans now dad I've given them my Brighton address so hopefully they'll stop hassling you after that
C	so yeah well it's never really been a hassle
B	yeah I've wondered if you've got random phone calls about me
C	no
A	no
B	random calls cos you haven't? that's amazing because the amount of time I've put your number down cos so many things require a number and I the only number I have in the UK I've given yours but I've worried that maybe you've had random phone calls from people or
C	no no no no only erm
A	they never once asked for you
C	here's a pen
B	oh I know I'm popular
C	did you er you couldn't remember your mum's obviously when you were
B	good god it's yellow
C	yes this is the elephant
B	really?
C	you put you put it might be your mum's cos er address ours is the same number eight
B	yeah
C	but it was you couldn't remember
B	no no no oh what for the
B	no yeah I remember yours well but I don't remember I I remember mum's but I couldn't be a hundred percent certain of it
C	well
B	and that's where my bag's going and I was just like I defiantly know dad's off my heart and I know the telephone number off by heart
C	yeah and actually you've been travelling for quite some time you're quite tired you're thinking
B	I was knackered
C	I'll default with what I know
B	terrible they so many of our bags went missing so many of us so I had a connection in Moscow from Seoul so I flew nine hours to Moscow by the time I landed in Moscow it was already like midnight my time so I was already kind of tired and then we had to run like mad cos they only gave us a one hour transfer
C	that's tight
B	which is tight yeah and Moscow Sheremetyevo or something airport is notoriously busy and notoriously not good just in general and we left late so we actually arrive
C	did they scan?
B	no no we just passed through we kinda had to queue jump so we ran l like mad and it was horrible and obviously
A	mm
C	I was slightly concerned you about your flight path only slightly because of the Ukraine
B	what's been going with Russia
C	plane that got shot down over the Ukraine
B	yeah it concerned me as well a little a little obviously
C	no
[ANNOTATION]	It took speaker B more than eight hours to get from Seoul to Moscow.	Entailment
B	really she makes me nervous
C	you could have
B	I think that's the problem I think you start thinking law of averages something's going to happen at some point if we keep flying you've got my mobile number now though?
[ANNOTATION]	They got the tickers for Moscow quite cheap through a mobile offer.	Neutral
C	yes that's all keyed in
B	yay I have a phone
C	and I put it on to
B	yeah I'll take
C	there's yeah a possibility that
B	that would be a great save
C	if you
A	you won't at the weekend because you switch it off
C	cos yeah as I said
B	do you both switch them off at the weekend?
C	no no
A	no I do
C	no she doesn't
A	I have my normal phone
B	yeah cos I can't get hold of dad
C	this is what I'm saying
[ANNOTATION]	She switches her phone off at the weekend as well.	Contradiction
A	no you won't he'll switch his off
C	if
B	yeah
C	you know if if it's a weekend use
B	yeah cos they were telling me originally that it was going to be delivered on the Sunday and I was kind of panicking a little bit cos I couldn't get hold of you at all on the Sunday
[ANNOTATION]	Delivering it on Sunday wouldn't have been optimal for speaker B.	Entailment
C	no what I was at a barbecue
A	yeah
B	I rang you quite a few times
C	I was I was negotiating the van
B	is that your number?
[ANNOTATION]	C's attended Mr. T's barbecue on Sunday.	Neutral
A	that's my number
B	okay well one second and I just need to write one more number
A	okay
B	zero erm I'm still getting used to this thing
C	yes you're not really a friend with phones are you?
B	no I don't really like phones
C	you get that off of me
B	four two three two erm save to people this is a touch one as well thinking that so it's a little bit confusing shall I give you mine?
A	if you just ring that number it'll tell me yours
B	okay sorry dad?
C	I think your mum used to get hers off of
B	I think that's probably what it is yeah it's a hand me down
C	it's a family air loom
B	did you get it?
C	it's a lot more sophisticated than mine though
B	It does the job I didn't have to pay for it
C	once money exactly all I need a phone for is free I an do my texts I don't want a
B	no this one does that but I don't
C	take photographs and stuff
B	no I just want and I don't even want to ring people I want people to ring me
A	have you got it one pay as you go?
B	yes yeah so it came with I couldn't believe it it came with ten pound credit I made a two minute call to you do you remember that first call we did?
C	yeah
B	three minutes that cost me a pound sixty
C	yeah
B	this thing's forty pence a minute
A	stupid it well you want to
B	forty pence a minute it's gone up quite badly I mean last time I had a mobile phone it was about five pence a minute or something why it's forty pence a minute
A	because you like you're doing pay as you go
B	yeah
A	if you have a contract I don't pay
B	no one's on that yeah contracts you get like loads of stuff but you're tied in for a year
A	I pay
B	or two years or something
A	we
B	five pounds
A	a month yeah and that's all the landline is erm free a hundred minutes for erm to
B	amazing
A	to any other to ordinary phones and all my texts are free
B	I just can't don't want to commit to a year or sometimes even two year contract
C	well you could commit to a year cos you're going to be here for a year aren't you?
B	yeah but don't you normally pay something at the start? you like pay for the phone or something and then you pay like five pound a month six pound a
C	so
A	yeah he's gotta look after his mum
C	I mean I said I we or we automatically default to David
B	sorry that
C	I just got up to speed with them
B	no I'm not either
C	I just see the phone normally cos its work phone is the bringer of bad news
B	someone wants something from me again
C	yeah
B	how's this summer been?
C	well it's unfortunately the seasons changed early this year
A	July was quite good
C	is this is end of summer now then?
A	yes I think so they talk they suggest that August will be below average temperatures
C	I think sometimes there's a little bit of flexibility with the season it it flexes one or the other it flexed the wrong way this this year
B	yeah
C	this time last year it was hot
B	it would have been nice I mean sometimes September's nice isn't it?
C	yes it can be warm
A	I mean it has been if if the sun comes out it's actually quite warm
C	it can be warm but not hot
A	but it's not
B	no
A	I mean it was quite so that you really couldn't do an awful lot
B	and the buildings aren't designed for it here they're not really
A	well and these are we're alright in here
B	yeah this is nice and high
A	it goes really tall and it's cool throughout the house cos there's the brick work and that
B	yeah
A	but then you see it's cold in the winter
B	yeah difficult
A	so you don't yeah
C	my twelve
B	no no too stuffy
C	and with this fungus in her lungs
B	wow
C	about that fast and
B	it's phenomenal how much better you've gotten I mean how bad you were
A	oh yeah I'm really lucky I really am lucky yeah
C	you she turned a corner
A	this time last year
C	she turned a corner I did worry very much when erm erm she wasn't holding down the anti-sickness tablet
B	no we were all worried
C	that is that's when we really started to think you know if you can't hold those down you're not going to get you can't eat anything cos these things things
B	you can't get any treatment
C	they will really hold a lot if you have like the strong erm anti erm erm anti emetics the anti-sickness that are like erm ondansetron erm you could probably eat something off the floor and you wouldn't
B	yeah no worries
C	you wouldn't be sick it's that strong but she was being sick
B	that was bad
C	so yes it was a lot of
B	brilliant turn around
C	I mean it's hard to believe that that the time has gone by and it's almost been a year since
B	yeah
C	but this is for check-ups and stuff
C	she's not actually been
B	that's brilliant
C	which has been good
B	yeah
C	it was a lot
B	so I still can't believe it's been two years since I've seen both of you in in the flesh
A	well time just goes so quickly
B	yes it does
A	it really does
C	yes it's it's it is it does go very fast
C	yeah
B	not too far off
A	no
C	no
A	yeah
B	he he's the same age as me isn't he? twenty-eight
A	he's a little bit erm older than you
A	about three months
B	about three months older
C	well he was born in April wasn't he?
B	I'm May
C	yeah and he's May one month
A	yeah yeah
B	is he the beginning of April though and I'm the end of May?
A	no twenty-seventh of April
B	twenty-ninth of May so there's not a big difference
C	well one month one month
A	just a month
B	exactly
A	yeah
B	so he'll turn thirty before I do
C	yeah
B	thirty I'm not scared about forty a little bit just cos I think it's only a year and a half until I'm thirty and then it's only another ten years till I'm forty and the last ten years have gone really quickly from eighteen to twenty-eight so
C	yes it's yeah
B	if it does that again when I'm forty it's completely terrible
A	big four oh
C	it really does fly
B	I will be sixty-five
A	that's true
C	it's almost enough to put you into tears or is it these onions god
B	yeah but I didn't see an elephant
C	elephant
B	no
C	yes we got it last year eh sorry this year I've got to cut some off erm in in two months' time I'll plant garlic again for to harvest next year
B	er I've got to sign a contract it's a
C	yeah but you're not going to earn enough to pay tax
B	no no
C	well I pay tax
B	I mean I've I've worked out if I can well the
C	well I said I I can hear
B	yeah
C	so
B	but basically I I'm hoping that
C	yes this will not take you this will not trip
B	but the problem is it may a little bit because for their ease they've put
C	yeah yeah
B	so all the money is coming to me
C	what whatever tax you pay will get back
B	yeah
C	you you're going to be under your
B	well I'm not paying they're not taxing me
C	no oh we
B	I'm having to file my own taxes at the end of the year
C	yes well you're going to be under the threshold
B	yeah erm eighteen pound an hour they pay every one hour of recording yeah I have to put in an extra half an hour per recording to listen through it and cut bits and edit bits and erm write I have to fill out some forms for every single thing that I send in general it's another I reckon another half an hour per for every hour that I record
A	it's not bad though is it?
B	it's a pretty good job yeah
C	expect another expect an
B	I don't have to go for job interviews I don't have to worry about teaching or meeting new students or wearing a suit or doing anything
C	and it's also better than having
B	oh yeah no absolutely
C	it's the sort of thing you would have
B	and it's in my field yeah I can put down that I was a researcher for Cambridge University Press
C	yes
B	for their corpus linguistics
C	yeah
B	and what's better I couldn't believe when they first told me but I was saying okay firstly can I be in the recording is that okay? yeah you can be in the recording can I how how many times can I record the same people? unlimited amount of times okay and
C	well every conversation's different isn't it?
B	well how many how many recordings can I send you? as many as you can until next June so I've got and I get paid eighteen pounds an hour so if I can just do five hours of recording a week that's a hundred pounds a week
A	so what does it record on to?
B	MP3
A	oh right
B	so I'm recording onto an MP3 they've given me a Dropbox link so I upload my
A	mm
B	and I've got until June next year which is basically until I finish my degree so
A	yeah
B	it's perfect
C	it will help
A	yeah it's a good thing
B	I contacted them today about transcribing cos somebody after somebody's going to listen to this afterwards and then turn it into a different alphabet I don't know if you know IPA? but if you look in a dictionary sometimes there'll be how you pronounce the word and you
A	yeah
B	it's it's in a different alphabet
A	yeah
B	I can read and write that and I use it to teach like pronunciation because English orthography on English spelling doesn't line up with pronunciation
A	no
B	you have a G and an H and it makes an F sound
A	right
B	so I teach with this different alphabet and they're going to be paying other freelancers to listen to these and type them up in this phonetic alphabet so I contacted her today and said look maybe I'm not quite qualified yet but maybe you know once I'm further headlong into my course maybe if I I have quite an interest in phonology can I get involved with with transcribing?
A	oh right
B	I wonder if they how much they pay for that if they pay an hour just to transcribe cos transcribing it would be difficult I think sitting down for each hour
A	yeah
B	so you'll be you will all be cemented in history
C	yes
B	the cambridge british national corpus two thousand and fourteen if historians ever want to wonder what we sounded like in the year two thousand and fourteen they'll hear us
C	if I if I remembered I was being recorded I'd have used bigger words
C	yes
B	what your accent is what these kind of things but
C	you need to get
A	ain't can't shalln't and not gonna
C	yeah
B	what are these words?
A	ain't can't shalln't and not gonna that's where they say like instead of I can't it's I can't
B	can't?
A	I can't
B	and that's predominantly in
C	Its like
B	because I will have to do my thesis and chances are it'll be on some kind of sociolinguistic variation and if I can find that this area hasn't been properly marked as an accent or a dialect but but does have enough grammar or syntactical differences to make it its own dialect then I can potentially do my thesis on that
A	sorry?
B	do you think you and dad have the same accent?
A	no
C	this is gonna have to be green er yellow
B	thirty-five years in
A	yeah erm so I think I pick it up and use probably some of the
B	vernacular yeah
A	yeah whereas your dad doesn't
B	no
A	no doesn't I don't think I've never heard him say can't I know I say it
B	no you say it sometimes yeah it slips
A	yeah erm
B	so you think you say it more than he does purely because you've lived here longer?
A	probably
B	yeah?
A	yeah
B	I mean what
A	yeah
B	bottles what?
C	this person doesn't
A	no this person has adds his Americanisms in we're going in the garage
B	oh dad does?
A	yeah
B	he says garage
A	terrible oh and we found a vase
B	does he say advertisement
C	no I just use garage
B	advertisements
C	tomato zucchini erm
B	yeah why do you use the Americanisms
A	oregano
C	I don't know
A	he just does he just starts it's so annoying
B	oregano and basil
A	yeah or
B	why?
C	oregano I say
B	you watch too much American TV
A	yeah
C	well I was there for a while you know three weeks and I it kind of stuck
B	oh you're going to pick up the accent yeah three weeks
C	well yeah I know I didn't pick up the accent I I I utilised the
B	I mean I lived in India for five months do I sound like an Indian?
C	I utilised the lingo
[ANNOTATION]	speaker b has never been to the asian continent	Contradiction
C	some of the words I thought I can't I prefer those I'd rather them
A	no they're horrible well don't come back here and
B	so do you say do you say aluminium?
C	yes cos I can't say the other word
B	you just physically can't?
C	yes I have difficulty with alluminuminium
C	so I say alluvium cos it's easier
B	you didn't even say it correctly that time
C	to say I say
B	you did some kind of mix of the two
C	it's easier to say right I'm going to
B	I used to have have be adverse to Americanisms I couldn't stand them when I was younger I really didn't like the sound of them now I'm very used to them there are certain words that really sounds nice like candy to me that's the most American word in existence candy do you want some candy?
A	I don't think I've really had much to do with American language to be fair
B	no
[ANNOTATION]	they are talking about accents	Entailment
A	er
B	I've had quite a lot recently
A	you've got friends in America haven't you?
B	yeah a lot of friends in America
[ANNOTATION]	speaker a doesn't have a lot of contact with america	Entailment
A	yeah
B	most people that teach out in Korea are American
C	and what's happened to
B	oh god I haven't heard from him really he's erm I think he takes our friendship for granted a little bit so he doesn't feel like he has to contact me but I erm I could do with an email from him from time to time
C	yes well it can't be a one way street can it?
B	no but I've given up whatever he'll contact me when he he contacted me a couple of weeks back
C	are are you erm is that still going?
B	yeah as long as you're not going to be longer than how long do you think
[ANNOTATION]	speaker c knows many koreans	Neutral
C	about thirty seconds
B	thirty seconds hang on a minute if we could be silent now
C	keep talking
B	okay I asked whether I could do that I wasn't sure whether I could pause it mid stream but she said provided the same people are around and the same kind of discourse is going on afterwards so it should be alright
C	yeah I was going to say it's just a a a crude noise
B	you're quite good people to record actually mum's there's like
A	oh right
C	have you put erm have you done your mum?
B	yeah a little bit I mean so far I've got seven hours recorded
C	of not of your mum good god
[ANNOTATION]	speaker b records with their phone	Neutral
B	mum
C	does this break
C	cor blimey governor apples and pears
B	bit of cockney rhyming slang I got
C	oh yeah
B	about an hour and hour and a half last night I had to edit it down a bit but
C	how is he?
[ANNOTATION]	speaker b's mother is still alive	Entailment
B	he's good it's good to see him he sounds so local it's unreal the way he talks his erm relative pronouns so which where when you know I said that's the man who gives me bread or that's the house in which my father lives
C	yeah
B	these connectors they're relative pronouns he replaces them all with what that's the man what my father knows that's the house what my friend lives in he replaces them all with what every single one of them
B	he says a a lot of things erm he uses erm
C	he could be your erm
B	personal pronouns incorrectly as well
C	he could be your
B	somebody I could study yeah I'll tell you what I've been looking in recently to doing I could deviate now and do a different masters and with one more year I could be a speech therapist and that's kind of interesting
A	mm
C	I think what
B	computer science
C	yes I mean computers or science in in isolation is quite
B	he's good at it though
C	but to combine well fortunately he is I mean
B	oh
C	to do his job they couldn't get one bloke couldn't do it
B	that's interesting
B	yeah
C	and
B	no
C	to so that he does this
B	he got the job
C	I didn't say to
B	and he got it if he erm pursues a career and is successful in a career in in his area he'll end up being the most successful of the all the
C	probably that won't be too hard
B	no none of us have set the bar too high have we? do you see
C	I haven't seen him for some time I spoke to
B	he keeps saying something on Facebook like really vague messages that sound like he's having a bit of a bad time but I haven't
C	he's been having a bit of a bad time with his missus I don't know if they're together or apart he says they're together but I'm erm the meat mince is it oh it's in
A	I don't know
C	in
A	yeah you kept it's by the sink
C	oh right I'm looking in the fridge and in the microwave
C	erm
B	he's getting worse is he?
C	I don't always believe he's my half-brother but I don't always believe what he says I take it with a pinch of salt so I
B	yeah okay
C	although er erm you know so everything he says I don't take it seriously but erm
B	yeah there aren't many of us and if
C	well no erm going back to my
B	yeah
C	she's got loads so er yes I could genetically hit the buffers after you two if you don't have children
B	I'm sure
C	I don't think erm you know at the end of the day grandchildren are nice I'm sure I'm going to get grandchildren from some quarter you know anyway but erm if you two don't erm deliver erm
C	it just er I'm sure your mum will be
B	yeah weren't panning out
B	yeah I can't believe he's had children no
C	oh you what
B	maybe at the age of forty
C	your biological clock isn't ticking hers is
B	hers is we just said we'll probably adopt if we end up having children
C	wow
B	just when we're forty or something and then at least we can choose and we were thinking if
B	so if I pay for them to go to uni and then we've got an agreement going on and then they just pay they sort us out when we're old
C	when you're old yeah that's what they say be nice to your parent erm to your children cos there's the ones that chose what old people's home you're going to go in
A	erm
C	you left it upstairs
A	upstairs yeah
B	shall I grab it?
A	it's up to you
B	I'll leave this on so continue
A	alright thank you
C	yes did you your mum wouldn't have come today I I I tried I rang about between twelve and one she must have been in the garden or out or something
A	well I was just coming in the front door and the erm and I heard the phone and by the time I'd walked from the front door to the phone it had stopped
C	I did ring from work
A	you didn't phone back
C	I
A	you didn't
C	no cos I thought er well I think something cropped up
A	I was going to say cos if anything had happened you'd
C	yeah
C	I just assumed you were with your mum it was that you'd seen her the day before erm something cropped up and I I I didn't give it another thought
A	I just walked into town
C	oh right you Fitzwilliam or do you go the long way now?
A	no Fitzwilliam
C	just up the hill?
A	yeah I wanted to get
B	these orchids are lovely
C	did you think that erm
B	erm I've seen him on Skype so not lots
C	I think that erm he will have more of a relationship with
B	yeah it's not that subconscious it's quite overt
C	and erm for you he will a brother's the person that you were punching in the back of the car
B	yeah
