D	no but you know like they have like Lacoste and like Harvey Nicks so he had like little like shorts on and then he had like loafers and then like like a bright pink polo t-shirt like a Lacoste polo t-shirt Prada sunglasses and one of those little side bags
B	lol lol
D	and he just turned up and he was like I'm
D	fucking amazing
D	and then we were doing this like
B	he said you look like a dick?
D	no like the thing like
A	and
D	yeah
A	yeah
D	it it's called guess what it's actually called in the trade? an ego ramp
B	ego ramp?
D	yeah
C	wow
D	yeah like they basically go out into the audience called ego ramps
C	no way
D	oh the best I think I probably told you about this
D	gotta be Bob
B	if you're talking reggae
D	yeah he was like
D	become
D	but he's fucking amazing
C	ah er
D	I can't I really wanna remember
C	I don't even know what that means
D	as he came in
B	yeah
D	what's he called? like the dude in The Inbetweeners Jay
C	oh my god that's so funny about Bob Marley
A	that's funny about
B	and if you're talking folk gotta be Bob
A	I
D	I actually go down those
D	he had like a proper little waddle as well you know like
D	fuck I forgot about him
D	that's a great time
C	well I'm glad we're being represented overseas that's all I'm gonna say
B	constantly
C	truly
C	truly represented
D	you know I hate like ah I really did fuck up in America
C	yeah well you probably were just like too embarrassed about the fact that you're English
D	no like every time I hung out with English people it could get really embarrassing
B	oh
D	yeah
D	no
B	and
D	what?
B	you were like shouting and like threw a beer over the neighbour's fence or something
A	I got in trouble with
B	we were talking about it today
D	sorry
B	it's like we we were just going round
D	I had a massive argument with someone as well
B	and I was like
A	cos I I remember cos I was also kind of being a dick at that party too a bit I think me and
D	I got in a massive I think I got in a massive
C	maybe she
D	I was like I'm sure I know you and she's like no you don't and then it got we got it got really heated
B	I know there was like there was a little arguing a little bit of shouting a bit of
B	and I was like yeah he's with me
B	it was quite fun
A	yeah that house is really fun it just feels like really hot girls were
D	whose house was it?
A	it was where
A	he's like found himself in Thailand
D	yeah
A	yeah that really fact that he's well up for rehab and like
D	yeah I was
C	what's he doing there?
A	rehab and he's he's like writing all this stuff on the internet about how great rehab is
D	he's like I fucking love it here
B	I thought he was living with Macaulay Culkin in Paris?
A	yeah I think that stopped
B	that stopped?
D	that's so bizarre
B	what's Macaulay Culkin doing now then?
D	don't know
B	I thought he was in a band isn't he?
D	isn't he in a band called like Pizza or something
B	yeah
C	he's called Pizza?
B	yeah something like that
C	it's called Pizza?
D	it's like called like Let's Get Pizza
B	I think so
A	I think that's funny how he went out with Mila Kunis for like five years
D	oh man
B	she who does she go out with now? Ashton Kutcher that's a good match isn't it? they've had a baby now
A	how old is Ashton Kutcher anyway? is he really old or?
D	he's probably like thirty something
B	yeah maybe like thirty-five
D	who did he go out with? that old chick
B	Demi Moore
D	Demi Moore
B	you got
D	no I have one with buffaloes for some reason
D	it's like
D	but that's a weird thing to have a synergy with
B	got the same thing with tits
A	the
A	that buffalo farm I've got on Instagram that
D	oh yeah
D	but I've met two people that know her
B	but like I thought she was a farmer but then I looked it said like social and digital media
D	yeah
B	for a marketing blah blah blah
B	it's just loads of pics of her dog
D	yeah it's kind of boring
B	and she's really pretty on the
D	yeah I really wanna go to like the American plains that's the one I have like some weird
B	yeah
D	that's
B	that's cool
A	how was erm Kanye West?
D	well he's so fucking ridiculous
B	oh is this real
D	yeah that was I didn't really speak to him that much but he just came in and we're not allowed to have any music and they just put some
B	his own songs?
D	yeah
B	and like
D	like
B	what did you what kind of stuff did you have to do for him?
D	I actually had to do nothing I just stood around for the entire day and to heat up some salmon that was it
D	and then like talk to him about it
B	heat my salmon
D	his fashion line for a little bit and he got this like Ebola photographer to shoot his like fashion campaign he's like I found this chick that shoots like Ebola survivors
D	and he's like so I was like I'll get her to shoot fashion
D	it's quite funny
B	fashion that matters
A	and he had to put his coat in the freezer
D	oh we didn't have to do that in the end he decided not to do it
B	haven't even
C	wait is that more wine or?
B	no there's another bottle there but it's not open yet
C	oh thank god for that
D	yeah it was a really funny photo it's not on my phone it's on
B	yeah
D	and just got this photo of Kanye like dancing round being all like
D	it's quite funny
D	I really like it
A	do you? but have you seen the video?
D	I haven't seen the video
A	it's weird man there's like Paul McCartney like jamming on his guitar
D	so weird no he did he said about that he was like this is my year like he's like this year I'm only gonna work with legends he's like I worked with Paul
B	who was he saying that to like? to you? does he just talk like that all the time?
D	yeah he talked to
D	like honestly
B	what what what was he saying?
D	he was like yeah and like he like he designed them
A	must be on something
D	so he like told her like how he designed them and he's like there's woman ones and the heels are this and I saw this like
A	I bet he's I bet he's been trained to do that
D	no I think he's just like
B	I I wish I could have seen him and
D	oh my god it was really kind of
B	oh my god he sounds insane like a crazy old man but like the
A	yeah
D	that's amazing
A	or at least funny
D	he's just like saying the most retarded stuff and you're not like shut up Kanye you're like
C	did he have a GSOH? does he like was he like
D	oh no he's got no he's like not lol he's like deadly serious about anything
B	oh
D	and like
A	did he seem like really wired? like erm
D	yeah he does like he was like a kid with ADHD he was really just like oh
D	like anything and like you give him a chance to talk about anything and it his whole thing is like it just
D	you know? it's just like
A	Kanye West is in art school
D	yeah he's just like
A	and er
D	art school was like a massive bunch of
B	yeah yeah yeah yeah
D	yeah
D	yeah it's
D	it was also like terrifying that so many people like he has so much power and influence over people
C	so I
C	I don't fully know who he is
B	he's like a rapper a famous
D	come on you can't know not know who Kanye West is
C	ah yeah I well like I have a like I have a feeling of like I know that and I know
B	yeah
C	but like he does he doesn't have any influence over me
B	mm
D	I wish I could be in your position he's so like present in my life
D	all the time
B	just right now or like
D	no forever
B	I wish I could be like
D	the amount of conversations I have to have on a daily basis about Kanye West it's ridiculous
D	it's all I talk about
B	I feel quite
C	yeah yeah I feel quite liberated actually I I feel quite free
D	how did you get to be in such a
C	I don't know
D	fuck
C	I
D	I really work
D	oh fuck
A	talk about his wife?
D	I didn't talk about his wife although I did walk into one walked into his dressing room at one point and he
D	but he he's like really
C	wow
D	then I walked out
C	yeah
D	stole an album from him
C	wait
D	I just
C	what do you even do? I don't I don't know what you do
D	I was his fluffer
D	get him ready
B	he's a nanny
D	and we were producing a photoshoot
C	but what do you do like what's your normal like what's your job title in the life?
D	like at the moment like production manager
C	okay right oh
D	so for like
C	so you make
D	I'm not very good at making it happen but yeah
C	that's your job?
D	yeah
C	okay cool
D	have to like find stupid shit people are like I wanna shoot in a castle that's got like da da da
C	yeah
D	and I
C	yeah
D	and ah
C	the people that were like loads of people have ideas you can always like people who actually do it are the people
D	well it's quite strange
C	yeah
D	you know I'm just like fine why don't I just
C	yeah
D	make my own idea happen?
C	yeah
D	it's really depressing but the reason I'm learning how to do it
C	yeah
D	not that there's any magic like this is like I know it sounds stupid but it's like I always was just like how does like this shit happen? like how do they do that? and it's just like you literally just you know and someone's like yeah I want a badger you literally like google badger farms and phone those people up
C	yeah of course
D	I know it sounds really obvious but I never like
A	can you imagine imagine having to do that stuff before the internet?
C	yeah yeah yeah yeah
D	I always think that I'm just like how the fuck did that happen?
B	and people didn't do such
C	well also it's like trying to it's I mean you you you can you experience that if you try and do something in India cos like the internet doesn't really exist properly
D	yeah but also the I was speaking to someone about this today
C	yeah
D	it's like the way shit does happen is way more like common sense like I remember when I was doing shit in Morocco when we like wanted something there you'd just like go up to someone and ask them
C	yeah yeah yeah yeah
D	or like in India it's like hey I want a palm tree so like I
C	yeah yeah yeah yeah yeah
D	and it's like I need a motorbike and they just go up to him and be like can I borrow your motorbike? here's it's like you have to call a fucking motorbike fixing agent and sign the fucking form and
C	yeah yeah yeah yeah it's a weird like it's a weird sort of er like double like parallel thing where in one civilisation that's like really like it in some ways in the UK it's really easy to do like all sorts of stuff and in some ways it's really really difficult and
B	makes it more over-complicated
C	yeah whereas whereas
D	but we've turned it into the industry and you have to pull all those things in position
C	of course if someone can make money
D	so people have a job
C	at any point and and also pay tax than like at any level
B	and like regulations
C	yeah exactly it becomes really complicated
D	yeah
C	you
D	but it also it's just ridiculous because it's like people just cos they have the ability to ask for stuff just ask for things and that's what's really strange about my job is like you can't just be like do you actually want that? and like have you actually sat there? I was like
C	but why do they do that? just cos they're really rich and
D	cos they fucking can and they're getting paid in
C	yeah
D	another thing I really worked out which I always like walking around here being like how the fuck are these people drinking lattes all day? like what the fuck do they do? how are they buying like
C	yeah
D	like
C	also lattes cost er one percent over
D	yeah
C	so like there'll be lots of people
D	no but you know what I mean you go into like
C	no of course but there are lots of people like who who who can look as if they're really money but actually
D	yeah true
C	you know what I mean? and I think
D	yeah no it is
C	you know it's kind of it like there's a weird like they're
D	there aren't like at risk signifiers
C	indicators yeah
D	yeah
C	and and and the people who drink lattes are also drinking lattes with the people who are unemployed like they're work like they're in the same cafés you know and that's kind of weird
B	they should have they should have separate cafés for poor people cos
C	I really think they should have separate
C	I don't wanna be
D	I don't think they should let poor people drink lattes
B	the amount of
B	so I can
D	but yeah it is gross how much some of
D	and the makeup artist was getting paid ten-and-a-half grand
B	that's so crazy
D	to do makeup for one day
C	what?
D	and her assistant got paid two hundred pounds I'm like
B	was both
B	erm what and why do you think that is? because the make cos the makeup is like really good?
D	cos they have to install like the hierarchy
B	it was
D	honestly she it's just like
C	she did a what sorry?
B	it's incredible
B	it's cheaper than getting George Clooney in though
C	yeah that's true
A	what was that?
D	we have this like
D	ten-and-a-half grand it's cheaper than getting George
D	it's gross though man honestly like the money some people get paid
A	I know it's like I know this makeup designer who like has a crush on me I was trying to get him
D	oh fuck
C	what happened did you turn them down?
A	no I just wasn't that you know I was trying to get
C	oh yeah
A	I mean I probably could have done it if I'd emailed him more often couldn't really I didn't really wanna do it
B	why don't you do it this holiday?
A	I need to see him again
D	who
B	you basically need to go round his house and do
C	yeah it is a bit like
D	yeah pretty much
C	yeah it'll be a bit awkward if you have to like kind of do that other stuff to get the job that's a bit weird
D	and how do you get those
B	he wants to blow me off
C	yeah that's what I mean it's just like
D	honestly though most of the shit most of the shoots we do
C	but you don't wanna like woo hoo woo hoo woo hoo woo hoo
C	ah sorry sorry I got I got the
B	that's absolutely no problem
C	I got the complete wrong end of the stick
D	but honestly like doing like fashion shoots like ads or whatever it is literally just like a massive hangout like no one really does anything you take like
C	it's so annoying
D	it's really really boring
B	people sitting around and then they have like a massive lunch
D	yeah they just have like
B	sit around
D	a big lunch and then like everyone that's working for them are just like they're paid friends cos actually the people that are like there they're like really sad and they've just like paid people to like hang around them that are their assistants
B	there are so many people wasting their time just sitting there all day
D	dude I'm wasting so much of my life right now
C	yeah but you get paid for it right?
D	yeah I get paid fuck all
C	it's better than doing nothing that's your job
D	and I can just figure out which bit I'm gonna do
C	you're probably getting paid more than minimum wage
D	dunno
C	how much is minimum wage now? six-and-a-half?
A	why don't you make up a story about Kanye West and sell it?
D	Kanye West is designing ISIS uniforms
B	ISIS
D	although that was
A	ISIS is real and therefore I'm making fashion attack
D	this this erm big idea that they
D	from nowhere he just came up to me and
D	I'm really good at speaking to people like that though I just fucking I love it
B	and you're like yeah yeah cool definitely you should do that
C	yeah
D	yeah
C	so good
B	that I guess I guess the that was a similar thing it was like
D	I
D	I think that's like my main skill cos I was like I need to get a skill I think I just have to accept that that is my skill
[ANNOTATION]	speaker b believes speaker d has to do it	Contradiction
B	chat shit
D	just like I can chat I'm not very good at like talking to people about actual stuff that's real but if it's just like nonsense like I could go on for hours like that weird date I went on the other day I had like nothing to say to her and it was actually like a curse because cos I had nothing to say to her I could just chat about absolute crap
A	she probably thinks like
D	what's your favourite animal? and then just like went on about it for like hours
C	wait what?
A	wait wait wait wait
[ANNOTATION]	speaker d did not go out on a date	Contradiction
D	just like I don't even know what I just like animals that I
B	I don't even know
D	no no there wasn't like a bad
A	by Philip Pullman I think
B	huh?
C	yeah that's why I'm thinking like
D	oh no I was just talking about animals that I
C	oh I see right it's not like an actual specific thing it's just
B	but in like no in American Indian culture like your spirit animal is like the animal in the wild that you're most connected to
[ANNOTATION]	speaker d talked about animals in their date	Entailment
C	most connected to ah okay right yeah
D	yeah
B	and you can have like a
C	okay
B	where you go into the mountain and like
C	oh I see okay
B	have like isolation and like discover
C	ah see I felt like maybe
D	but also you're meant to kill them aren't you?
D	you're meant to like you kill your spirit when you kill an animal in like native America you like wear all its stuff cos then you like embody the powers of the animal which
[ANNOTATION]	in American Indian culture, your spirit animal is an animal you feel spiritually connected to	Entailment
B	calling upon the power of ten tigers
D	what?
B	er it's from a cartoon Captain Planet he calls upon the power of ten tigers
D	I call up the power of ten do you know one thing I'd love in life? would be an animal whistle if I could
C	yeah that'd be cool
B	or like a dragon
D	think about it
[ANNOTATION]	speaker c's favourite animal is the elephant	Neutral
D	or like a bird
A	yeah they have like hawks falcons
D	yeah that used to be a big you can make crows do it you can make crows follow you ravens
B	it's quite easy to create train crows
D	cos they used to do it and like
A	but you've just got to never ever squeeze a full owl
D	what?
C	that's right
B	tell
D	what?
B	never squeeze a full owl tell
D	I like this is like storytelling like
A	show and tell
D	show and tell
C	I like it when we can tell a story
D	stories are great
C	so
C	and he was like kind of a bit of a bully
C	and the guy was like ah yes this is a perfect example of the of the dominant you know baby owl
B	baby baby chick like remains
B	that he's eaten just like an early like all over the floor
B	and the guy was like
B	and he was just like
C	never squeeze a full owl
C	and then the owl like started eating it again
C	amazing
B	what was that weird falcon dude that we met outside
A	I know I was just thinking about him
B	we were really
B	ah
A	he thought you'd asked him what are your plans
B	I was like do they eat plants? and he goes oh well I guess like I'm gonna do this for a while but it's always been my dream to like study like marine biology or something like
C	ah
A	but the weird thing was
B	I was like
A	the weird thing was obviously he kept touching his crotch
B	and he had an erection
D	shut up
B	yeah he was talking to us we were we were like he was a volunteer and he was really dorky and we were like sort of like wasters we were like really engaging and like chatting loads and being like really overly interested and like falcon like the whatever the fuck was going on and erm asking loads of questions and then he misheard when I asked if they like eating plants and thought that I was asking about his hopes and dreams
B	and then he we realised he had an erection
D	why did he have?
B	don't touch the
B	I don't know I think he was just
D	falcons are pretty sexy
C	wait but were there falcons like flying around or?
A	yeah there was one perched on the top of a table
C	oh well to be honest I'm not surprised
A	he was like having a look through my telescope like a peeping tom
C	oh
B	yeah
C	that's
A	peeping tom
B	we were like gotta go
D	that would be pretty cool that
B	good luck with your good luck with your plans
B	by the way do they eat plants or not?
B	well I thought I'd do this for a while and then maybe move back home er
C	oh
A	I saw like an eagle or a falcon like swoop on a pigeon in New York once
B	cool
A	and
C	what? that's crazy
D	I got attacked by a falcon twice in LA
C	shut up
D	I told you about it
C	what?
B	in LA?
D	like outside my house like you have to come down these little stair
D	a hundred percent
C	really looking forward to this story
D	there was a tree opposite my house so like my house is like a building you have to come down the stair like this and there's a door but like an outside door and I came out and I was like jogging to my car and I usually wore
A	the only time er he's get exercise
D	and something just
D	and I like something just fucking smacked me across the back of the head I turned around like really fucking hurt I turned around and a falcon was flying off and basically my head was bleeding and it swooped down and dug its claws into my head
B	it thought you were a rabbit
D	it thought I was a rabbit
B	ah
D	and then I was like I was fucking freaked out like fucking scared out of my life cos I was like I'm getting attacked by a fucking falcon
D	and I was like my like shitty car I drove to work and then like three days later it happened again and this time I was going into my house so every day
D	yeah it lived in a tree opposite my house and I was going into my house it swooped down and did it again and then it went to my door was there and it went like
B	bitch
D	so I had to throw a stone at it I was terrified
C	oh fucking hell
D	so then every other day
D	I just walked to my car with a bag and swing it round my head like this
D	to keep it away
B	you should have just pressed your face against its little fucking kill you
D	I'll fucking kill you
B	yeah
D	and throwing its
C	dude that's crazy
D	it was so scary man
C	but
D	and my head was like fully like it fully dug its talons into my head but I thought somewhere literally I thought someone had come up and just like punched me in the back of the head
B	motherfucker
C	but was it wild or did someone own it?
A	wild
C	a wild one?
D	I think it was wild yeah
B	sounds pretty wild
C	fuck man that's really that's a great story that's an excellent story
D	but then I had this like weird thing with like I thought it was like cos I was thinking of leaving
C	oh
D	and it felt like really spiritual
A	a spirit animal
D	I do like peregrine falcons a lot
C	I like peregrine falcons
D	I like an osprey as well
C	I like an osprey
D	I've been listening to this really good radio programme about ospreys
C	really?
D	yeah
C	nice
D	and he like puts radio transmitters on them and like tracks their migration patterns
C	yeah that's pretty cool man
D	they fucking go far man and then
C	yeah
D	this osprey like does different routes back from Africa
C	fuck
D	and then they the osprey his girlfriend cheated on him he didn't get back in time he took a different route and he didn't get back in time
C	no
D	and another man osprey moved into his nest
C	ah you're kidding?
D	and he got back
C	are they wait are they the ones that erm like pair up for life?
D	I don't know
A	that's like foxes
D	like ejaculated
A	barbed
B	and dogs right
C	and cats are barbed too
D	but they have to be in free-fall while they're having sex
C	what?
D	so they have to basically fly up really really high
B	that's amazing
D	start having sex and then they just free-fall so sometimes they don't get high enough or she's not good enough and he doesn't come they just fucking die and they just plummet into the floor
B	what if he's not good enough? then what happens?
C	she's not hot enough
D	yeah it's risky well like that's like the most extreme sex in the world you're plummeting towards earth and if you don't finish in time you just crash into earth cos you can't separate and they can't fly when they're together
C	they can't? dude that's
A	it's like trying to like pee through an ocean when you're treading water
D	there's a really good documentary about it just like animal sex
D	slug sex is like
C	oh no I don't like I don't like it
A	I thought slugs were asexual?
D	no slugs the way they slugs are like they have both sexual organs
B	yeah
D	and they have this giant
D	yeah they have these
C	fuck
D	blue penises that come out their heads
C	wait normal slugs that we see every day?
C	shut up
D	there's this beautiful documentary and what they do
A	beautiful
D	no it's honestly it's amazing
C	I
D	what they do they wrap they wrap around each other like they like intertwine and then they like make themselves all salivary and like drip down and they spin around and then a giant blue penis comes out the head and they like wrap it around each other and just
C	hang on
D	oh fuck I was gonna wear these to work tomorrow
D	my best falling asleep was
D	and
A	well French
D	mm
B	we fell asleep with wine in
D	where?
B	and then
B	and I spilled it on my crotch
B	it was the middle of the day
A	it was white wine
B	I woke up I had a wet crotch and no wine
C	it was alright at least it was wine
D	do you reckon I should pour white wine on that now?
C	yeah I think we drank it all
D	shit
C	no there's a drop there
B	there's a
D	does that actually work?
A	I dunno
C	yeah
A	do you remember when we saw
C	use use the stuff in the glass
A	wait yeah used to wait
D	you just pour it on
A	remember when we saw
B	yeah
D	ah that's really cold
D	when we was kids
B	when we was kids this guy
B	and erm he spilt red wine we were all like drunk in his house he spilt red wine on the floor and he goes oh no oh no oh no put red wine on it and poured
B	he used to say like you know like somebody cut themselves he goes
B	yeah
D	shut up
B	no no I know salt in the wound
C	mm
B	put red wine on it
D	but anyway there's this there's this mouse
A	this'll sort it out
D	this type of
D	that erm
D	basically it doesn't have sex its whole life and then when it comes into season it just has sex straight for like nonstop it just like goes on a little rampage for like
C	like a holiday in Ibiza
D	it just runs out of energy and its hair starts falls out cos it's like so tired and it gets like really scrawny and it's just fucking for like five days
A	that's like
D	no and then it dies it just dies of exhaustion because it fucks itself to death
A	wow
D	and it like goes scrawny and its hair starts falling out and da da but he impregnates like
B	still getting laid yeah
D	you know like seven hundred mice ladies
C	wow
