C	something to eat dear?
D	I think I'll have a curry
C	so will I a large one cos I'm hungry
A	what are the curries like here?
B	they're not bad
A	yeah?
D	yeah they're not bad at all
B	I had one
A	I'll give it a try
B	I preferred it to the takeaway
D	that's the they're the different curries today
A	do you want this one?
B	no it's alright
C	do you get chips with it?
B	no
A	curry
D	you can have a portion
B	can have a
C	a portion a portion of chips for me as well
A	so they've got a tikka a jalfrezi sweet
B	I preferred this curry to the one from the takeout
A	is it all of these ones?
D	yeah
A	oh right that's pretty good
D	it is today
B	six fifteen and includes a drink
C	yeah that ain't bad
A	oh that is good what drinks do they include then? is that on here?
B	yeah it's all the Kronenbourgs and the juices
D	it says at the bottom of there what the things are
A	I said I wasn't gonna have a drink but
A	if it comes with it
C	well I said I wouldn't
A	yeah
B	oh whatever
D	yeah
B	dad's talking about tins on the beach already
B	oh you can get a whisky
A	yeah there's Bell's only
C	that's what I normally drink Bell's
B	got a bit of er a little bottle of er Red Label for the weekend
A	oh nice thank you very much
B	dad saved me his last drop
C	put it on the on the er tab you know what I mean?
B	put it on the tab and I've got a Blackberry as well
A	oh
B	to replace the Vodafone that doesn't work properly
A	nice yeah that one keeps
B	doing something doesn't it?
A	doing random I trying to ring her and it's it does pick up
B	yeah
A	I get a bit worried it's like half eight where is she?
C	can you you could have brought a phone in
B	yeah
D	it goes straight onto answer phone doesn't it when you try phoning it?
A	er this I rang her three times and it rang every time but she didn't hear it
B	oh yeah oh right I just did it and that was kinda my fault that time
D	ah
A	was that your fault that time? I didn't know if it was the phone
D	oh
A	yeah but
D	oh see whether whenever I try it just goes straight onto answer phone
C	yeah it does on that one
B	don't know we'll see if the other one's any better shall we?
C	could have brought it in
B	erm
D	is that new?
A	that Blackberry's pretty good isn't it?
B	yeah
D	oh
B	I just haven't it's just been in a box since it's got a bit bent actually but it's nice isn't it?
C	large curry and chips please dear
B	I thought that's why I was wearing what what curry do you go for?
C	I go for the the extra one
D	yeah but what one do you want? well you've been having the jalfrezi
C	the one with the extra bits on it
D	no
C	I don't know
B	I might have the rogan josh
D	you get extra bits in all of them
A	that's what I was thinking
D	but I can't remember which curry you actually had oh that's a new one
A	this is different it's not the same as the one in
B	is it not?
A	said it was the same no
B	oh no it doesn't look the same as the one in
A	doesn't look the same at all
B	in
A	they've got different whiskys on here as well
B	they've changed it since we were last here
A	ah
B	when I when I ordered the burger last time it was down in this section they they've updated their menu
A	it's more expensive this is two forty in
B	oh is it?
A	yeah
B	we did one
A	so it is different different versions
B	unless it's just gone up check your menu again
D	that's
A	I was only there like a few days ago
B	alright then
A	last weekend
D	that's sweet potato chickpea and spinach curry is a new one
B	oh right so they've updated their menu again
D	yeah
A	you gonna go for that one?
B	are you getting the large
D	no I don't think so
C	or maybe er
A	what what tickles your fancy? what do you normally have?
D	erm the jalfrezi I think is it?
A	yeah chicken jalfrezi
D	yeah
[ANNOTATION]	Person D said that he normally have chicken jalfrezi	Entailment
C	is that what I normally have?
D	I think so
A	I might go for the lamb
B	mm rogan josh
A	is it curries all round then?
C	yeah
B	yeah looks like it doesn't it?
A	sounds like a good idea are you getting a drink?
[ANNOTATION]	Person A think that Person B's idea is a good one but have a drink might make it better	Entailment
B	ah probably
A	I mean it does come with it
C	it comes with a drink anyway
A	it comes with it seems a bit silly not to get it doesn't it?
D	I might have the rogan josh actually cos we don't often have a lamb one do we?
B	I like it I'm tempted by the chicken tikka masala
[ANNOTATION]	Person B think that chicken with tikka masala is tempting	Neutral
C	I'll have a chicken tikka masala
D	well that's what you have normally off of that menu when that's what they do any er
B	anyway
D	anyway they always have that one you don't normally have that on not when not when it's curry day
A	that guess it's pointing not
B	oh yeah
A	the ambient sound
D	you could that's going large you can have that with all of them
C	right let's get that then
[ANNOTATION]	Person C like to gonna have that with all the accessories	Neutral
D	it doesn't matter which curry you have you can have that with it
C	alright rose petal go and get it
B	I'm still debating give me a second
A	you having chips with it
D	so you make your curry large by adding a vegetable samosa and a large onion bhaji
C	that's it that's it
B	ah
[ANNOTATION]	Person B need another chance or second chance	Entailment
A	does it make the actual curry large? or does it just
D	no
C	no
B	no you just get a bhaji and a samosa
A	you just get more
D	yeah you just get a bhaji and
B	I dunno whether to make one of ours large how much is a large then?
[ANNOTATION]	Person B is going to dance	Contradiction
A	we can make one of them large and we'll share the samosa and the bhaji
B	bhaji
C	and their portion of chips
D	I think it's an extra pound
B	and er does it not come with where did the chips come with the?
B	ah right
C	but I I don't like them wafer things
B	no yeah
A	poppadums
B	poppadums yeah they're a bit of a nonentity aren't they?
C	yeah waste of time really
B	I don't know whether to get a rogan josh or a chicken tikka masala
B	alright alright I
C	yeah you did
B	so maybe I'll get the tikka masala or a chicken balti
D	oh I think I might have had the rogan josh last time when you had it didn't I?
B	yeah
D	cos the lamb was really like
B	tender
D	tender wasn't it?
B	yeah it was tender lamb
A	was it good? I'm definitely going for that then
B	alright me too
C	so we'll get three of them and a chicken thingamajig
D	a jalfrezi
A	and is one of ours an extra pound?
B	yeah
A	we'll share it
B	yep
C	we
B	and dad wants some chips to
C	and chips
B	what beer do you want dad? Kronenbourg
C	that'll do
A	I'll have Kronenbourg as well
B	two Kronenbourgs
A	it's pretty good isn't it? six quid for a beer and a curry
B	curry yeah you can't really beat it especially I mean as you're gonna pay a load more somewhere else but then you're paying quite a lot more and is it really that much better?
A	did you see that noodle house just as you walked down?
B	yeah yeah yeah
A	it's like eight pound for a tiny little bowl of some noodle thing
B	oh is it?
A	it's terrible
B	I went I went to the menu just over there the Middle Eastern place it's about eight or nine pound a dish but I reckon it might be quite tasty
A	yeah
D	so if I get a a lager as well will somebody be able to finish mine off? cos I won't be able to drink a pint
C	yes
A	course he will
B	yeah
C	yes dear go up there get your card out
B	shall we order then? are you two gonna continue talking?
A	yeah yeah are you going up as well?
B	yeah well just
D	come up with me
B	do you need a hand? yeah
A	or I can go and
C	yeah go on then
B	alright then you go and give her a hand
C	and
B	and we'll continue talking shall we? is that better? and a portion of chips
C	yeah chips
D	chips
A	so what was it? are we both one rogan josh one of them's big
D	yeah
B	yep that's all you need to remember
D	three three rogan joshes
A	well I'll remember ours you remember yours
D	one large
B	one chicken jalfrezi and four pints of Kronenbourg
D	and a portion
C	yeah a portion of chips and two bread rolls
A	page fifty
D	table
C	and two bread rolls
B	er two bread rolls
C	can expect that of course
B	no you can see the motor from here
C	that's what I said yeah
B	that's alright isn't it?
C	nothing
B	dying for a
C	well yeah
B	yeah I know but panyard and panying
C	yeah
B	all this all this vocabulary you've enriched me with dad it doesn't mean anything to anyone else
C	yeah I mean when you when it was raining hard you say it's legging hard really
B	oh do you say legging hard as well? yeah well what did you call your dad just dad?
C	yeah
B	and your mum mum?
C	yeah or or father
B	you didn't call them
C	no no
B	not ma pa da ma
C	nah nah
B	those tinker names?
C	nah nah called him the old man or dad or father
B	yeah
C	or the old git
B	yeah we just call him the old man don't we?
C	mm
B	yeah how's
C	yeah I mean
B	yeah yeah
C	that's the trouble
B	he's still alive though so
C	oh blimey yeah and he still has his Tennent's every day
B	I mean his body must be pretty strong really to go through all that
C	well yeah yeah
B	how old's how much older is he than you?
C	only a couple of years
B	oh is he? I always think of him as being quite a bit older than you he's always got
C	well yeah
B	he doesn't always got more of a sunken face and that hasn't he?
[ANNOTATION]	they are talking about a man who is about two years older than speaker c	Entailment
C	yeah nice looking car that innit really?
B	I know it's nice when you come up in that
C	the the new one's even better oh
B	I don't mind the car that's in front of it it's
[ANNOTATION]	there is a white car	Neutral
C	yeah
B	although I bet that boot's not very big
C	yeah nah that's the trouble
B	oh that car's still fine for a few more years
C	but you couldn't park much closer than this could you?
B	no you could bloody see your car dad
C	I mean he was there look and still see him out the window
B	yeah that's true
C	I could have still parked behind that one there even
B	you're tucked away nicely there though aren't you?
[ANNOTATION]	speaker c doesn't know how to park	Contradiction
C	yeah yeah
C	plenty of room round there they come out that bit or go in there there's plenty of room
B	they've got a badge on their dashboard too
C	yeah I see it yeah
B	I bet there's some real ponies in here
C	yeah yeah they don't they don't
B	no
C	especially when you know your way around
B	mm yeah you know all the spots to park then
C	we're getting used to it now though ain't we?
B	mm mm maximising it
B	mm
C	let's get over there
[ANNOTATION]	speaker b wants to buy a new car	Neutral
B	yeah don't
C	oh
B	oh wasn't gonna do this today were we?
A	cold pint of Kronenbourg no never mind
B	oh well I won't study now till tomorrow
[ANNOTATION]	speaker c thinks they will never get used to it	Contradiction
B	pick up from where I left off didn't get anything done today either just tidied up and
C	you see them little tables?
B	yeah nice dad
C	alright aren't they?
B	can't think where to
[ANNOTATION]	speaker c can see some tables	Entailment
C	I mean you just set them up like this
B	yeah
C	you just put your laptop on them and
B	yeah
C	well sit on the settee
B	have your dinner on it and that
C	have you dinner on it or you can sit there on the
B	yeah that is
C	yeah
B	erm which is a bit annoying cos keep I have to clear it off with all my work stuff on it cos when we were sat on the sofa we were sat on a chair and the chair came down lower than the sofa and
C	yeah yeah and it's never been used
B	no
B	that's good isn't it?
C	I'll have a look at that bike when I get get back and all for you
B	mm
C	remind me
B	I'll set up my phone while you're there make sure it all works alright
C	yeah
B	erm how much did
C	doesn't matter enough
B	yeah I bet
C	well I thought of you straightaway
B	yeah
C	cos I know that one ain't that good
B	and it works I mean I don't use it for much
C	it's only one for the
B	but if this one's quite it's true if that's got free wi-fi on it
B	yeah dad's a bric-a-brac man isn't he?
A	bric-a-brac
B	can I go for a wee now?
D	yeah
B	I've been busting for ages
D	oh I need to go as well
B	started er I said to
A	oh what?
B	you know I said to you the other day what's a panyard?
C	or
A	never heard of it
B	and it means raining hard but we also say I just said it I'm going for a pany
D	pany it means a wee
B	I only use words like that when I'm in the company of family
A	stylistic variation
B	yeah yeah I definitely
A	the gypsy blood comes out
B	yeah
B	go for a pany or legging it yeah legging it's raining hard
D	legging it is running
C	is raining hard
B	yeah and running raining he says legging it
D	legging it I thought that was running if you're legging it
C	nah legging hard is raining darling
B	guess you can say anything hard can't you?
A	there's a lot of ways of saying it's raining
B	yeah
D	well I've heard legging it for running
B	mm
C	yeah if it's legging hard raining
B	used to say
A	leg it
C	if you wanna leg it you run
D	I haven't heard that before not for raining
C	ah well
D	my bag's there
A	you off as well? how was Belgium then
C	lovely
A	you enjoyed it?
C	food mm
A	what did you have?
C	oh steak burgers er biscotti thing oh that was lovely
A	yeah nice
C	and the bowl it come out in was like a spare wheel
C	oh gorgeous it was really nice
A	would you go back there do you think?
C	yeah
A	yeah
C	yeah
A	great stuff
C	the only thing is driving was fine knowing where you're going is different
A	yeah not the same
C	because if it says
A	you're on the other side of the road I mean
C	blah blah blah blah
C	when in fact you know you don't know where you're going
A	no
C	but yeah I mean driving is just staying on the right when you go round a roundabout you're not that way you're that way
A	it's just everything in reverse
C	and then you stay on the right again
A	yeah you didn't go wrong many times or?
C	no no no no
A	that's good
C	no I think I did once and then I soon corrected that was on a little road no traffic and I corrected it
A	yeah yeah my dad did that once he was going quite fast on the wrong side of the road
C	yeah ah
A	oh crap there's a car coming
C	and you've gotta be so careful but yeah we done well
A	oh that's good
C	yeah got lost a couple of times but
A	how long were you there for?
C	only three days
A	yeah three
C	two nights and a day yeah
A	but you spent a night in two different places?
C	yeah yeah yeah we went
A	oh yeah nice
C	it was like a just one big room boarded like a toilet and bathroom and kitchen all in one at the back yeah it done for the night
A	it had a kitchen in it?
C	yeah yeah
A	you make your own tea or coffee
C	yeah but there was a bistro right next door
A	yeah
C	and we ended up eating there in the end oh dear
A	was Bruges nice? where did you prefer Antwerp or Bruges?
C	for the market in Bruges yeah definitely
A	er
C	yeah there was hundreds of stalls once a year they opened it and there was just well they reckon between seventy and a hundred thousand people visited in a day
A	god
C	it was huge absolutely huge
A	it's like a massive festival isn't it?
C	yeah yeah
A	did you find were were the prices good in the market?
C	yeah weren't bad yeah
A	all in euros?
C	yeah oh yeah in euros
B	the food sounded amazing
A	it did sound nice
D	oh
B	it shits on our
A	Europe's pretty good on that front
C	oh the bread
B	you can see why Europeans come here and like British
C	I mean the bread over here's crap to that over there
A	yeah
B	yeah
C	weren't it? it was really good over there weren't it?
A	it's even worse in Korea
B	people were really friendly and treating them well
A	and it's so clean and tidy and over there
B	should be
C	yeah
B	no
D	when we went to Bruges the satnav the last roundabout you come to the satnav turns you right
B	yeah
D	so which was wrong and we went down and it wasn't there and then this little man come
A	he took you?
D	so off he goes on his little bike his little old legs going
C	road no no no he goes back back back and away
D	and then he
B	is it just cos he was little? was he was he a midget?
D	no no no
C	no no
B	oh right sorry
A	why did you think he was a midget?
B	you said a little man
D	well it's cos he wasn't very tall
B	oh right
D	you know he was just a
C	about the same size as mum
D	no he was a
B	just wondering why
D	well yeah because his little legs were going because we were in the car you know
B	ah so he was going really fast
D	yeah
A	so he was cycling really fast
B	ah
C	and he took us there
D	and he
C	ah that's nice of him
A	it's amazing how kind and helpful people can be when you need
B	they really are
C	out of the blue
A	the amount of times we've had some people just help us for no reason whatsoever
C	he could think we was lost
B	in every country in every country you realise that people aren't what the news makes it out to be
A	no they are genuinely kind and
B	the majority of people are just people
D	are just yeah are nice
A	I mean some people do wanna rob you but they're everywhere
B	yeah yeah
D	yeah
D	happen
B	I mean other than like on the underground or something which is you know
A	yeah have you seen the movie In Bruges at all?
D	no
B	it has a midget in it
D	oh has it? is that why you asked?
A	it's got Colin Farrell in it
B	it's quite er
D	oh
A	it's probably one of the only movies I like him in
B	it's quite funny
A	yeah a little bit rude in a couple of places but
B	it's a little bit rude yeah
C	oh what about that what about that what about that road we walked up?
A	oh fair
B	oh
C	yeah standing like that
A	red light district
D	yeah
C	jet black I thought there's a mannequin what are they doing selling it in there?
B	yeah
C	like
C	I said to mum let's get outta here
D	and the whole street was like it
B	oh
C	yeah
D	the red light district yeah
C	yeah well they're white black and all
D	well it wasn't far from the from the erm
B	I wonder what their if their laws are very similar to Holland in that
A	they must be
D	and then the
B	yeah to have an open shop for it they weren't on the street they were in windows?
D	they were in the windows inside
C	yeah
B	it must be like Holland then
C	yeah
B	it must be legal it must be
C	yeah
C	I think mother said just get out of here
D	and another a bit further up there was another street like it wasn't there so
C	yeah
D	so obviously
C	so we missed that
D	we wandered into the erm seedier part of Antwerp
B	yeah
B	it's weird isn't it seeing them in the window?
A	we did that in Japan didn't we?
B	we were desperately running around trying to find somewhere to call to call in New Year
A	and ended up in the red light district
D	oh
B	cos we were in a weird kind of city it was obviously in the wrong part of the city and er we were going in and out and we went down this road and there were just pictures of Japanese women's faces looking innocent enough but we knew it couldn't have been quite right but they were all like it and we were like we ended up in some golf bar or something
A	or something
B	with the four of us calling in New Year absolutely smashed
A	we were hammered
B	we had a couple of bottles of Jameson's in our bags in the evening so you know
D	who was that with?
D	oh
B	we've got some great photos of us looking horrible
C	good fun
B	yeah
A	good so you'll go again do you think?
D	yeah
C	I would yeah yeah
B	I'd love to come with you to Belgium
C	yeah
B	maybe we should try and make a trip of it before we leave the country
C	yeah
D	yeah that'd be nice
C	I really I really enjoyed it
B	even if we just go into Bruges and
C	yeah that's what
B	and maybe they
A	lovely really lovely
C	yeah the
B	from the war
C	and the chocolate
A	if you watch that movie it's all set in in
C	there's dozens of shops and all this dark
D	didn't buy any chocolate
A	no chocolate?
C	no
D	no
B	they found cheap whisky but they never brought any bottles back with them
C	no
A	oh my gosh
B	dad's been saving me his last little little bit
D	yeah well we thought we'd find it again but we didn't
C	give us that bit
B	ah
A	I don't like dark chocolate though my fault
C	oh I love it
A	do they have good white chocolate there?
C	oh yeah yeah
D	yeah yeah
C	but I like the dark best anything dark chocolate I all day long
B	dad likes I've been buying him that hundred percent stuff what is this? throwing cash around in Wetherspoons
A	a massive wodge of cash
A	bloody hell
A	you should get lunch then shouldn't you?
C	put it in Nationwide while we're here
B	well yeah
D	that's three hundred that
B	wow
C	alright
D	some
C	I bought some games fifteen years ago for fifty P each
D	for for Nintendo
C	and I put them on Ebay Nintendo games
B	you bought them for fifty P?
C	yeah
B	I didn't really I wondered how much you gave for them
C	and and we just got four hundred or something for them but they take their bit out of it
B	you shouldn't
C	you haven't
A	I wish my dad had given me three hundred quid when I see him
B	no wouldn't give me a kiss
C	well ain't the
C	it ain't
D	that's what I wanted the bank for
B	oh right that's what you wanted the bank for?
C	and I thought well Nationwide's only here innit?
B	yeah
C	if you wanna put it in there
C	that's what I said
B	our joint account
A	thank you very much
B	we share my money these days you see
A	you've still got your old account put it in there
B	well
C	that's what I said to mum
B	yeah thank you so
A	I said I wish my dad'd do that I end up paying for him every time I see him
B	he talks a lot though so you you owe money for the
B	he is talking
A	not enough
A	happy birthday by the way
B	thanks dad
C	no
B	you're as young as you feel eh dad? I keep you nice and young
A	it's a landmark
B	when your baby's twenty-seven you've got to be at least
C	thirty
B	fifty-odd haven't you?
B	thirty yeah
A	you're mid-fifties aren't you?
D	yeah I'm late fifties now
B	she's thirty she's got thirty years on me
D	yeah
C	the trouble the trouble with mum as she's getting older she's getting shorter
A	you shrinking?
D	no not yet
B	she hasn't started yet
D	I've always
A	I did think earlier when I saw you
D	I've always no I've always been short
C	when she walked in the sunlight she used to throw a shadow she don't anymore
D	I don't think I haven't got any shorter yet have I?
A	no
B	that's a good one for you
D	I know you do get shorter as you get older but I don't think I've started shrinking yet
B	no you haven't mum
A	shorter what happens? is it just like
D	well your muscles shrink
A	are they just compressed?
B	yeah yeah
D	your muscles
B	cos your bones aren't
C	oi in ten years time you'll be a dwarf
D	I mean my mum was
B	yeah you've only gotta be like under five foot
D	five foot four
D	or five foot two between five foot two and five foot four my mum's height she was four foot ten
A	that's quite a big difference isn't it?
B	er regular regular yep that'll be easier just pass it along mum to
A	let's get rid of all this let's make some space shall we?
B	yeah
D	thank you
B	we don't need these condiments either do we?
A	no
B	at least put them on the end do you want any salt and pepper?
C	no
D	no
B	no I don't think so
A	thank you very much
B	ah it looks good doesn't it?
A	yeah it does look good
B	yeah
A	more
B	yeah get a bit of naan and get a bit of whatever with your pint I mean this is four this is even five pounds in a couple of
B	get a whole meal for that price in here
A	bit of mango chutney
[ANNOTATION]	Person D agree for having some space	Entailment
B	no I don't like it
C	yeah I don't like it
D	I know cos I pushed it along
A	yeah I just burnt myself
B	well you had a warning
[ANNOTATION]	Person B think that Person A didnt pay attention to the warning	Neutral
A	I don't have asbestos hands like you ladies
B	and I I can stand there and hold it for two minutes
A	yeah yeah
B	got like calloused or something didn't it?
D	yeah asbestos fingers
A	yeah yeah
B	asbestos fingers and yeah
A	that's what my mum used to say asbestos fingers
[ANNOTATION]	Person a is going to dance	Contradiction
D	yeah
B	and we've got the two large haven't we dad?
C	yeah have we?
B	no messing about
D	and the chips
C	yeah well I don't like them things
D	well neither does anybody
B	yeah it's a bit of salad or something isn't it? I like the er generous sprucing of er coriander there
A	oh coriander that is generous
[ANNOTATION]	Person A seems like the coriander in the salad	Neutral
B	really really spoilt us with that one
A	do you like your poppadums?
D	not particularly no
A	no?
B	no I don't this so there's enough there without them quite dense now aren't they?
D	mm
A	oi
[ANNOTATION]	Person A was amazed that they do not like poppadums	Neutral
B	I've got monies you've gotta be nice to me now
A	oh right
B	yeah
D	I find them really salty
B	yeah I like
A	here it comes
B	mm mm mm here comes the large try and talk over him maybe
A	is there space for that? just leave it here I'm sure it'll be fine
unknown_female	chicken jalfrezi
B	yeah that's dad's erm and the rogan josh is here should have a oh oh right there cheers
A	thank you very much
C	anybody want them?
B	oh no
unknown_female	I think the samosas are missing if you want
B	yeah yeah the
A	bhaji
B	cheers alright then thank you
C	and the chips
unknown_female	and the chips
C	and the chips what did you do with them?
B	he doesn't like them
D	you could have just put them there or something
A	that's his tip
A	I'll just carry your food
B	the customer's always right and all that
A	yeah
B	that's a bit of a
B	must be a
A	what's this like then?
B	ah I didn't get any seasoning on mine either where's my bit of
A	there you go
B	ah where's my bit of coriander?
A	mm
B	mm
A	it's gonna give me heartburn immediately
B	yeah especially with beer
A	no
D	nah
B	no
A	I suffer from it
B	yeah he does
D	I used to get it when I was pregnant
A	oh god I'm not pregnant am I?
C	well don't get it now you'll get me worried
D	ah could make a
B	make some what? from being pregnant
D	yeah if I was pregnant now it'd be a bloody miracle
A	oh yeah
A	like the bearded lady or something
B	cheers
A	it's true
D	yeah
B	you should have seen my nan
A	it's always those thin wirey ones isn't it?
B	yeah
A	they really weird you out man
B	every time I've cut this mole I think of you mum
