C	sorry
C	and erm making them eat erm chili peppers and trying to tell them that they were something else and things like that you know through experience
B	yeah
C	this is this is what erm
A	you must have missed him out on here
C	this is what erm galvanises
A	and the only reason I've got it on for was because I thought the erm jackpot was fifteen and a half thousand pounds and I just wanted to see it's not very often it gets up that high but it must be something else
B	sorry you want to turn it up? I can stop this
A	no no it's finished now
B	are you sure?
A	yeah
B	sorry if you missed it
A	no it's alright I just wanted I don't listen to it intently it's thank you it's just habit but it's they don't very often win very much like this time they've just won a thousand pounds
B	fifteen grand
A	and it got to fifteen and a half and I just thought oh but it must have been somebody else unless we've missed the one did we have it on yesterday? I can't remember
C	er no we missed it erm just came to the end erm yes I think it's it's experiences like that that galvanise erm I treat
B	because you went through more with him
C	because I grew up with him so and I've always kind of continued to see him you know there hasn't there's probably not been hardly erm there's probably only been about three three years in the last since sixty-nine
A	is that alright?
C	that I haven't seen them
A	the onions are
B	yeah the onions are going into my eyes as well
A	yeah they make mine sore
C	erm so yeah so I don't think your mum does it consciously it's probably but like you said things have to be natural if they you you can't make round pegs go into square holes there's you know but I think erm there will be more of a relationship between him and
B	no I'm I'm not gonna know him obviously erm I can't see myself living close enough even if I did live in England I still wouldn't see him very much
C	no I just don't see you living in England to be fair
B	no
C	this is a stage this is a staging post
B	maybe
A	is that sun in your eyes do you want the blind down?
C	somewhere else
B	no it's okay as long as I don't there you go perfect are you sure?
A	I don't know if it's the right one
B	no it's the other one I think
C	that's the plant that you sent
B	oh that one
C	year
B	oh it's looking healthy
A	it is not we've tried everything
B	will it flower again?
A	hopefully um I've tried everything I've done I tried putting it in the lounge I tried changing it in different positions in the window I just nearly lost it and then your dad said well I'll take it and
B	yeah
A	but now he's he's put it in to erm I bought plant food and everything but it seems to have a hold now
B	well it's climbing up there nicely
A	yeah
B	do you have to encourage it to do that or does it just start climbing?
A	oh no it just goes those trails like mad
C	bit of training
B	you've got a few orchids your kaffir lime tree looks in amazing
C	yes
B	really good
A	window I spoiled
C	it has erm
B	how many can I take?
C	well I'll cut you off some erm leaves I have to make sure that there was something eating away and I I as you can see here hoping I've got it but they're not I don't pick a leaf off when I cut it I cut a branch cos that sends a message to replace branch leaves don't send messages to replace leaves
B	no well if you cut them off a couple of branches that would be great
C	yeah well I'll I'll
A	I've no idea
C	where is
A	you know I ever since you sent that message I came in the same morning that you sent it I went through everything with your dad and mine and then he said to me some time about it ooh so
B	well what what I've got a copy on my computer so we can print it tonight and erm sit down and go through what there is I've organised everything with mum's and
A	but this this person doesn't organise
B	no?
A	no I can just see where
A	yes
B	sounds about right I think that is more right I'm more
A	I like to be organised I like to know where things are as soon as it came through and I went through it yes so that we've got this that and the other I said right I won't remember so when it was all sorted and you put our names by it I said right you need to run that off now so I can look at it and then we can begin to pick it all up
B	yeah
A	and that's as far as it's got
B	I like to be organised too
C	well print it tonight so we can get on the case erm
A	that you can get on the case
B	there was erm there was a table mentioned what kind of sized table is it?
A	it's erm you know the one you had in at your erm house at
B	two collapsible chairs?
A	yeah the chairs are fold up ones
B	no I don't remember that
A	yeah it used to be underneath the window in the kitchen directly behind the as you came in the back door it was just underneath there
C	yes yeah by the window
B	yeah I think I do remember
A	it's an oval one
B	it's big enough to get four people round it would you say or?
C	oh yeah
A	yeah you could it I mean it's not probably overly comfortable but yes you can
C	yeah
A	it's about as wide as that and about as long
B	the table itself doesn't fold down does it? With like a divider in the middle
A	no well it does yes yeah
B	it does?
A	it does cos it's in bits own
B	I think I do remember that yeah that's brilliant I can't remember what else was on the list
A	no
B	I think I can have a look actually I've got it with me this is my new laptop
A	way nice
B	mm remember I've been using that tiny little one for years yeah I upgraded so I could study
C	in style
B	yeah I mean not really in style it's not like
A	are you using that
B	no no I don't need that any more no no no he's not he's run out of cash
C	I was gonna say he told me he told me he wasn't going to
B	he's run out of cash
C	he's over budgeted been
B	yeah you heard those stories then?
C	indeed
B	jesus I'm glad he came out to visit me though I am
C	yes well I I was glad that he didn't bottle it
B	no yeah me too
C	he did go
B	so I'm looking for the list daily list to buy okay I've got you down for one frying pan or a or a wok or something what it was you said
A	frying pan
B	erm you said you had two medium sauce pans
A	yeah
B	if you don't have any of this stuff that's okay but this is just what what you've written down you said
C	are you writing this down?
B	one large and one small knife
A	one large
B	and one small knife
A	one small knife
B	again if you don't have it don't worry a cheese grater
A	yeah
B	a whisk
A	hand whisk?
B	yeah I don't know just it says whisk any kind of whisk you've got
A	yeah
B	one that you do that or one that you crank a handle that'd be great
A	the one where you crank the handle
B	oh that'd be great that would be really good
C	give you some exercise
B	yeah erm what else do we have you
C	is this a keeper or a thrower?
B	you said you had a double duvet
A	yeah
B	and two pillows
A	yeah
B	you didn't have any baking trays or pans or anything did you?
A	no I use them
C	we'll probably getting you some from Wickes
A	you said you have some curtains
C	that must have yes I think I have I'll just double check will they fit the windows I don't know
B	anything will do I've noticed on the street the house that we're on we're the only place with a street lamp and its right outside of my bedroom basically
A	oh so it's bright
B	yeah big kind of heavy curtains would be great
A	I'll have a look
B	did you say anything else?
C	that was too bad about the TV because erm the
B	yeah they got back to you
C	they then got back to us so I thought oh crap
A	it was even
B	was it even quieter?
A	no it wasn't a case of being quieter it was just
C	it was tinny
B	it was just broken
A	it was so tiny it was awful absolutely terrible and this is bad enough
B	is the onion gone enough do you think? is it still?
C	sorry?
B	just saying about the the thing
C	there we are I can put in down
B	but is it still getting into your eyes
A	no it's alright now I can open the window
A	just recently onions have been really strong
B	leave it on if it hasn't gone enough or
A	no no I'll open the door
B	or open a window or something
A	no you can't open the window with the the key's gone and there's alarms on it
B	you lost the keys where did we get up to? er a table
C	a cuddly toy
A	table table
B	there was a table as well
A	table
B	there were two chairs
A	and two chairs yeah
B	er and that was everything
A	brilliant
A	okay right is there any furniture in the house at all?
B	er there won't be anything no but er mum's
C	what have you got for a cooker?
B	there's a not very good electric cooker there the whole house is electric it's all erm electric cooker they didn't provide a washing machine so
C	right okay ah taking charge
B	mum's got us erm like a canvas wardrobe and some chest of drawers and a bed frame the mattress is more important than the bed but they'll all at least make things more comfortable
A	yeah
B	so we've pretty much got most things we need really
A	well the cooker's in there from
B	you have a cooker
A	we've got cooker you can take it if you want it?
B	ah maybe
B	and it's electric?
A	yes
B	yeah
A	and it's it's an it's a
B	what would I do with the other cooker though that's the question?
A	is there any outbuildings?
B	no I tell you what
C	in
B	on her own
A	one bedroom and she's just got one little the literally the kitchen and the living room is all one room and you just got one bit where the bathroom goes off
B	it's ridiculous isn't it?
A	that's it
B	so expensive
A	yeah and students
B	my friend in London is paying seven fifty each and they got like a fifteen hundred pound apartment nothing plush just two bedrooms in London
A	it's horrendous prices
B	yeah I couldn't believe how much it was and then we paid about three hundred pounds in fees
A	mm
B	not best pleased but never mind I've already paid that money so that's money gone
A	mm but well yeah that fortunate
B	I paid the tuition and I paid my rent and just get it out of the way try not to worry about it
A	Right I do want to sort that out now
B	yeah thank you for providing that and then dad said he's going to get a van erm off
A	yes
B	yeah that's brilliant
A	I think my brother said you can borrow it the only thing you have to do is you have to fill it up with diesel
B	yeah of ours
A	and erm
B	I'll get that in how much do you think it will cost for a return tank?
A	well I don't know I'm sure
B	god I hope I'm not paying a hundred and
A	fuel so I don't think that can be right
C	what's that?
B	to get to Brighton and back
A	that can't be right can it?
C	no I mean my car filling it up will be seventy quid and that gives me almost seven hundred miles
A	yes and don't forget hers is a little tiny weeny
C	yeah how much do you think it's going to cost me for the
A	so they sort
C	well it's probably going to do about thirty thirty odd to the gallon I think
A	it's gonna cost you nearly a hundred's quid's worth in fuel
C	well well we'll see what it is fuel's not cheap that that's what when I was thinking
B	or
C	kidney beans have we got any of those?
B	there's no other way of getting my stuff up is the problem
C	no kidney beans we have
B	I didn't think fuel was that much unbelievable
C	we'll see how we'll see what it it it it is for
A	but it's about isn't it?
B	it is what it is yeah
A	cars cars are erm I mean
B	yeah
A	so there isn't the size and then not the height either
B	no
A	and they've got a fridge freeze to bring back so
B	mm all the fuel
A	well they're down in
B	no so he's moving to
A	no no no my
B	oh okay
A	and because
B	they've got to pick it up
A	he's then got to pick it up so it's easier for Rob to have it there than have to go backwards and forwards
B	and where's
B	so he's staying local but just
A	yeah he's not going far
B	yeah no
C	yeah he's not going far
B	no
A	no
B	what's his place like that he's moving into?
A	it's nice it's erm it's like a modern middle terrace
B	okay
A	so erm yeah and its three bedrooms bathroom
B	oh nice
A	two double rooms
B	and he's living with
A	yep yeah yeah
B	they've been together for a long time now
A	they have now yeah
B	do you see children on the horizon?
A	not that side no
B	why do you think not
A	well eventually but not the near future no they were I mean
B	just focused on other things
A	he's uh changing direction with work and everything so
B	yeah
A	what with all that and then on top of that erm
B	mm
A	she's still quite happy to enjoy going out with her friends and doing all this so I don't see and I don't think
B	no that's fair
A	so
B	that was very diplomatically put she's younger
A	no but she is isn't she?
C	she's
B	than
C	she's not young young but she's
B	yeah but
C	where
B	I understand
C	the focus is different
A	what's that purple Oxo?
C	that's beef er or is it lamb beef lamb
A	no it's not
B	beef or lamb
C	it's lamb
B	are the cubes lamb?
A	yeah
B	like er sorry are the cubes purple when you open it?
A	no no
B	cos I asked for mum to send me out some lamb and she sent me out green ones it didn't come in a box it was just green wrappers and I thought that green was vegetable
A	it is
C	yes it would be
A	but it's there's the vegetable ones in there
B	so I've been cooking and it hasn't even been lamb this whole time it's been vegetables
C	you can smell the you can smell the lamb it's it's lamb stock
B	but I'd never had lamb stock before so I just it was kinda like a it didn't look like vegetable stock either it was like a light brown colour and I was just like a light brown colour and I was just like
C	brown yeah it's
B	something weird
C	yeah it it's
A	no cos we had to get
B	cos sometimes you have lamb with mint don't you? so I thought maybe they made it green
A	yeah yeah
C	because that's going in here that I put lamb and beef in
B	mm
C	can you smell the lamb?
B	good
C	can you smell the lamb?
B	yeah I love lamb
C	yeah
B	do you have your password to your Wi-Fi?
C	er yeah but it's a huge one it's cos it's it's a
B	is it on the on the router?
C	it's not even a
B	what do you call that box?
C	erm it's a router
B	yeah so you don't use the American for everything
C	no
B	the router
C	no only the words that suit me
B	yeah you just pick and choose
C	yeah I've got it but we'd have to get it erm
A	can't remember it off the top of his head
B	well after dinner
C	no it's a huge it's it's our names and birthdays er for you
B	oh wow
C	it's a tough tune to so it it'll be a case of cut and pasting it eh and them erm
B	well if I could grab that after dinner that'd be great
A	are we having dinner before midnight tonight?
C	yeah
B	yeah I'm hungry what's taking him so long?
A	yeah it's taken ages
B	he could have asked for my help but he didn't want it
A	oh no
C	no it's you're a guest
A	he doesn't like help
B	yeah but I offered I offered
A	he likes to do it himself
C	you're a guest not a
B	I can get you filling out forms in the meantime if you'd like to where be my bag actually?
C	your bag's in you in the bedroom
A	in your bedroom it's across from your bed
B	okay I'll be back in a mo can't bring this so
C	right this'll be ready in about erm fifteen minutes
A	sorry
C	fifteen minutes
A	before tea?
C	yeah I my mistake I put the erm I put the kidney beans in late I should've put them in earlier and they're very hard
A	oh yes please I'd rather wait that bit longer and have them
C	yes that's what I I was thinking it's got erm apparently they've got a game it it's you like games it's probably not a the topic you won't like but it's supposed to be a puzzle solving thing erm that erm he's going to bring over tomorrow and we'll play it'll take a couple of hours it's the says it's battlestar galactica but it's actually you've got a you're working out who the cylon is so basically it's like a a mystery you've got to work out who the person is so you like things like that so forget about the the
A	topic
C	the topic I was just saying about that game that you were going to bring over tomorrow
B	oh yeah if you're happy to play it
A	yeah I
B	it'd be great it's a sci-fi series that we'd all watched but it it's it's just a board game really and
A	that's fine
C	it's trying to find out who the cylon is or something
B	it's quite fun yeah yeah
C	so it's a mystery kind of a working out the
B	there's there's the first round one person is given you're each given a loyalty card and there's only one cylon in the whole game of four people and you get the loyalty cards twice in a game so potentially at the beginning nobody's a cylon but you don't know
A	what is a cylon?
B	a
A	oh right
B	like the robot bad guy so
C	but they look human
B	but it follows the series cos in the TV series they look human so you can't tell that they're cylons and sometimes they don't even know they're cylons the yet switched on later
A	I'm not going to need to know this am I?
B	no no
A	I'm not at a disadvantage
B	you don't need the back story
A	alright then
B	would you fill one of these out? would that be okay? dad will need to as well once I get these
C	I'll let you fill mine out cos er
B	yeah okay
C	yeah I'll take it
B	erm one once you've signed this once I don't have to do it again it's just the first time you use you need to sign it
C	yeah
B	so today's date is the
C	twentieth
B	twentieth of August I might move up here with you
C	er right what do I need erm
B	twentieth August what happened
A	I if I ever just catch it when open my glasses and pinch
B	oh your skin oh not nice
A	do you write the month in words? so what do we say?
B	yeah they're a little particular
A	so what do we say it was the twentieth
B	twentieth of August yeah two thousand and fourteen full name family name you're a
C	yes
A	this is going to look good isn't it?
B	not at all how old are you then pa?
C	er almost fifty-five now
B	so you're fifty-four
C	yeah
B	fifty-four anything special for this year cos obviously I'm around
C	sorry erm
B	if you're doing anything I can come back up to
C	yeah erm probably I don't think I'm going to do anything actually do be fair
A	no
B	well I'd like to take you out for a meal or something
C	I'm thinking about going to get
B	yeah well either I'll come back up here or you guys could come up to
A	mother tongue English British
B	sorry?
A	sorry he was speaking that's my fault mother tongue English British
B	what do what do you think? just write down whatever you think so what would you say
C	mother tongue
B	if somebody asked you what your mother tongue is
A	English
B	English then write English
C	she speaks it like a native
B	dad you male or female
C	erm one hundred percent a hundred and ten percent male
B	hermaphrodite birth place
C	erm
A	that's a county
C	yeah
B	which country has most influenced your language or the way you speak? I mean you were saying earlier a bit of American
C	America American yeah
B	so would you say you're kind of
C	yeah
B	by American dialect
C	yeah
B	so I'm going to say English American dialect
A	accent
B	what would you consider your accent?
A	I don't think I particularly have an accent
B	well you told me earlier that you have a bit of a
C	well she uses some of the
A	well but then it's not really an accent is it?
B	again this is your perception
A	right
B	they might even be interested in what do you think your own accent is over what it actually is so what's your
C	I wouldn't say I wouldn't say I have an accent
B	so if I asked you dad what's your accent or your dialect?
C	I don't have one I don't think er
B	okay interesting I don't have one
C	I don't really have one I night have one but I wouldn't know it
A	I had to think about that
B	linguistically you absolutely have one everyone has an accent but because you believe that you have Received Pronunciation which is the the elite form that that's having no accent or dialect
C	yes
B	everyone has an accent everyone has a dialect
A	so how many months or years have you lived there as in the town or the country
B	it's a very debatable question that everyone's been getting confused by that I got people to draw a little arrow and did the one for the country and then did an arrow for the town if it was different
A	right okay so
B	I guess if you've lived in the same place your whole life you could just write one but if you've lived in England longer than you've lived in
A	right
B	with a little arrow
A	England fifty-five years
C	you've been in
A	and in
B	yeah just roughly
A	I think it's about thirty-five years
B	how long have you lived in
C	er about almost nine years
B	nine years do you speak any other languages what do you think he'll say?
A	Spanish French
B	French and Spanish if yes give further details how how well does he think he speaks it?
A	education secondary school college sixth form college
B	how well do you think dad will er say he speaks French and Spanish?
A	what would you say are you beginner intermediate advanced
B	er
A	beginner
C	I wouldn't say advanced I wouldn't say beginner either I can hold a conversation
B	intermediate? lower intermediate? upper intermediate
C	intermediate
B	just intermediate
C	in French I can have a conversation in set pieces that I would know
B	that would probably be lower intermediate
C	yeah okay
B	I would say I'm lower intermediate in Spanish
C	yeah
B	education you went to secondary school?
C	yeah
B	did you go to sixth form or college?
C	no
B	no
C	I went to
B	yeah that's fine that counts as college
C	yeah that's
B	what's your job title
C	erm I'm now a customer services agent
B	customer
C	yeah
B	services agent
C	yeah I'm the only one
B	topic of subject
A	oh right okay
B	right you need to do this bit dad
C	what's that sign?
B	sign name in block capitals date and your contact details so either a postal address or an email address cool and then I don't have to bother you with that again given your email address?
C	yeah
B	so obviously if they contact you at some point which I don't think they will but they may just send you out an email or a letter just saying can you confirm
C	yeah
B	that you did were a part of it then just say you were
C	can you read that is that legible
B	er more or less yeah more or than less
C	my handwriting is not brilliant
C	yeah
B	my handwriting's the same as mum's I guess cos
C	I
B	I guess cos she taught me to write everyone says I have really girly handwriting so
C	well girl's handwriting's actually better than boys'in my view
B	I mean I'm being extremely legible here I'm not
C	alright well I've done all mine in black capitals cos they're all
B	yeah that's the west best way to do it
C	okay signed dated
B	perfect
C	and address
B	thank you very much a done deal you went to secondary school as well so I'm just going to tick that off
A	oh sorry
C	actually she she had a private education it was private
B	oh so does that not count? in secondary school
A	yeah
C	which is a private school
A	well what difference does that make it's still secondary isn't it?
B	it's still
C	well it's not well I well yeah I suppose so but it's not it's
B	it's just a better one
C	yeah it's a better one
A	no I went
B	was it all girls when you were?
A	yes
B	yeah cool thank you very much
C	have you continued Spanish at all?
C	erm or
B	huh?
C	yes yeah
B	but not so much recently I've been reading a lot of books
C	yes
B	linguistic books erm I haven't had so much time for Spanish
C	well you you can forget it I don't think you'll ever go back to Korea to work will you?
B	no I'll forget my Korean that needs to fall out of my head
C	yes I still obviously remember I you probably get your linguistics from me rather than your mum
B	yeah
C	and I remember you know
B	yeah
B	they they've changed a little bit over the years but
C	I just I just stay in my head
B	it's definitely a useful talent
C	well it I just remember words to be fair it's just yeah just remember them
B	is it just the three of us tonight?
C	sorry?
A	yes
C	yes
B	just the three of us might pop to the toilet would you mind if I keep recording while we're eating
C	that's fine with me I'll try to chew quietly right
B	it's actually better for me like now if I can just get a long recording for like an hour or two hours and then I don't have to keep filling out the forms of everyone I talk to with mum I get like ten minutes and then
C	he's got a little drum kit
B	yeah and he started playing it when I was recording
A	do you want water?
C	please
A	oh
A	and sit
C	yes I know
A	talking instead of working can't do both
B	smells good didn't put any mushrooms in it
C	no I don't put mushrooms in it
B	good yeah I mean you did put mushrooms
C	sorry?
B	you did put mushrooms
C	ah yes I was one oh it's the magic ingredient I'd forgotten
B	I put I put in loads of kidney beans when I do it now you were saying you don't do them from erm
C	I've forgotten the magic ingredient
B	chocolate
C	yeah I've forgotten
B	you said you don't do them from dried beans
C	er no they they're from the tin they're
B	they are poisonous but I mean I I do use them dry
C	yes yeah
B	I have to soak them for a night
C	yes
B	and then I have to boil them for quite a while
C	yeah
B	but they're erm
C	you're doing it the old fashioned way
B	yeah
C	yeah
B	well they were so expensive in Korea to get a can a beans
C	yes
B	whereas I could get a bag of dried beans
C	yes
B	it was much easier same with garbanzo beans chickpeas
C	you're you're going to obviously be able to erm get source things much cheaper than er
B	yeah I've been really pleased I went to Lidls the other day and was like ah food is a lot more
C	yes
B	sometimes we it was so seasonal that we could buy a kilo of potatoes for fifty P or a kilo of potatoes for four or five pounds it was like
C	yeah
B	really changed
C	I I once picked up a carrot one I mean it was a big carrot but it was like three pounds for one carrot
B	what in in
C	in Korea
B	if it's out of season it just like shoots but the problem is it can spike from week to week it just like really jumps on us one week you go in and celery's a pound for a bunch the next week it's three or four pound for a bunch
C	yeah so there's no
A	do they grow anything like this in the actual country? or is it all imported?
B	they that's the thing the the prices my
C	they grow everything
