B	what do you listen to? do you listen to anyone?
C	erm ah Taylor Swift's like
A	you actually filming it?
C	yeah it is recording now
A	how long's it been recording for?
C	er two minutes now
C	yeah
A	might even cut that out
C	they're not going to like this material okay erm
A	I just wanna say for the record I nearly fell off the table
C	yeah yeah
A	so I I don't swear a lot I just
C	they're they're listening to you right now
B	disclaimership
C	okay erm no no no what
A	I'm not a bad person
C	have you seen the Hobbit trailer
B	the new one?
C	yeah there was a new one like
B	I've not
C	a couple of day ago watch it erm alright
A	should we give our names? should we call ourselves like Mr X or something?
C	er it's just no Mr X
B	John Smith we're all John Smith
C	we're all John Smith
A	oh I
C	that'll be alright actually have you watched Pulp Fiction?
B	I have
C	yes yes three people watched Pulp Fiction
B	yes
C	okay I watched I watched
A	and I like Fight Club
C	I I like I was amazed by Fight Club
A	I was amazed by Pulp Fiction
C	and then I told him to watch Fight Club
A	I told him to watch Pulp Fiction
C	I'm now amazed by Pulp Fiction
B	Pulp Fiction's like
A	I'm now amazed by Fight Club
C	every minute of Pulp Fiction is so well made
A	not not not the parts where there's like random sex scenes and
C	no the thing is no that that all has a secret
B	yeah but it's not
A	yeah what about the rape scene? what is that trying to portray?
C	yeah yeah yeah it's showing eh erm it's okay let me think about this erm the the rape scene was
B	it just seems that people's
C	yeah
B	cos bits of it are just rubbish like
C	I think it it was a
A	you know Tarantino
C	the fact that a mob a mob dealer was getting raped
A	no no the point is you haven't seen Django yet
C	no I haven't seen Django
A	or any like kill Kill Bill and all that
B	Kill Bill's amazing
A	basically
B	yeah yeah
A	oh er erm Inglorious Basterds
C	he's he he's done it best
A	Tarantino's go-to is making ultra-violent movies ultra-violent
C	but in a in but in a better way than say Michael Bay does which is action and women
B	what's an ultra-violent film?
A	like
C	just very violent
A	yeah like
B	oh ultra
C	violent
C	erm no no
B	UV lighting
C	Tarantino I he he tries to put a message across I I
A	he doesn't he doesn't really
C	no okay he does it
A	alright think about Django yeah?
C	but he does it well that's the point
A	have you seen
C	oh no
A	no hang on a second that was a great film
C	oh really?
A	not saying it's a
C	okay okay so so so what's the problem with that if you make good films? and it's the thing with erm
C	yeah yeah yeah Edward Norton and Brad Pitt amazing that really got me into Brad Pitt like
C	you know what I mean
A	no I don't
C	I got deep into Brad Pitt erm okay
C	eh I'll start I'll start again erm what was I going to say? yeah
A	yeah yeah they've taken the wrong message
C	people just are getting the wrong message
A	yeah I know but
C	men should go home
A	but that whole
C	yeah that's true that's true
B	isn't it sort of based it seems like communist revolution type they call the proletariat or call the you know? the chefs and
C	proletariat
A	but yeah
B	all the like they all sort of group together
C	the workers
A	yeah yeah
C	yeah
A	they felt like that as though the system had screwed them over
B	that's fair enough yeah
A	sort of like that's why they blew up the credit card companies
C	oh yeah yeah
A	cos they were sick of er
C	when he tried to blow those up
A	yeah yeah yeah I guess it is revolution style
B	revolutionary type
C	yeah he was saying take back your take back your
B	yeah
C	we just think that oh we need to improve ourselves by becoming hench and becoming ah a Gucci model
A	yeah I I
C	yeah
A	and it gives them a lot of self-confidence but to be honest if you're you know get diabetes or something it was your fault that you have like type two diabetes
C	not all but yeah
A	yeah I know
B	but it sort of like it seems to be sort of it's like how in religion you know you ask for forgiveness from god you sort of
A	yeah yeah
B	it's like scapegoating it's not taking responsibility and you're not improving yourself if you you know say you're finding it hard
A	yeah
A	but everyone has the capacity to improve it's just I guess Fight Club's way of thinking about it is being free
C	but that's why that's why he says
A	I ain't cos even then
C	self-destruction that's what he says
A	no
[ANNOTATION]	Speaker A is talking about self-destruction.	Contradiction
C	self-destruction is is the root to humanity humanity's success but
A	yeah but even then that's that's a form of self-improvement cos they try and that was that's what he
C	but that that's that's getting
A	erm
C	yeah a different a a a point that a point that me and er
[ANNOTATION]	Not everybody who has diabetes is to be blamed.	Entailment
B	yeah
C	trying to be perfect and yet Brad Pitt is pretty much the
A	and he's
C	yeah exactly erm
A	oh yeah well he says that he says that
C	so maybe he's already
A	cos he says like I fight the way you want to I talk the way you want
C	yeah
A	like F asterisk C K the way you want
[ANNOTATION]	We can all improve in some way.	Entailment
C	straight to
B	well said
A	keeping it clean here
C	oh right oh
C	exactly yeah
C	I
A	ah yeah it's hilarious but there's always that's like low or high pleasure that's like the lower that no you find it
C	Pulp Fiction made me question things
[ANNOTATION]	Speaker C saw Pulp Fiction at a very young age.	Neutral
A	like?
A	yeah it's very hard yeah it's
C	the whole movie's about grunting and like you know
A	shooting people in the face
B	it's just what's it? it's just Mr Tarantino trying to get some what's it you know? catchy lines that everyone will
[ANNOTATION]	Tarantino got three Oscars from the movie Pulp Fiction.	Neutral
C	yeah that that is true
B	I think it's
A	I guess
B	I suppose yeah but
A	I you've got to think of the purpose of the writer I mean cos
B	it's like
A	I don't know it eh I don't know the writer but did he write the book wanting to make a profit? or did he just write it just cos he just wanted to write it?
C	who? Palahniuk? for with er Fight Club?
A	yeah
C	eh
A	okay well if it was sending a message then I can understand that slightly more than erm er Pulp Fiction
B	exactly Pulp Fiction is meant to be entertaining
A	yeah Pulp Fiction was meant to be entertaining whereas er er Fight Club was meant to be thought-provoking
C	yeah okay
A	Fight Club was meant to actually make you stop
C	you're you're like comparing two different things but
A	no I know I know that's what
C	yeah that's why we can't but erm
A	obviously there's no definitive answer as to what is a better film but
C	no no it's like everything is objective but erm
A	IMDB says
C	IMDB
C	ruin their career thingy erm er
B	better question is the music in Pulp Fiction good? the music?
A	yeah
C	yeah it's
C	but
C	and the music they talk about erm the
B	what is it? is it?
C	I don't think that anywhere is better but it it it it got to it was such a good song I'll
B	it's like he does like Chuck Berry ah it's incredible music
unknown_female	Chuck Berry
C	yeah I know I know it's like it's like a Guardians of the Galaxy soundtrack
A	ah
C	and and the theme behind
A	that's the
C	yeah yeah yeah
B	which one?
A	Guardians of the Galaxy
C	have you watched
B	I've
C	you have to see it it is the best
A	it is I we're yeah well yeah
C	and we both love that it's my favourite Marvel
A	I I I'm confused whether that or erm Days of Future Past I suppose
A	it's the best in that it it's the best in
C	why did that? it was another Wolverine movie it really was all about Wolverine
A	I don't know no no no no it wasn't about that it wasn't
C	it was as much a Wolverine movie as
A	it
C	yeah
A	where he had like he was the he was basically the main character
C	yeah
A	but he
C	yeah exactly
A	but they were they were my favourite parts of the movie
C	okay
A	yeah Quicksilver
[ANNOTATION]	Speaker A didn't like any character from the movie.	Contradiction
C	Quicksilver er you you know they added that right at the end it wasn't actually something that they
B	oh really?
C	yeah and and and and the Quicksilver that's going to be in the Age of
A	age yeah
C	than erm cos you know Age of
A	yeah
B	oh yeah
C	there's there's a they they they're also having Quicksilver but they're not making him a
B	right
[ANNOTATION]	Quicksilver will not be related to any other movie.	Contradiction
C	erm because of rights and and stuff
B	yeah
C	cos Fox owns the rights to Avengers and
A	oh yeah yeah Fox
C	yeah
A	because
C	no no but as in they can't combine them and I I'm just saying they've set the bar so high
A	yeah I know but no but the point is here
C	er yeah
A	yeah cos that cos that Quicksilver was comedy Quicksilver
C	yeah
[ANNOTATION]	Fox owns Harry Potter apart from Avengers.	Neutral
A	yeah
C	but his
A	yeah I know the
A	you know the part where he runs around?
C	Time in a Bottle Time in a Bottle
unknown	yeah
C	it's so good it's so good
C	erm yeah
[ANNOTATION]	Time in a Bottle lasts for ten minutes.	Neutral
A	and he just runs around and starts flicking stuff and moving guns around
C	physics in that scene was legit as well
C	ah
A	erm okay if you want?
C	no yeah yeah yeah yeah
B	I mean the problem with
[ANNOTATION]	No physics was implemented in the movie.	Contradiction
A	I mean F equals M A so
B	the problem with
A	his acceleration is awesome
C	yeah no
B	the problem with
A	ah ah because when he moves the arm his acceleration doing that is like like amazingly massive so the mass of that arm times that acceleration is gonna like just decimate the guy's face
C	it's going to
C	and that's a good idea that's what he did
[ANNOTATION]	The characters of the movie are very clever.	Neutral
A	no he no no no I mean like it would like punch a hole in his face
B	when he runs
A	it's like that yeah yeah
B	yeah but when he runs how come the the air resistance doesn't rip his skin off like
C	because he wears that those goggles
B	or like er you know?
B	he's a mutant and how don't his clothes shatter to pieces like?
A	or yeah and the floor why didn't the floor crush? when he runs on that
C	okay you know that? the
unknown_female	see you guys
B	see you next week mate yeah
C	see you erm you know that song Time in a Bottle?
B	yeah
C	if he was going at that speed how could they play that song at that
A	well no because time is a time is relative time is relative the faster you go the closer you get to the speed of light the more time slows down
C	cos he
A	so
C	he was
A	so technically yeah yeah
A	no no no no
B	to real people it would sound a lot slower
A	yeah yeah
B	but if he sped if he sped up super quick I think it
C	yeah yeah that's what I'm saying is that what he did?
A	no no no no no it's not that no because time is
C	yeah
A	the er the more time slows down but but relative you to you you won't see a difference cos you know? you around you but everyone else
B	yeah
A	erm will see you going fast you would see everyone else going slow
B	yeah
A	the headphones which are part of him
B	yeah
A	erm because he they're they're moving at the exact same speed as him
B	yeah
A	he hears them at at the exact same speed everyone else hears them slower no faster relative to to him
B	yeah
C	yeah
A	it's just physics
B	it's messy
C	yeah yeah I I won't understand that
C	that's that's fair enough
B	it's effort
C	no
A	it's like yeah no he didn't need to
C	think think he would
A	no he
C	yes
B	so it's speeding up for him cos he?
A	yeah
B	ah I see I see
A	no what? yeah well yeah
B	that's cool it's pretty cool
A	yeah it's like the classic Einstein thought experiment with the er
B	which one? the
A	the
B	yeah
A	classic isn't it? eh so they both have clocks and the erm like the pendulum of the clock is a photon and it bounced up and down between two plates and that's how you use cos that that never changes that the speed of that photon
B	right
A	erm you you can calculate time precisely right?
B	okay
A	so it's moving up and down and then so you know what the interval is and you can calculate time precisely and he theorised that
A	if he was eh running eh if he was flying near the speed of light? that erm that and he
B	oh right
A	erm it would it would seem cos to to him that photon is moving at the same rate to him himself but to everyone else it's moving that distance hence must be slower so erm the entire world is seemingly slower so so by him moving faster he slows down the world around him but compared to everyone else
B	that's amazing
C	everything speeds up I think you mean? because if it covers that distance it needs to move quickly
A	yeah yeah yeah yeah sorry yeah yeah yeah sorry
C	so yeah yeah yeah okay
B	that's cool
A	yeah that's just like sort of one of his classic thought experiments
B	it's like Schrodinger's cat that's sick and I think I can understand it as well
C	yeah yeah I know
B	that's weird like
C	it's it's a way of thinking
A	yeah it I know the
C	at least the way my brother tried to explain it to me
A	the the pop culture way of thinking of it is just like the cat can be both dead and alive which it can't
B	it's so cool cause okay for the record
C	yeah
B	you have a cat?
C	yeah
B	in a box?
C	in a box yeah
A	there's a fifty percent chance
B	with a some dynamite which has fifty percent chance of blowing up
unknown_female	yeah
B	and
C	yeah yeah yeah
B	so therefore is the cat dead or alive?
C	yeah
B	before you open the
C	why can't it be both dead and alive?
B	cos it can't
C	it can why not?
B	well it can't
C	like in the sense
A	no no no the whole point
B	through our common sense it cannot but
A	the whole point it was that it yeah I know because the whole point is it's meant to be an allegory for the particle wave duality
B	right right
C	oh
A	yeah so a
B	love the way The Big Bang Theory turns it into into a relationship paradigm
A	yeah
B	by we can be both dating and not dating
B	the way Leonard and Penny did it
A	so so a wave can't be a particle at the same time as it is a wave but given
B	but
A	because
B	cos therefore that implies our thoughts have physical impact
A	no
B	right
A	that can only happen when it's a particle so it must be a particle that's hitting the thing but whereas erm like a when a a a wave erm like reflects a particles can't reflect like that
B	right right
A	so erm it's like it's undefined so the cat is both dead and alive it's it's kind of it's not it doesn't mean that it's both dead and alive at the same time it just means that it's undefined
C	right it means it's neither
A	yeah it's neither
B	yeah yeah
A	so it's a completely undefined as what it is up until the moment that you make it define itself
B	mm undefined is very similar to like how here's a question what's one divided by zero?
A	yeah it's undefined
B	exactly yeah and it's and it's not infinity because if you approach it on a a Y equals one
C	yeah yeah yeah
B	but the reason we don't say equals infinity because normally if something approaches something we just say equals that
C	yeah
A	yeah
C	yeah
B	but the reason
C	it doesn't it actually never does
B	cos it well it approaches it but and if if it if that was it we'd say it equals infinity
C	yeah
B	but it approaches different numbers depending which way you
C	yeah right yeah
B	if you come from the bottom it approaches minus infinity which is completely different and
C	oh yeah
B	there's some
C	yeah
A	well yeah well
B	therefore it's undefined and it doesn't have a limit like
A	yeah yes
C	oh man
A	I guess that's where where physics starts to make sense when
C	no no it right right right
A	that's like that point
B	I think it's just you hear it so much you start to believe it
C	fair
A	yeah well no I I can kind of get Schrodinger's cat I don't know well obviously
B	why do you
A	we don't get the mechanics of it
B	yeah yeah
A	because you know we we we can't because er by the very nature of trying to understand the mechanics of it you change the mechanics of it
B	yeah
A	yeah that's the
A	I guess feasibly it could be both dead and alive but I don't think that would really from a physics standpoint hold but so it's more likely to by undefined up until that point
B	do you have any idea how we understand what photons are like? cos we obviously we can't see them
A	yeah erm
[ANNOTATION]	they are physics students	Neutral
B	well cos the moment they hit your light they're gone they're eye your eye they're gone
C	oh right yeah
A	yeah yeah yeah eh that's the that's the whole Heisenberg uncertainty theorem isn't it?
A	that you can never know a a position and eh momentum at the same time
C	god damn it
B	yeah it's cool isn't it?
A	yeah yeah yeah
B	the more you
A	yeah and and you can do that with anything so like I think a woman famously tried to get out of a speeding ticket because she used
C	really?
A	cos you can't know my position and my erm my speed that accurately at the same time
C	that's just someone messing that's someone messing with their
A	obviously they still gave her a ticket
C	yeah I know it was like like anyone's going to buy that
[ANNOTATION]	they have a physics exam soon	Neutral
A	yeah yeah
C	yeah look just to dumb this conversation down quite a lot is is this is more philosophy
A	yeah yeah sure
C	relating to philosophy is philosophy and talking about er hypothetical stuff pointless in itself
C	or is?
A	that's
C	yeah yeah I know yeah exactly so why spend your life talking about something that is only going to be relative to people?
A	because they they actually have real life applications I mean if you think of a
C	how many people think oh am I going to do this Schrodinger's cat? or this principle? or?
A	no no I know yeah I know I know you think it's completely mental but like you think of a quantum computer
C	yeah
A	oh you you basically people
[ANNOTATION]	they are talking about economics	Contradiction
C	yeah
A	and
C	yeah
A	which where you can have
B	I think you eh you give an electron like ten spins at once and you can measure them all at once or something and it
C	yeah sick
B	on a normal bit on a computer
[ANNOTATION]	quantum computers cannot be used to measure the behaviour of electrons	Contradiction
A	that means there's ten electrons yeah
B	but this can be like every number between one and zero at the same time
C	yeah
A	which is defined by its charge erm its eh position its eh energy level
B	yeah yeah
[ANNOTATION]	there is an exact number of electrons	Contradiction
A	and eh its spin
B	and you can measure all of them at once
A	so if it if it has if it has ten different spins that means it's effectively ten different electrons
C	yeah oh right yeah yeah
A	which means that effectively you can do the times the amount of calculations
C	what so like when it's moving it changes its makeup or?
[ANNOTATION]	speaker a is a university teacher	Neutral
B	I I don't know how it works but
B	you you give it a
C	yeah
B	and you can measure each of them to get different stuff out
A	yeah
C	right right
B	and they reckon it'll be better to make like a brain-type computer
C	yeah
B	because brains work more like that they work you know more complex and you know firing lots of things at once
C	yeah yeah
B	instead of just a linear
C	brain
B	so they reckon like they
C	yeah? really?
B	yeah yeah and it and it's like this big and costs like fifteen million quid yeah?
C	do you think that will advance at the same rate computers have advanced?
B	I think they'll advance faster
C	looks like looks like they are yeah
C	yeah oh that's amazing
B	yeah yeah yeah
C	so I'm again changing the subject maybe deliberately erm
B	and it's going to come back to physics again
C	no no yeah we will
A	it's like me and
C	yeah I know erm
A	and what happens in physics? it explodes there we go
B	so what sort of musics do you like?
C	yeah yeah yeah
A	but this this is a genuine conversation
B	we're just
A	and I think they're going to be revelling in it
C	I don't think they care what we talk about
B	it's true we're just effing weird they're not going to want
C	no I know
C	they're not going to listen to everything erm oh no they are though cos they're transcribing it so that's cool
A	well yeah they could be transcribing this
C	they're going to turn everything we say into into er words erm there's seven minutes left of this half an hour recording
B	that's pretty cool
C	erm what was I saying? erm yeah what music do we like? okay erm
B	yeah do you just like
C	cos I think we all completely have complete opposite
unknown_female	your gay face
B	oh my god
C	shut the shut the
A	that's not music
C	okay no not erm I don't like Nicki Minaj er what's that
B	has it got
A	that Ice Cube thing?
C	Lil Wayne Kanye Kanye's Kanye's okay
A	Kanye man Kanye Kanye's awful I just like him cos he's a prick
C	Kanye's
C	when he took when he took the mic
A	it's like excuse me excuse me hi Taylor I have a lot of respect for you
C	yeah yeah yeah
A	but Beyonce made an amazing video this year
A	ah it was
C	it was
A	have you seen erm erm have you seen er Oasis er Liam Gallagher's reaction to that?
B	I know he go on what did he say? there's so many
A	eh he goes erm he goes
C	so many
C	and she was so grateful and cos she's a country singer
B	ah so happy yeah
C	she
A	and everyone just went ah except for Kanye West
C	and she went she was like ah thank you thank you
C	Kanye drunk goes up
A	bursts onto the stage
C	steals the mic she's like what is going on? and he was like
C	that's what he said
C	erm and then he said erm
A	yeah and I think she should have won
C	and he said Beyonce's video was history and then he storms off
C	erm and Taylor Swift doesn't say anything she's just like she's just like standing there and it's ah it's so sad
A	yeah she doesn't know what to do
C	and then he who gets the biggest backlash ever goes to Japan for a year makes no er er you know er
C	erm er news conference whatever you want to call it erm no music he was just he was off for a whole year cos it was just the amount of crap he got
C	he's a prick he's he's a
A	ah yeah douchebag he's
C	I know a Kardashian they're so perfect for each other it's
A	yeah I know
C	ah I'm so happy I'm not ignorant or?
B	I need to like expose myself to more of this gunk like you know? like Kardashians and stuff
C	yeah I know literally I found myself two days ago I was just like oh what is this? and I knew
C	but anyway what was I saying? so I like I'm a big fan of Eminem that's all I'm going to say
A	no ah
B	he's good actually I must be fair
C	I yeah I I
A	my favourite is Will Smith and that's just it
C	yeah yeah yeah Will's ah funny that okay
B	yeah
C	early early two thousands
A	he doesn't swear at all
C	I know
A	in his rap and his rap is just like happiness in a rap
A	that should be a Subway advert
A	you heard it first
C	oh I get it
B	patent
A	I'm patenting that one
C	oh my god
A	transcribe that and send it to me please
C	what happened was if you care? yeah Will Smith criticised erm basically the rap industry for
A	yeah
C	and then then Tupac and Biggie died and then everything just went back to normal Eminem started swearing more and
A	I the rap
C	I just like
A	yeah
C	but yeah the the way he can er conjure rhymes and and then and
B	well
C	it's like
A	well Pitbull's a genius Pitbull's a genius you know why? you know why Pitbull's a genius? he rhymed Kodak with Kodak
C	yeah exactly he could rhyme orange with anything
A	yeah
B	he probably doesn't what's it? even write it does he?
C	no no he he writes his own songs and that's that's not just me
C	he he he he's one of the few erm yeah
B	okay
A	sounds like you're fanboying here
C	trust me I do I I
C	he he he genuinely writes his own his own lyrics the the thing that people do admit are usually stolen are erm they're called sampling of if you listen to any rap song
A	yeah yeah
C	usually the chorus is is it's not stolen it's given permission but it's from a different song like erm like
B	yeah
C	you know? they stole off of erm Aerosmith well they didn't steal it they got permission you know?
B	yeah
C	so that's called sampling there's a big debate about that but generally rappers write their own lyrics though
B	that's cool
C	erm I can see I can see I've hated Eminem at times as well
B	see Eminem like Not Afraid erm you know the Love the Way You Lie he did with?
C	yeah with
B	they were brilliant brilliant songs
B	but
C	erm well at least at least now you know he's had some really awful albums
C	and that he's he admits now for being as awful as you know? in that they're horrible bass lines horrible but pointless lyrics I mean I think there's pros to each album but I mean
B	yeah yeah
C	from the heart yeah
C	okay away from the hip-hop I like erm I got into Linkin Park more
B	okay yeah
C	erm they had their ups and downs as well
B	like when they did Numb and stuff Numb and New Divide they were they were brilliant yeah
C	yeah New Divide erm In the End er what I think that's sort of two thousand and seven onwards two er even later than that
B	yeah
C	erm
B	they are very good but like the newer stuff I've only heard one of their albums A Thousand Suns maybe?
C	yeah yeah yeah A Thousand Suns that erm
B	that was awful
C	yeah yeah they were known for turning we're talking about Linkin Park
A	oh
C	erm Linkin Park were known for for having a really awful term like twenty ten to twenty twelve and now they've released another album erm er with with some well what I consider great songs Linkin Park songs
B	yeah
C	they they they basically put dubstep in their music and
A	oh yeah I guess every er band goes through that phase where they have to do something
C	yeah change
A	change so that it shows that there's differentiation in their music
C	yeah I know that they're not just putting out the same it's like The Beatles never had to do it did they?
A	so yeah I don't I don't like I don't like eh certain rap where these people just feel the need to swear
C	yeah
C	okay
B	yeah
A	don't swear don't shout
B	I suppose I suppose that's fair like
A	I like I like a certain melody in music cos at the end they I can talk and swear a lot and I probably do
B	it's true
A	so I does that make me any different?
C	yeah
