B	what now you're drinking this wine?
A	what do you mean?
B	we'll
A	I we're sharing both of them
D	I enquired with my French friend
C	what?
D	well his house got struck by lightning
D	and he thought he woke up and thought that he'd been attacked by giant rats
C	what?
D	cos everything had like fallen off the wall
D	and he
C	he was like ah it's something
D	and he lives by like erm
D	so it's like
B	pond rats
B	definitely pond rats
D	and then he found out there's a lightning strike and all like the his electrical stuff had popped out of the wall like all the sockets
C	that's crazy wow
A	yeah my my aunt got electrocuted by being on the phone when her house got struck by lightning
D	did she actually get electrocuted?
A	got electrocuted
B	what she died?
D	what's happened to her?
A	no she's erm
B	oh
D	cos I watched this documentary once about people who get struck by lightning and it's always
C	that's weird
D	so yeah he'd like sleep for like three days and not three months but then like stay awake for like a week-and-a-half and the I can't remember like but they did like all the crazy shit like rewired peoples brains and stuff
B	I met someone who'd been and he was well crazy
A	and your chances like as soon as you get hit by it once that's what lightning knows you or something the chances like go down like one thousand percent or something
D	probably like
A	they will they're like they're like likely it happens once it's likely to happen again basically
C	yeah cos my friend's mum was like
A	what?
C	cos
B	charged yeah
D	yeah
B	well yeah this guy was fucked
D	you also get people that try and get hit by it as well
B	really? like
D	there's gotta be like
D	go out with like wearing like tin foil and holding like a big metal pole
A	all you've gotta do is go out
A	all you've gotta do is go out in a boat in the ocean and
D	say what?
A	if you go on a boat in the ocean and you go to the top of er the boat there's nowhere else for lightning to go to so you'd definitely get hit
D	yeah true
C	but doesn't it just really hurt?
B	yeah I bet it really hurts
A	yeah but you get superpowers
B	yeah you couldn't get
D	yeah you do get superpowers
D	I'd go through a little pain for a superpower
B	be more angled
C	er I got literally sort of once sort of
A	I
B	I got electrocuted
A	when when I was in
C	yeah
A	we was like we always like we'd get out of the pool soaking wet and getting electrocuted by the thing and we'd all like fall off the wall and
A	but everybody was still sort of wasted and no one never really noticed
D	we used to do that all the time when we were growing up like
D	where you like grab it and grab onto someone and then they get electrocuted
C	what?
D	pass it
D	yeah
D	no but it's like but it's not an actual electric shock like you can hold
A	yeah
D	it just like bolts you
A	yeah
D	it's really weird
A	I was always I was
A	so I used to have I once was in a house where you could see the
D	you can't see me
A	to see what would happen I thought
D	yeah we used to do that all the time but like you make like lines of people and then one person grabs it and passes it all the way through just gets
B	does the first person get it more?
D	no you don't get it cos it passes through you the only the end person gets it
B	that's
B	uhu
C	oh
D	have you every been tasered?
C	no
D	I'd quite like to give it a go
B	I think if you were in the police you'd have to do it right? know what
D	how to get tasered?
B	I think
B	I think so anyway
B	yeah
D	massive
B	help yourself
A	Christmas
D	yeah how did you make those cool things by the way?
D	have you emoji'd yourself yet?
B	mm mm
A	I need to get my phone
C	is that what you sent to me today? is that you?
D	what is the website for doing it?
B	I suppose that's quite hard to do the
A	it's called
B	it was really time-consuming actually
A	but I've seen I saw that
C	it was really good
A	it was better ones for you though than what you chose
B	what a hair? no it's
C	that was definitely a
A	can we have another
B	huh?
A	this one's going about to go
D	candle's about to go
C	maybe in the drawer the candle drawer I'll have a look
B	maybe in the candle drawer
C	I
D	so what what's the emoji website called?
[ANNOTATION]	The candle's scent was not cotton and linen	Neutral
A	I think it's called Bitmoji
B	Bitmoji
D	I can't google it cos like random shit'll come up
A	yeah have a bit of it
B	okay
D	Bitmoji
B	Bitmoji
A	group ones
B	like if you could make
[ANNOTATION]	The emoji website was called emojiworld	Contradiction
D	yes looking
B	yeah it probably is actually it's taken a while though it takes half an hour to
C	what to make an emoji
D	that was like my favourite thing on computer games when you had to like choose your
B	avatar?
D	avatar
[ANNOTATION]	Speaker D hated making avatars when playing computer games	Contradiction
C	I can't fucking believe it
B	I still have dreams where I
D	really?
B	that used to be
A	what avatar were you?
B	just like it was like erm the like
[ANNOTATION]	They are discussing their avatars they have made on Nintendo Wii	Neutral
D	I actually bought an Xbox pretty much just to get an avatar
C	sorry
D	oh I went on the
B	the what?
B	what is that?
D	it's like this guy developed it it's like a virtual reality headset
B	so wait what is it? it's like is it a game?
[ANNOTATION]	Speaker C prefers PlayStation over Xbox	Neutral
A	is like the
D	no it's like you wear it and people made films for it and like you can like look around three sixty at like random shit and I did this one where it's like and you're stood in the middle of a lake and then there's this train goes by and then the train comes and drives on the lake but if you're not looking if I like drive behind you so you like turn around and there's the train it's pretty amazing and then
B	wow what are they gonna use it for? movies?
D	I think it's one of those things that everyone's like it's gonna be the future but it's like gonna have been the future for like the last twenty years
B	what's it called? Opura?
D	Oculus Rift
A	it doesn't sound very Google
B	egg carton
[ANNOTATION]	Speaker B is planning to buy Oculus Rift	Neutral
D	no like literally get a cardboard box and get some like empty toilet rolls and like erm an old erm cereal package and glitter you have to like glue it and then put glitter all over it
B	mm
D	and then you watch it put your Iphone in the end and it's like full like virtual reality
A	thank you
B	what?
D	it's quite amazing you have to download the app on your phone
B	toilet roll and glitter?
D	yeah you have to do the toilet
B	cool
D	and there's one where you've got in a womb with a baby
A	ah
B	ah
D	it's so weird
D	then there's this giant baby like floating around you and
B	in da womb
B	not not again man once is enough for me
B	I'm not going back
D	I'd love to go back though
B	would you?
D	I feel like it's the most cosy place
B	yeah but it'll be all fucking gross and shit man we
A	well there's no way I'm gonna do it
B	placenta
D	this is the thing I don't understand so much
D	how do babies breathe? they don't actually breathe
A	they breathe through their uterus
D	but do they actually breathe?
B	do they?
D	breathe?
B	don't they just get oxygen from blood or whatever?
D	yeah this I know so little about really basic things
B	I know cos like they don't even have lungs and shit for long
B	it's like an arm or something you know?
D	it starts off as an arm?
B	it's like it's like a
D	in the womb
B	whatever it is it's something fucking gross and weird
D	I had this really weird
B	like Arnold Schwarzenegger?
D	just like hundreds of them in a
B	seriously?
D	but I had this one
B	er so weird
D	I had this one the other night where I like in my dream I figured out how to get so I was like if you have sex in the bum before you have sex with like a girl in then you get gay babies
B	yeah
D	and if like a guy gives you a blowjob like you get a Down Syndrome baby and like
A	why?
D	and I'd like in my dream I'd like figured out how you get all these like
D	it was really weird it was really really bizarre and I was speaking to someone about it and they've had a similar dream where they've figured they thought they'd figured out that shit so it's a common thing so
B	so who'd you have sex in the bum with?
D	I don't even know it was like no most of the time I didn't even do anything to get pregnant I just suddenly had loads of babies it was really odd and I had this dream for like about a week and I had to wake up panicking
B	maybe you were just maybe you your biological clock is ticking
D	I think I'm just pregnant
D	I think I'm pregnant
B	you should go to the doctor and say that
D	happy
D	I might do it
B	really
D	the worst ever I had like got really convinced that I had testicular cancer at school I just had to go to the doctor
B	I thought I had AIDS when I was at school because I read this article about how someone got AIDS from like a club somebody remember when there was that thing erm where like somebody had
D	people like stab people with needles and shit
B	yeah and I found this inexplicable pin prick on my body and I was like oh
B	oh shit man was well worried about
[ANNOTATION]	they go to the same doctor	Neutral
D	yeah I was really scared of that at school cos you know like they come in and like give you lessons and be like don't be embarrassed about going to the doctor's and I was like I must have it I'm not going to be embarrassed and I went there
D	yeah
B	didn't have it
D	didn't have it
B	did you do a pregnancy test though?
D	no I didn't do my pregnancy test
B	just be like look I've been reading on the internet I'm really worried
[ANNOTATION]	speaker d has not had dreams about being pregnant	Contradiction
B	so it must be really
A	I wonder how many how doctors now get I read this on the internet so it must be whatever you know
B	yeah I
A	yeah my
D	they really need to be trained
A	mine not totally
D	my doctor
[ANNOTATION]	doctors spend a lot of time on the internet	Neutral
A	he asked me if I speak English
B	might disappoint
B	vegetarianism is
D	yeah
C	maybe you were?
A	my mum had a really good tactic with er much younger used to go to the doctor she would just tell them that she was a doctor as well and they would like sort of sit up more straightly and like pay attention
D	yeah what happens do doctors go to the doctor?
B	I guess so it's like hairdressers you know?
C	they do go
A	that's why shrinks always go to other shrinks
B	they go to the doctor
C	why did he think you were in a cult? that's really weird
[ANNOTATION]	doctors do not need to go to the doctor	Contradiction
B	what were the other questions like?
C	the other questions like
B	do you
C	do you regularly
B	are you in a cult?
C	I'm like yeah I brush my teeth every morning
[ANNOTATION]	speaker a's mum pretended to be a doctor	Entailment
D	he was just this like weird African dude that he was yeah he just was
B	read about in on the internet probably
D	and I was like Jesus dude
B	antidepressants
C	mm
[ANNOTATION]	speaker c brushes their teeth regularly	Entailment
D	but you know
D	but they just go through like a series of questions to like
B	yeah yeah yeah yeah totally
D	like professional
B	erm yesterday on a totally different subject I found out that
A	what?
B	like travelled around like teaching circus shit and then she got kicked out of circus school for
B	can imagine
D	why was she in the circus? just
B	he dad was like into it and then got her into it when she was like really young trained her up
C	ah
B	it's like you have to do that shit again oh that's so cool she
D	what
B	she could do all kinds of shit apparently acrobatics like pretty well
C	I thought she was cos she's like a dancer right? I thought she was a dancer?
B	no
C	that
B	she sort of does like a bit of modelling a bit of acting but not really she just works in
D	what happened to
B	yeah I think she should hook up with
D	just does
B	yeah she's got like quite a few acts she
B	yeah really
B	yeah
B	and it's quite slow like it sort of takes so long to load each one
D	come
B	yeah do it like
B	so what's going on at
D	nothing just
B	she does have a cat
D	nothing she's just
B	she's ill?
D	she's always ill man
B	oh
D	she's always ill
A	she's like you lot
B	yeah it was
C	yeah you should really stop drinking like you know I just I've been thinking about it and I don't drink
A	but that's did we tell you about the shop guy?
C	yeah
A	the shop guy
B	yeah he's like fucking scratch card junkie spends all his money over four hundred pounds a week on scratch cards it's like it's like
B	and then he said it again
A	I can't believe a scratch card addict told me to stop drinking
B	I don't drink myself
B	really? well I don't spend four hundred pounds a week on scratch cards
A	the funny thing about it was his story started off about saying how he won one hundred pounds once
B	yeah was like we bought a scratch card and he's like I won a hundred pounds once
B	and we were like cool then he's like yeah I actually had a really bad problem I spend four hundred pounds a week
B	erm
B	still he was chuffed by that
D	I wouldn't
B	I
D	I once accidentally spent fifty dollars on scratch cards
B	is that all?
D	cos I
[ANNOTATION]	Speaker D has been gambling.	Entailment
D	and then I realised it didn't give change so it
B	did you win?
D	won five dollars
B	oh my god
B	that's
D	that's really depressing
B	yeah that's well bad
D	have you seen that film? what's that film? like American horror
B	really?
D	yeah
[ANNOTATION]	American horror is in fact a comedy.	Neutral
B	I didn't think anyone ever won that shit
D	it's really good
C	wow
D	he's like mate
B	oh my god
D	mate
B	wow
D	bought me a drink bought me a couple
C	he bought you a drink? that's awesome
B	mine's a
A	might
C	Bollinger?
[ANNOTATION]	The drink was a cola.	Neutral
C	get some Bollinger don't just spending money on wine
A	it just depends
D	nah one pound
A	can get a ten pound one
D	yeah ten pound
B	yeah but
C	I'm sure I've been behind people in queues in the shop and they spent like thirty quid on scratch cards just like that
D	yeah you can
D	I just always give them to people on birthdays cos like they're easy to get
D	wait do you give if you give someone a scratch card what terms and conditions do you like if
B	fifty pound
B	get back
D	I wonder what the law is with that? like if you give someone a scratch card but you bought it legally you would keep the winnings
[ANNOTATION]	Many people spend money in gambling.	Entailment
B	I don't think the law applies you'd have to figure it out between you
B	fist fight
[ANNOTATION]	The law cannot consider all cases.	Entailment
D	there's gotta be a law for that
A	arm wrestle for it
D	there needs to be a law for anything
B	yeah it's gotta be it's gotta be at least like strong moral code in place
D	yeah I reckon arm wrestle
B	but I think they're always like you have to state the as the conditions when you give them the scratch card
C	what did
[ANNOTATION]	There are many types of scratch games.	Neutral
B	nothing
D	happy Valentine's
C	that's that's
D	what's yours is mine
C	that's real oh yeah
B	also high expectations
D	did you win
A	no
B	you
D	would you have thought of that present if you
[ANNOTATION]	The expectations are higher than they have been	Neutral
B	way better if you win what?
D	yeah I think if a friend gave me a scratch card I would
B	yeah
D	definitely upgrading
A	don't you wish they had still on Myspace of top friends?
D	I
A	rank your friends
D	fucking hell but that was so
D	and then they had that thing where you like can like not hack it but you can change a
A	yeah and like
A	I remember like just sort of seeing kids that I used to hang out with that had sort of twenty thousand friends on Myspace like a top ninety-six
[ANNOTATION]	They don't have a Myspace account	Contradiction
A	like
D	dude I was so yeah people really
B	oh no it opens in another page right?
A	I know when one girl that I barely knew made me her number one top friend
C	oh oh
A	you know
[ANNOTATION]	The girl doesn't have any top friends.	Contradiction
C	oh my god that's so embarrassing
C	oh my god what an idiot
D	I know loads of people
B	oh my god we had such a funny story about that like that
C	woah woah
B	anyway so
B	so we we met her and we're like oh my god oh my god and I was like you're
[ANNOTATION]	He knows more than 500 people.	Neutral
B	I thought you was I thought you was Polish or something man?
B	it's like no it was
A	I say there is a Polish name which is Gooner
B	oh my god it's
A	that's what used to happen cos
B	didn't really get on
A	is that what
D	shall we go back to doing Myspace
B	yeah yeah see you later
A	but people used to cos I went out with a girl that was like really big on Myspace and people would come up in the street and ask her if she was that person off of Myspace like all the time
D	yeah
[ANNOTATION]	They both have Myspace accounts.	Entailment
C	what?
C	how did how does that work?
A	I don't know but people always come back are you are you
B	but what does she do like
A	just like posting like pretty photos and like I dunno
[ANNOTATION]	They have both seen the girl.	Entailment
B	had a lot of friends
A	had friends with other people who had loads of friends
B	ah where's my computer?
A	what?
C	my does Myspace still exist? it's all still there isn't it?
A	not no there there's a big scandal cos they deleted everything
C	what?
A	and
B	what really?
A	yeah
D	they tried to turn it into like a music platform
A	yeah
B	they
A	er about a year-and-a-half ago two years ago
B	I swear my stuff is still there
A	so you see
B	my comments has gone though pictures are there
A	yeah that and all the messages has gone
B	that's sad cos that was the coolest thing about it
A	yeah
B	it was like a ghost town of like static conversation you know? it's like
D	the worst is Facebook has like Facebook obviously
D	it was like just wanted to
B	yeah yeah yeah
D	puts it in weird like context
B	yeah
D	I like
A	yeah
D	just be like hey how's it going? haven't seen you in a while and then the last message was like from their break up
D	and then it was just like
B	text
C	yeah
B	very sad about Myspace I thought that was cool
A	yeah no it was like there's was like this there was like this sort of erm support thread which had like about seventeen people on it who were outraged
D	do you reckon live
B	seventeen people are outraged
B	do something
A	I guess they were Myspace must have been paying for that
B	yeah well also like it's just embarrassing isn't it? if it's
A	no
B	no I don't even know what that is is that like Linkedin?
D	no it's like a blog but it was like a journal and you were like friends with people on there
B	no actually I I just
A	I just remember like
D	I thought I was really into the internet when I was younger I have like friends in America that I used to call I
B	chat rooms?
D	I used to be on this thing called Lipstick and Cigarettes
A	do you know what's funny about I think that actually now now a lot of old people use the internet like that and have friends all
A	yeah
D	and
C	do they
D	it's really amazing
D	oh yeah just having a chat
D	men can't be like
C	yeah
D	alright Barry like what's going on?
D	how are the kids doing? but on Call of Duty you can yeah
C	yeah they're not really allowed to do that are they?
B	have a natter
C	no no
B	you can if it's like through the medium of Call of Duty and you're like
C	or if you're in the pub
D	yeah it's like pub or golf like golf is
B	cos it needs to be like banter it can't be like gossip like catching up so just shooting the shit
C	yeah yeah yeah
B	you can do that if you're doing something else at the same time
C	yeah yeah yeah
D	but imagine transcribing that it'd be fucking amazing like
D	it'd probably be like let's kill the fucking Arabs and it's like how's Siobhan getting on at school then?
B	just kill the fucking Arabs
B	my little brother like was like a massive massive computer game freak you know? like I guess all my brothers were to an extent but like now he lives with his girlfriend in
A	what so they cut-out the
B	huh?
A	the Charlie's Angel cut-out from the
B	oh yeah he used to have that in his bedroom
B	but like anyway so erm his girlfriend was like oh
C	woah that's
B	what are you gonna do? nothing so
B	if you don't like it find someone else you're not you're not gonna do any better are you?
D	I love it it's just like like
C	find someone else that's awesome
B	Tripadvisor
C	now when are we gonna hang out with
A	he's not drinking all year
C	what? all year? fuck off
B	cos he's like we're like why? he's like cos I had a well crazy year last year
C	fuck man
D	that's pretty extreme
C	what do you mean he had a well crazy year?
B	he needs to find a wife man
A	yeah that's why he's doing it is to find a wife
C	but that's easy
B	he needs to
D	that's exactly what he'll need to do
B	well if you if you if you get like you the harder it does when he's drunk it's not necessarily like a social lubricant as that
B	it's more like anti-women spray
C	well he should just be slightly more
A	I told him how to get a wife
C	how do you get a wife
A	he's gotta go to America
C	why?
A	the British accent
B	the British accent and shortage of men
D	I think that's so much
A	it is true are you crazy?
D	it's not
B	I've experienced
B	there's a shortage of men cos they just think you're a
C	you're not you're not posh enough maybe
D	excuse me?
D	erm it's so not true like think how many English people in America now if you go to like Indianapolis or something but in like New York or LA it's like there's so many English people
A	that's why they're all there
D	what
D	it didn't work for me man
C	I think yeah well it didn't work for me either maybe we should just pretend to be like on Downton Abbey or something that's what that's what
D	that or
B	they even like Australia cos they have no standards
B	they're like anything'll do anything a bit sort of
D	they like white foreign people basically
B	Czechoslovakians
D	erm I did threaten someone though that was massive and he took it really seriously cos I did like a fake Cockney accent
C	no way? that's amazing
D	yeah it was
D	I was at this like show and we had like all access passes or whatever
D	and I got so fed up and I went and stood in like by this seat and this guy came up to me and said
D	he took his hat off
B	wow
D	he took his hat off and threw it
B	wow
C	and then like rested of my nose like went right pressed my nose like right up against the side of his head in his ear right
B	what? what?
D	but like I have no idea where this came from and then like turned around and walked in like
B	were you drunk?
D	in a stadium it was in the
B	I'm going to fucking kill you
B	anyone would take that seriously it's not your accent
D	then I turned around and walked up the stairs like fully expecting this like
A	especially if you're little and he's big
D	I was walking up the stairs shitting like bracing myself to like just cos he was like a massive jock like bracing myself for someone to just like come up and punch me round the head and I got to the top of the stairs and I was like
A	why was she screaming at a hot dog lady?
D	cos she was basically we were at this show and she just you know Americans just like take like rules so seriously and it was just like everyone was like no you can't and like we blatantly can do that I can't there was something about the hot dog she was like we can't serve it with just ketchup it comes with ketchup and mustard and she's like well you can and she's like no the management says that we can only serve it
B	I'm gonna fucking kill you
D	that like
D	that had drunk like he was just drunk and he was like slouched against the wall and they cordoned him off they put like
D	they put caution tape around him
C	that's amazing
D	and got the
D	but it's just like we were
B	just take them off
D	you know like sometimes you just feel like really trapped like they're just obsessed with like
B	rules
D	rules
B	controlling
A	it may be hard when she
B	yeah shouldn't go there man
A	you'll be cordoned off all the time
B	you'll get permanently cordoned off
D	it was so like literally like caution tape around him
D	that was proper
B	oh they're fucked
C	whose are they?
B	fuck my
C	is that yours?
B	mine's broken the blue one
A	have you seen
D	oh did you fuck your Iphone when your
A	only when I
D	cos I want the jailbreak but I'm worried
A	I think that's fine if you go but I know people who do it and it's nothing happened to their phone
D	yeah I might do it another thing for me to do later
D	can't wait
D	maybe I'll go and get a wife in America
C	you need to do a posher voice?
A	I don't even think it's I don't really think it's that either though
C	it's just for some reason they think it's exotic
B	yeah
C	and they're and it sounds attractive to them I don't think it has to be posh
D	mm
C	maybe you just have to like
B	yeah
D	I think you have to dress like you're English as well
D	actually it does totally work cos English
D	he pulled this like
B	yeah is he from
D	because he say what?
B	is he from
D	no he's like I don't know where he's from he's from England
D	and he literally
D	I really fucked up you know
A	that's why my dad lives there I think
B	I won't
B	and it was like he keeps walking
B	English
C	that's
D	see I also I think yeah you have to dress like pretty much
A	yeah but I know being like
A	and he stopped the bus drove it back to the bus station and like ten minutes to go back
C	that was amazing
A	what happened like took me off the bus and like walked me to the right bus and I was like to his friend like make sure Mick Jagger gets to
B	and when we were in Mexico and that guy was talking to us we were buying cigarettes and he was like you look like Mick Jagger and you were like that's my dad
A	I remember that
B	it was amazing
A	it was what on New Year's Eve?
B	it was amazing
A	where?
B	he's like oh
A	oh yeah I remember
D	I can't find out what English
