C	or you can think about what your dream is
B	I'm not sitting here for an hour
A	you don't have to sit here for an hour
C	you can think of what your dream is and er
C	isn't he?
A	well yes
B	no
D	what what what age?
A	dad dad won't let you live here when
D	what age?
A	well when you start earning
C	well as soon as you leave full time education I I I would expect you to pay rent and contribute to the house
B	I'll pay you in lifts instead
C	no
A	oh lifts from the pub excellent
C	well well
A	and your petrol
B	alright
D	you said you weren't paying my petrol
A	well you're fourteen you don't need to worry about who's paying for your petrol
C	you you know if you don't know what you wanna do
A	but how much what do you need to get to get to America? how what does it matter what your rating is?
B	well yeah they're not gonna take a seven point two
A	so what what rating do you need to be at to get there?
B	I dunno basically it has to be low
A	yeah but how low?
B	below a well I'd say a five
A	well yeah are you gonna get below a five in the next year?
B	no it's not gonna happen
D	anyway I'm going for a shower I smell
A	mm thanks
B	I'm going for a shower after so
A	oh
C	the other option is we start you on those LTA courses
A	what LTA courses?
B	coaching courses
C	coaching courses
A	oh as opposed to the LPT ones?
C	yeah
A	mm
B	he saying he's still really angry
A	about what?
B	well he's like I'm the second highest qualified coach now and on the lowest pay
A	has he still not had a rise?
B	he says he's gonna ask once he's sixteen
A	he is sixteen
B	well I dunno yet
A	he was sixteen in March
B	maybe he has had a rise I'll ask him tomorrow we always talk about it
A	mm
C	have you told him you've had a rise then?
B	yeah I told him I had a rise yeah
A	does he wish he'd done the coaching course?
B	he did that's his point
A	no no no sorry not the coaching course
C	the the referee
A	the er tournament organiser course
B	I dunno cos it doesn't two of us to run it
A	mm
C	he doesn't seem to enjoy coaching anyway though does he?
A	no he doesn't
C	is he a good coach when he does coach?
B	yeah well he he knows enough doesn't he because he just relays information that he's been told over the years doesn't he?
A	he's had a lot of information given to him
B	quite he's bright isn't he? so
A	yeah
C	does he do more technical coaching than you do do you think?
B	it's hard to do technical coaching in a group session
A	is that why they don't do it?
B	yeah cos you can't really
A	well why not? why can't they like line everyone up and and make them serve and tell them what they're doing wrong?
B	cos when you're lined up waiting for your someone to serve one by one and there's nine of you in the group you have to wait at least nine minutes
A	I know but well that's what annoys me about
B	that's why they do that's why it's tactical
A	the academy it's not
B	well they can't they physically can't really do it unless unless you put them all just into matches and you go round one by one and pick something out
C	see what I don't understand though is that you you you can do drills in groups can't you?
B	yeah
C	yeah so why can't one person be doing some drills and just the other person take people aside for ten minutes just to say look
C	this isn't quite right I'd really like you to work on this this and this
B	what so?
A	yeah I I yeah
B	no cos you don't do drills for long enough drills last five ten minutes
C	alright well it
A	oh it's just when you're doing hitting at the end why not take one person aside and say okay?
B	cos you don't have time to do everything
A	and and that's that's what
C	but you
B	yeah
C	well in that term if you've got twelve
A	I've had loads of wine
C	if you've
A	I'm gonna not
C	if you've got twelve people in the group why can't they just identify two people each lesson and say right in this lesson we're gonna focus on these two and the rest we're just gonna continue doing generic stuff with but they'll have other stuff that they've been thinking about
B	well I think the big difference is which is what me and
A	mm
B	and you've got your technical part which is the lesson
A	oh
B	so he
A	so you're not getting and
B	yeah
A	is getting one out of the three
B	so
A	okay
B	already which is why it doesn't happen
A	so out of the
B	so
A	people in the academy how many are doing all three?
B	well most of them are doing all three and if they're not doing all three they're averaging at least one a month of a private lesson
A	so it's only you two
B	so he's just doing the tactical
A	oh okay
C	but I I I think that tactical is a load of rubbish I really do
A	yeah I think you'd you you'd benefit from the technical private lesson
C	because
A	over the tactical
C	the
B	I've said that all along but I dunno why you're telling me
A	I know well we I know I know
C	doesn't make any difference telling me
A	we didn't manage to get out of it did we? but
C	but even when you spoke to him we we left it down to you to tell him and he you had a chat with him and he
[ANNOTATION]	Person C is going to have a sandwich	Contradiction
A	who?
B	what the squad?
C	yeah
B	that's because I I
A	he talked us round
B	in
A	so you can't have a go at him
B	in the squad I
[ANNOTATION]	Person B think that it is not clear that why he could not see him	Entailment
A	he talked us round
B	in the
A	quit is the past tense
B	so
A	of quit
B	there was no reason not to
A	quit
B	and then
[ANNOTATION]	Person B think there is no sense in Person A's words	Neutral
A	got it?
B	everyone dropped out so it ended up being a lesson anyway so it was a win win for us and
C	oh so it has been good for you?
B	well I then
[ANNOTATION]	Person B is going to dance	Contradiction
A	this has on the Tuesday now when I said to
B	everyone's dropped out apart from him
A	everyone's dropped out which is why he said
B	I am the only one
A	okay I'll transfer the money over to
C	right
A	but what I'm thinking is it's within our it's
C	okay
[ANNOTATION]	Person C agrees that Person A is gonna transfer the money	Neutral
A	forty pounds a month
C	yeah he is
A	he's got it mentally
B	he's only the best there
A	he wants to win
B	cos he's the fittest
A	he's fittest he's got it mentally
C	but they all say
A	but
A	he's
C	find a way to win
A	and he's the one that they all want to beat
C	so that must be that must be tactical
A	he's the one they want to beat
C	yeah
A	they've all said that haven't they?
C	he's
A	and they're two years
C	he's a lot
A	younger than him
B	yeah well that's his he's picked a different sport he can't expect to go anywhere with tennis if he's gonna pick football over it so why
A	no
B	put in er
A	no I no I agree I agree
B	money after money? he's picked football invest in his football
A	thing is though he's
C	he can't become a
A	not gonna be he's not gonna be a professional footballer
C	he's not gonna be a professional tennis player though
A	no he's not you're right
B	and he can play football up until he's thirty
C	well can you? I don't think tennis is a better
B	you can do I think
C	I think tennis is a better social sport
B	yeah definitely
A	tennis is a great sport when you're older to
B	but he's always gonna pick football
C	but he's not he's not gonna play football until the age of I suppose he can always come back to tennis whenever
A	he'll come back to tennis and pick it up like you have
B	he can play football
A	he'll he'll play
B	until the end of sixth form for a team and yeah then he'll move move somewhere then he can't play football
A	the thing with tennis is you need
C	yeah you do
A	whereas tennis you can just turn up
B	well talking to
A	to a club join play
B	Mr
A	which is what you did
B	Mr
A	yeah
B	covered our AS level and me and
A	still?
B	semi-pro
A	and how old?
C	but you were talking about
A	semi-pro? how old
B	yeah
A	is he?
B	he seems I dunno twenties thirties
A	Mr who?
A	do we know him?
C	I thought he was the rugby player
A	have we met him?
B	that's
A	have we met him?
B	no
A	do we know him?
B	no
A	no oh okay
B	he's erm
C	do you have
B	no he was back he he'd left well he didn't get the job
C	what job?
B	he he was a PE like what's the word? so you've got like a DT oh I can't remember
C	NQT
A	head of department? no?
B	no he was like a er just
A	assistant?
B	I can't remember though anyway he went for a PE job and didn't get it because they got rid of his job
A	right
B	and then er he came back today cos
A	oh okay
B	but he yeah
B	football wise
A	oh okay
B	cos he gets paid to play football
A	oh he gets paid?
B	yeah not a lot
A	who does he play for?
B	it er a
A	oh okay
B	he says his level is one division higher than
C	oh really?
A	mm
C	but will
B	I don't see why not if he plays
A	I I mm
B	he's in reserves
A	oh who knows?
B	do you really think that?
A	well when he finally realises he's not gonna be CDG
C	I think he does realise
B	no he doesn't he wants to go to
A	he doesn't
B	oh does he?
A	yeah he wants to go to
B	he wants to go to
A	and
B	at at the end of this GCSEs
A	and do his A levels there or his Btec there and er and play football that's what he wants he wants to try out for that
A	he wants to go for the trials
B	what you think he'll pick hockey over football?
C	I think he's a better hockey player than he is a footballer
B	yeah he is but he's not gonna pick it
A	no he
B	he's got a lot more friends in football
A	he wouldn't pick it through choice that's the thing with
B	he can yeah he can play for
A	his he does it through friends
A	but does it
C	yeah but I think he would train
B	yeah
C	as he gets older he and he he's able to travel
A	no he'd train the thing with
B	yeah
A	and he doesn't wanna do it and I said why not? you're really good at athletics and he said well none of my friends are doing it this year so what you just run for like two and a half minutes or five minutes depending on what you're doing and the rest of the time you're just sitting there with people you don't wanna talk to
C	well he should do it he should do it
A	of course he should do it he's good I said the school needs you to represent them because you win for the school
C	yeah yeah
A	but he's like mm my friends aren't doing it this year
C	so is he gonna do it?
A	I dunno we need to talk to him he's been a bit vague he hasn't shown me any letters
C	just can I just stop you for one thing?
A	I didn't cos I was no good at anything nothing nothing at all nothing sporting wise but
C	I mean I would have represented my school for anything because very much like
A	well it was I wouldn't I'd have been like oh my goodness
B	he's out of the lessons enough
A	oh he's out of lessons loads
B	I saw him walking out the
A	loads he's out of lessons
B	I saw him outside of lesson time the other day I said I remember when we got home what were you doing out of lessons? just coming back from a school meeting
A	yeah he's on the council he does all the sports
B	he misses like
A	it's shedloads
C	but that's good though that's not bad for him to go on the council no the
B	he won't they don't do mum they don't do that once you get to GCSE set
A	no
B	dunno why you're worrying
A	it's alright I'm not worried I'm not worried in year nine
B	you told him one time he couldn't do a sporting event hockey because it was missing a day of school and you thought he'd already missed too much
C	but in
A	he misses a load in in
B	but he's in year nine
A	cos he does everything for that school
B	the year doesn't matter
A	he does every sport going
B	but he
C	well he does
A	he does it's
C	he wants some
A	bound to eventually because he does every sport going he's good at every sport and they pick him for every sport and he misses shedloads of days because oh I'm doing this I'm doing that for the school
C	well I think if
B	if
C	the the I suppose the difference between you can communicate quite well whereas he has still got that
A	oh he can't yet
C	he can't think clearly enough
A	well yeah he he is
C	he is he's a bit like he's a bit like a
A	he just takes his ball as long as he's got a ball in his hand or at his feet he's happy or the on the end of a stick on the end of a bat
C	do you think coaching's helped you with that?
B	what?
C	just being able to talk to people
B	dunno
C	but you quite enjoy coaching don't you?
B	it's alright
C	why wouldn't you like to do teaching?
B	no
A	because you'd be in a school
B	yeah kind
C	do you know what? as a teacher
A	fundamentally
C	it's completely different from being
B	yeah I know that
C	see they'd probably sit in the common room and absolutely howl with laughter
B	yeah they do the PE department love the banter
C	yeah they probably just laugh at students
B	yeah they do
C	they they probably
A	well cos they've all been there haven't they? they've all been students that have hated school probably
C	yeah
B	well er he says he'd rather join the police
A	the police?
B	yeah he came up with that over
B	he came up with that the other day he said because once you get in there
C	they have to tell the truth
B	he goes once you get in there you can climb and climb the ranks and get higher and higher with the jobs
C	yeah you can
A	is that what he wants to do?
B	I'm not sure if he'll do it
C	would you wanna do that?
B	not the police no
A	I can't imagine
C	he is slightly dodgy he'd need to
B	he's quite bright
C	don't have to be bright necessarily to be in the police you have to be able to communicate
B	yeah he's confident
A	yeah he is confident he is
[ANNOTATION]	He's not very confident with himself	Contradiction
B	very confident
A	yeah he is
B	the other day we were on the way home
B	at giving the cheeky comment
A	yeah he he he blew it he did
B	no he caught on straightaway and then he
A	no he had blown it because you had said it's one pound thirty
B	oh yeah and he said
A	and he said oh here's the such and such the number bus I said well that's alright then cos you don't get that whatever what he said the seven the number seven I said well you get the eight ten and he
A	and dropped he dropped you in it because I would have
B	yeah
A	believed you
B	well he thought
A	you said
B	he thought I was just wrong didn't he? and then
[ANNOTATION]	Speaker B was on the way home from university	Neutral
A	you said they've gone up to one thirty
B	and then and then he tried to catch on
A	and I would have believed you and it was
B	and then he catched on
A	it's not yours then caught on caught
B	caught
A	but yeah I mean he is he can chat and he's personable and I quite like him
[ANNOTATION]	He tried to catch on the joke	Neutral
B	he's so funny
C	he's alright
C	but
B	especially if it if if he ever argues with the teachers
C	have you chatted to
C	recently?
A	no I haven't chatted to
C	he's just he is he is like a a footballer that hasn't been to school
A	is he?
C	and and
B	he lives in
[ANNOTATION]	He plays football and hasn't been to school	Entailment
C	in
A	no he didn't get a GCSE not one
C	no but in fairness to
A	but is he's he's still not putting in the effort in is he?
[ANNOTATION]	He doesn't put effort in being sociable	Neutral
B	er I I dunno it's hard to tell with him isn't it?
A	oh I dunno his sister's not doing much better
B	his sister's a lot worse than him
A	his sister's been at a special school
B	she's
[ANNOTATION]	His sister goes to a special school because she's in a wheelchair	Neutral
A	and she's been expelled not expelled what's the word?
B	they tried to put her on a
C	excluded
B	managed
A	a
B	but it didn't work out at the other school
A	to another school
A	then she's come back she's just cheeky
B	she's actually like naughty whereas
A	mm
B	do anything stupid whereas his sister will like argue with teachers and stuff whereas
C	so what? so
B	he loves his football he's playing
A	who's he playing
B	he's joined the Monday team
A	oh a Monday team
B	yeah there's two divisions on the Monday team
C	is he any good though?
C	that's not very nice
B	well well no as in like they always thought
C	oh there was another lad in the the paper actually
B	and then moderation came in
A	oh yeah
C	there was a
A	yeah go on I'm listening
C	the the lad who's joined
B	moderation came in
A	oh did he?
B	yeah he's
A	and he did he not get his PE GCSE?
B	er well no but he I told you about the grade boundaries
A	yeah but
B	if if the grade boundaries
A	you said in
B	hadn't have changed he would have got his GCSE
A	so what did he get?
B	he got a D
A	a D? oh
B	but if the
A	oh
B	in science but in year ten
A	oh okay
B	he did he
A	so he sat them all in year eleven and got not one?
B	yeah
A	god that's soul destroying
C	well it's not soul destroying he he's made that choice
B	he was he did regret it but
A	unplug that
B	he's in love with football at the moment it's all he plays day in day out he will still go on walks like
C	so do you guys know er?
C	is that his name?
A	no the one that played for this this one
D	yeah that would be
A	have you plugged it in
C	yeah his erm
A	thank you
C	I I
B	played for
C	no
A	no
D	oh no he didn't
B	I I didn't know him
A	yes
D	yeah I know him
A	he's er
D	yeah he's good
B	he's he's not at
C	is he a good player?
D	he yeah he's
B	he's
C	is he a striker and winger isn't he?
D	yeah
A	oh he's well when er
B	why who's he played for?
C	is he?
B	he's naughty
D	yeah he is naughty
C	is he a lad or not?
D	he's no cocky
A	naughty in what way?
B	no he's er it's like
B	and he's like
D	and he's like one of the main people in year ten
B	yeah yeah
D	let's see
A	is that his picture?
D	let's see
B	yeah I there's videos of him playing football oh excuse me the language in this but this is class wait a minute like you ready? so he's the guy that shoots
A	who does he?
B	he's just messing around in goal yeah? he
A	who does he play for?
B	kicks it out this is him picked it off first time
C	oh right okay so erm
D	yeah I dunno how many
B	who did he play for?
C	I know he told me he told me the time he got
A	oh
B	what time did you get?
D	thirteen point five
B	who did er
C	he's at
A	what can you do a hundred metres then
C	but he was at
B	I dunno but I can beat
C	twelve point nine
A	what you can beat
B	yeah
A	oh can you?
C	he's meant to be very very quick
A	who?
A	no I meant can
D	yeah
A	a hundred metres?
B	yeah
A	so what does where where does he start to beat you? what distance?
D	four hundred
A	four hundred?
B	easy
A	so a hundred two hundred
D	I dunno about two hundred
B	yeah cos it's a sprint
D	so it's four hundred
A	well I'm keen to know
C	four hundred is a sprint
B	yeah but it's a sprint on a whole track I'm not sure I can run that far
A	so where do you where's your best time fifteen hundred still?
B	I'd beat him at that
A	or eight hundred?
C	well eight hundred is
A	well no
B	yeah well I dunno
C	well I well I think he's better at eight hundred cos he's er he's got that sort of attitude that he can just keep going and run his legs off
B	it makes you feel sick
D	oh yeah it does
A	how many is that? two laps of the
B	yeah
C	two laps of the track it's a really hard distance
A	eight hundred?
B	yes
C	yeah I couldn't do eight hundred
D	and a sprint
B	well have you got toothpaste all down my jumper?
D	yeah yeah
B	if that doesn't come out you owe me eight pound
D	oh
A	eight pounds?
B	how much did that jumper cost me?
A	what from er
B	Primark
A	Matalan?
B	Primark
A	Primark
D	do you wanna see my toenails?
A	pardon?
B	no
C	no
A	your toenails? oh
C	have they gone manky again?
A	oh god
D	alright this one it fell off I didn't tell you about it it fell off
A	which one fell off?
D	I dunno it's someone stepped on it and this is what happened
C	yeah but
A	let's see
D	yeah
A	oh not even your big toe?
D	no no
A	oh
B	there must be some sort of cream you can get for his toes
C	I think he's got a fungus in it he probably needs to go and see the doctor again
A	let's see bring me your
D	oh you wanna see my blisters on the other foot
A	blisters from what?
D	er tennis
A	tennis? well
B	it's what happens when
D	no you wanna see this one first
A	well what's given you blisters?
C	oh
A	do you
B	don't put it on
A	oh my god
D	yeah
A	that's vile
A	right so where's the the big toe that was falling off?
D	it fell off
C	falling off
A	which foot?
D	that foot
A	that foot?
D	oh I mean the the
A	pass it here pass it here
D	they both fell off I think
A	oh god
D	what did he say?
B	what time's your first match tomorrow?
A	so that one
D	yeah
A	is
C	is he coming over to see it?
B	I'm not sure
A	is that the new so the one
D	yeah
A	on top of that fell off so that's a new nail?
D	yeah
A	well that's quite nice so what's happening with this one?
D	someone stepped on it
A	who?
D	yeah
A	who stepped on it?
D	I dunno playing football
A	well it's gonna
D	mm
C	in on his
D	yeah
A	which nail?
D	oh this one this one goes up and down and it's it's
C	have you tried to cut it?
D	yeah
A	oh it's vile to look at
A	I'm not being funny
D	dad do you wanna see a technical change me and
A	is that your blister?
C	no he's talking
A	but
B	cos you got cheap tennis shoes
D	yeah
A	they weren't cheap tennis shoes
D	they are cheap mum
B	do you wanna see the technical change me and
A	no
C	who's that?
A	I want to discuss
B	he's the guy that
C	yeah
B	so straight round we then made the technical change
C	yeah yeah
B	technical change
A	who? can I see?
B	yeah cos
B	it's not
C	who?
D	who is it?
B	dunno I've never met him before
B	do you wanna see what
A	yeah
B	that's er that's a normal serve
C	I can't see give it to me
B	and this I have to point out the serve bit right so you see this bit here? see where my racquet goes there? it goes out for like a bit of pronation and then just sweeps back round
C	yeah
B	yeah? from my topspin
C	yeah
B	goes completely out the opposite way and look at that
C	that's big pronation
A	who who recorded you?
A	when? oh
C	oh yeah
B	cos that is you wanna go from
A	what?
C	from seven to one
B	yeah it's really difficult
A	you're not going seven to one with that seven?
C	seven
A	oh okay with that
C	seven
A	oh okay okay okay
A	got
A	where?
A	where?
A	that one?
C	yeah
A	mm
C	yeah
A	who's that from?
C	it's his
A	when?
B	the other day with the tennis ball emoji and the strong arm emoji
A	so what's he texted you just now?
B	he said hi
C	so
B	what time is your first match tomorrow question mark I've put twelve forty
A	oh has he replied?
B	no
A	twelve forty so we're
B	yeah yes
A	midday yeah?
C	so
B	yeah
A	we're thinking about
D	that's nice
A	private lessons
D	yeah
A	because you're hanging on by a
C	I wouldn't necessarily put it like that personally
D	no neither would I
A	you put it put it your way go on
D	well you don't need to
A	two third set tie breaks to win you're hanging on by a thread
D	yeah thanks mum thanks for that really encouraging me
C	that's really motivational that was wasn't it?
A	he knows that
D	you know you know I lost I was losing to him today?
A	who?
A	when?
D	when I played him today
A	the squad?
D	yeah playing playing played
A	yeah but when it matters
C	what was the score today?
D	three two er it was on the serve I was serving it was
A	when it matters
B	can I have one of these cookies?
C	I think with a bit of technical help
A	mm
C	you've got all the physical ability to do it
unknown_female	mm
C	you just need a bit more technical help that's all
D	yeah
A	which is why we're gonna
C	cos I think if erm if they gave you a bit more work on your serve your serve'll be
D	yeah
C	a real weapon
D	yeah I need
C	yeah you do yeah you do and then cos
D	yeah I think er all I need to do cos we do you know how we're doing one person could attack one person could defend and then if it were me against
C	well not with
D	I was winning more points though being defensive
C	well
D	just make sure he doesn't come inside the
C	oh okay okay
B	now do you wanna listen to?
C	the other thing
A	so
C	you didn't do you didn't put a single lob up against him when you played in the match not a single lob you er you tried to pass him and he he and he anticipated every passing shot and made the volley but he's short he's got no legs
C	he's quite quick so he can get back
unknown_female	mm
A	you can't say that
C	but if you if you hit it
D	yeah
C	that you wanna attack and put away and often it hits the top of the net doesn't it?
D	yeah
C	where it goes flying out
unknown_female	mm
B	last time I called him like
A	is that what he said?
C	fine
C	that's a
B	sorry forgot
B	mm
C	bro
A	say me and my bro are going all the way in the future
D	oh
A	but
C	well well I'm well I'm not here so
D	put Monday night
C	well what about
A	actually yeah because erm yeah
A	ask him what he can do on a Monday night
D	yeah mm
A	are you texting him now?
D	yeah
A	while he's talking to your brother?
B	no he's
A	why? what have you said?
B	sorry forgot
A	no
C	competitiveness?
A	something like that
D	did you
A	so that was his that was his phrase
B	no
A	oh wow well done
C	yeah
A	well I think I'd rather have the balance because you're right he's not gonna be a
A	so you want the balance don't you? you want it to be
C	well
A	no we want
B	I can't
A	why not?
B	dunno
unknown_female	yeah
A	talking to
C	oh so where's
B	no I told him I can't come out this month
A	this month?
A	how was he with that?
B	I dunno
D	what? who?
B	yeah that's their nickname cos it's the
A	and that's what they're called?
B	well they're called the
A	you could play for them with your
B	yeah
A	mm
B	they're a pretty good team apparently they're all apparently they do you know the first team
C	oh why?
B	yeah
A	who?
A	why?
B	I'm not sure anyway oh break us off a little bit mum thanks erm apparently the
D	thank you
A	oh
B	with the club
A	so
B	but they they made the
A	so you know the new
B	mm
A	where will their
B	which
A	home pitch be?
B	that's the trial they'll wanna try and get some of the home pitches to play at
A	oh okay
B	and they will want to try and so yeah they'll want to get to the stage where they can arrange to play matches against like the
A	mm
C	mm
A	but
A	what's that?
B	cost you a lot of money but it's the best
A	who's
B	it's like it's an academy where you play football matches and just because it's er it's just a big academy and you can go and do school there and everything that's where
A	how much is it then?
B	I dunno
C	erm
A	mm
B	I need to go and
A	about what?
