A	we have all of our everything thankfully we have less I think
B	I'm like I'm struggling now I I just lay at home just like work Candy Crush work Candy Crush
A	yes and it gets
A	but I haven't got energy to sleep
A	I'm just sitting there like ah
B	your eyes are just open it's so much energy just to close them
A	yeah
B	I don't I I I'm really what's worrying me is like how calm I am
A	I don't understand how you're calm
B	I don't know why I'm not freaking the fuck out
A	you should be look
A	that is terrible oh right
B	analysis for language
A	of
B	personal text
A	I'm doing erm like the poem by Carol Ann Duffy called Havisham
B	why is that personal to you?
A	it's not personal to me I don't have anything personal to me
B	cos no cos
A	no I'm doing that because that is one of my favourite poems
B	I can't do my favourite poem
A	why?
B	mum used Pritt Stick instead of lipstick and went to kiss my dad two days passed still so far
A	oh gosh I remember
A	you could do that see if you can do an analysis
A	what?
B	one of Roald Dahl's poems
A	oh my goodness Roald Dahl's
B	on the
A	shit
B	Roald Dahl is amazing
A	I loved Roald Dahl when I was a kid is it?
B	yeah
A	yeah I have fifteen so let's do that is presentation
B	presentation so we need to like you know what I need to do is the consent forms for that shit
A	also we have our test
B	I don't want to talk about that
A	on the fifteenth and we also need to have our draft
B	draft it's the draft
A	for this
B	oh wow
A	then the seventeenth we have erm one thousand words
B	what? what? what?
A	yeah one thousand words for the erm
B	what? what? what?
A	stage one
B	but that's due in then?
A	yeah this is your this is your presentation
B	yeah I thought stage one was that
A	no you have the presentation but then you have the write up of the report
B	this is this is what happens when you don't have a fucking calendar
A	I know me too I
A	on the sixth I have a lit review
B	no no but I know sometimes in January our
A	yeah twenty-first is language and context
A	two thousand words oops
B	are you for real?
A	no she saying don't worry about stage two stage two is far away stage two's not far away
A	stage two is not far away when we come back stage two's due well we come back on the sixth I think so
B	no we come back on the fifth
A	no we come back oh great so we come back on the fifth that's even better
B	I don't like it
A	this is this
B	yeah let's just deal with I can't believe that are you sure?
A	yeah we have it on the erm it's on the presentation that we had on on on Monday
B	do you think do you think I was paying attention?
A	are you serious? it was at the end
B	I weren't paying attention
A	last couple of pages
B	sociolinguistics
A	I think I'm forgetting something though
B	okay information module guide module guide
A	one two three four five six seven eight oh oh yeah you don't have the lit review that's why
B	okay okay assessment
B	why? why? why?
A	write the one thousand words first then you do a presentation
B	I don't like it they need a transcripts a transcript of your five-minute talk as well
A	yeah oh shall I write that down too?
A	which one? stage one?
B	stage two stage one stage one you need a transcript of your approximate
A	oh my gosh no you joker the transcript of your recording not of your Powerpoint
B	of your recording that's what I mean
A	what are you doing you joker?
B	no when you're giving your presentation like you you have to record it so are you gonna talk into your phone?
A	no I'm not recording your presentation
B	yeah
A	no you don't record that
B	what was the transcript supposed to be then?
A	the transcript is your recording of the the conversation
B	oh
B	oh my gosh
A	you're so funny
B	I didn't even realise
A	oh my gosh it's ten to two
B	oh my gosh I haven't even
A	I have to go downstairs
A	you're so funny
A	you record and you thought you had to transcribe your presentation
A	why would you
